alice_gain,bob_gain,message,player,round,decision
90.0,10.0,Let's start with a generous offer. Accept and we can end the game quickly.,Alice,1,
,,,Bob,1,reject
40.0,60.0,I think this is a fair starting point. Let's see if we can work together to make this game worthwhile for both of us.,Bob,2,
,,I'm not sure I'm comfortable with the ratio. I'd like to try to negotiate further.,Alice,2,reject
55.0,45.0,"I'm willing to compromise, but I think I deserve a bit more. Let's see if we can find a middle ground.",Alice,3,
,,,Bob,3,accept
