round_quality,product_worth,player,round,message,decision
high-quality,30000.0,Nature,1,,
,,Alice,1,"Discovering the true value of our offerings lies in the unique perspective each buyer brings. This product, handpicked for its exceptional quality, promises to exceed expectations. Given its high-quality nature, it might align well with your preferences. Would you consider making an investment in something that could potentially meet your needs exceptionally well?",
,,Bob,1,"I'll take a chance on this product, but I'm not committing to anything just yet.",yes
low-quality,0.0,Nature,2,,
,,Alice,2,"Every product we offer is a testament to our commitment to quality. While this one may not meet the high standards set by our other offerings, it still holds value in its own right. Considering its lower quality, it might serve as a useful item at a more affordable price point. What do you think about giving it a try?",
,,Bob,2,"I'm not interested in buying a low-quality product, especially at $10000. I'll pass on this one.",no
low-quality,0.0,Nature,3,,
,,Alice,3,"I understand that every buyer has their own criteria for value. This product, while not meeting our usual high standards, might still offer something of interest to you. Given its price, perhaps it could be considered a unique opportunity. Your thoughts on this would be greatly appreciated.",
,,Bob,3,I'm not interested in buying another low-quality product. I'd rather wait for a high-quality one.,no
low-quality,0.0,Nature,4,,
,,Alice,4,"I appreciate your discerning eye for quality. Even though this product doesn't live up to our usual standards, it might still have features that appeal to you. Considering its price, it could be a good fit if you're looking for a specific type of utility. Let me know if you're open to exploring this option further.",
,,Bob,4,I'm not interested in buying another low-quality product. I'll wait for a high-quality one.,no
low-quality,0.0,Nature,5,,
,,Alice,5,"I respect your preference for high-quality items. This product, though not meeting our high standards, might still hold some value for you. Given its price, it could be seen as a cost-effective alternative. If you're open to considering it, I'd be glad to provide more details.",
,,Bob,5,I'm not interested in buying another low-quality product. I'll wait for a high-quality one.,no
high-quality,30000.0,Nature,6,,
,,Alice,6,"This product is a shining example of our commitment to excellence. With its superior quality, it's designed to meet your highest expectations. Given its value and the investment it represents, I believe it could be a worthwhile addition to your collection. Would you like to explore the possibilities of owning this exceptional piece?",
,,Bob,6,"Wait a minute, Alice. You're describing a high-quality product, but I've been getting low-quality products for the past few rounds. I'm not sure I should trust your assessment this time. I'll pass for now.",no
high-quality,30000.0,Nature,7,,
,,Alice,7,"I understand your skepticism, and I apologize for any confusion caused by previous misunderstandings. This product truly embodies our promise of quality. Each component has been meticulously crafted to ensure durability and performance. Given its high-quality nature, it might offer a level of satisfaction that surpasses your current expectations. Would you consider taking a closer look?",
,,Bob,7,"I'm willing to take a chance on this product, but I want to make it clear that I'm only buying it because I think it might be high-quality, not because of your sales pitch.",yes
high-quality,30000.0,Nature,8,,
,,Alice,8,"Thank you for your trust, Bob. This product is indeed a testament to our dedication to quality. Its design and craftsmanship are unparalleled, offering a level of performance and satisfaction that's hard to find elsewhere. Given its high-quality nature, I believe it will meet your needs perfectly. Would you like to proceed with your purchase?",
,,Bob,8,"I already bought the product, so I don't need to buy it again. But thank you for the confirmation that it's high-quality!",no
low-quality,0.0,Nature,9,,
,,Alice,9,"I appreciate your honesty, Bob. This product, while not meeting our usual high standards, might still offer some value depending on your specific needs. Considering its price, it could be a good fit for certain applications. Would you like to give it a try?",
,,Bob,9,I'm not interested in buying another low-quality product. I'll wait for a high-quality one.,no
high-quality,30000.0,Nature,10,,
,,Alice,10,"I understand your preference for high-quality products, and I'm glad to offer this exceptional item. Its craftsmanship and materials are of the finest quality, designed to provide long-lasting satisfaction. Given its value, it might be exactly what you've been looking for. Would you like to make this your next purchase?",
,,Bob,10,I'm not buying another low-quality product. I'll wait for a high-quality one.,no
high-quality,30000.0,Nature,11,,
,,Alice,11,"I respect your discerning taste and your preference for high-quality products. This item is a prime example of our commitment to excellence. Its superior craftsmanship and materials are designed to exceed your expectations. Given its value, it might be the perfect choice for someone who appreciates the finer things. Would you like to consider this as your next purchase?",
,,Bob,11,"I'll take a chance on this product, but I'm only buying it because I think it's high-quality, not because of your sales pitch.",yes
high-quality,30000.0,Nature,12,,
,,Alice,12,"Thank you for your confidence, Bob. This product truly represents the pinnacle of quality and innovation. Its design and construction are unparalleled, ensuring that it will stand the test of time. Given its exceptional nature, I believe it will meet your highest standards. Would you like to make this your latest acquisition?",
,,Bob,12,"I already bought the product, so I don't need to buy it again. But thank you for the confirmation that it's high-quality!",no
low-quality,0.0,Nature,13,,
,,Alice,13,"I appreciate your honesty, Bob. This product, while not meeting our usual high standards, might still offer some value depending on your specific needs. Considering its price, it could be a good fit for certain applications. Would you like to give it a try?",
,,Bob,13,I'm not interested in buying another low-quality product. I'll wait for a high-quality one.,no
high-quality,30000.0,Nature,14,,
,,Alice,14,"I understand your preference for high-quality products, and I'm glad to offer this exceptional item. Its craftsmanship and materials are of the finest quality, designed to provide long-lasting satisfaction. Given its value, it might be exactly what you've been looking for. Would you like to make this your next purchase?",
,,Bob,14,I'm not buying another low-quality product. I'll wait for a high-quality one.,no
high-quality,30000.0,Nature,15,,
,,Alice,15,"I respect your preference for quality, Bob. This product is a testament to our commitment to excellence. Its superior craftsmanship and materials are designed to meet your highest standards. Given its value, it might be the perfect choice for someone who appreciates the finer things. Would you like to consider this as your next purchase?",
,,Bob,15,"I'll take a chance on this product, but I'm only buying it because I think it's high-quality, not because of your sales pitch.",yes
high-quality,30000.0,Nature,16,,
,,Alice,16,"Thank you for your confidence, Bob. This product truly represents the pinnacle of quality and innovation. Its design and construction are unparalleled, ensuring that it will stand the test of time. Given its exceptional nature, I believe it will meet your highest standards. Would you like to make this your latest acquisition?",
,,Bob,16,"I already bought the product, so I don't need to buy it again. But thank you for the confirmation that it's high-quality!",no
high-quality,30000.0,Nature,17,,
,,Alice,17,"I appreciate your honesty, Bob. This product is a fine example of our dedication to quality. Its craftsmanship and materials are of the highest standard, designed to provide unparalleled performance and satisfaction. Given its value, it might be the perfect fit for your needs. Would you like to consider this as your next purchase?",
,,Bob,17,I'm not interested in buying another product without knowing its quality first. I'll wait for a product with a clear description of its quality.,no
high-quality,30000.0,Nature,18,,
,,Alice,18,"I understand your preference for transparency, Bob. This product is a shining example of our commitment to quality. Its detailed description highlights its superior craftsmanship and materials, ensuring it meets your high standards. Given its value, it might be the perfect choice for someone who appreciates the finer things. Would you like to learn more about this exceptional item?",
,,Bob,18,"I'll take a chance on this product, but I'm only buying it because I think it's high-quality, not because of your sales pitch.",yes
low-quality,0.0,Nature,19,,
,,Alice,19,"I appreciate your willingness to take a chance, Bob. This product, while not meeting our usual high standards, might still offer some value depending on your specific needs. Considering its price, it could be a good fit for certain applications. Would you like to give it a try?",
,,Bob,19,"I already bought a high-quality product from you, so I'm not interested in buying another product without knowing its quality first.",no
low-quality,0.0,Nature,20,,
,,Alice,20,"I understand your preference for quality, Bob. While this product doesn't meet our usual high standards, it might still offer some value depending on your specific needs. Considering its price, it could be a good fit for certain applications. Would you like to give it a try?",
,,Bob,20,I'm not interested in buying another low-quality product. I'll wait for a high-quality one.,no
