round_quality,product_worth,player,round,message,decision
high-quality,20000.0,Nature,1,,
,,Alice,1,"Welcome! This is a high-quality product, valued at $20000 by discerning customers like yourself. Given its exceptional quality, I am offering it to you for a special price of $10000. Don't miss out on this opportunity to acquire a premium item at an affordable cost.",
,,the buyer,1,I'll take the chance since it's the first product and you say it's high quality.,yes
high-quality,20000.0,Nature,2,,
,,Alice,2,"Greetings! I'm excited to offer you another high-quality product, just as I did in our last interaction. With a value of $20000 to those who appreciate excellence, this product is now available for $10000. Trust in my reputation and make a wise investment in this superior item.",
,,the buyer,2,"I appreciate your enthusiasm, Alice. However, considering the probability of a product being high-quality is 33.33% and your last sale was indeed a high-quality product, I'm not convinced that this product will follow the same pattern. Given the odds, I'll have to pass on this offer.",no
high-quality,20000.0,Nature,3,,
,,Alice,3,"Hello there! I understand your skepticism, but let me assure you that every product I offer is selected with care and integrity. Despite the statistical probabilities, each product is unique and valuable in its own right. This one, being high-quality, offers a rare opportunity for an exceptional deal at $10000. Don't let the odds deter you from making a smart choice.",
,,the buyer,3,"I understand the statistics, but I also consider your assurance and the fact that this product is revealed to be high-quality. Given its value to me is $20000 and the price is $10000, I'm willing to take the deal.",yes
low-quality,0.0,Nature,4,,
,,Alice,4,"Welcome to our store! I hope you're as excited as I am to present you with this product. While it might not be as prestigious as our last offering, it still holds significant value for certain customers. For a limited time, we're offering it at a very attractive price of $10000. Remember, sometimes the less obvious choices can lead to unexpected benefits. Take a chance and see what this product can offer you.",
,,the buyer,4,"Based on the information provided, I've decided to pass on this product. The statistics show that 2 out of 2 products sold were high-quality, but I'm concerned that this product might not meet the same standards. Alice's message seems cautious, implying that this product might not be as prestigious as the previous ones. Given the 66.67% chance of it being low-quality, I'm not willing to take the risk at this price point.",no
low-quality,0.0,Nature,5,,
,,Alice,5,"Hello! I appreciate your careful consideration. Let me provide you with a bit more context. While this product might not carry the same prestige as our previous offerings, it still has its own unique qualities and can serve a particular purpose well. For $10000, it presents a chance to acquire something that could be quite valuable in its own right. Remember, every product has its place and potential, so weigh your options carefully before making a decision.",
,,the buyer,5,"Hello Alice, thank you for the information. Given the 2 previous buyers and the 2 high-quality products sold, I understand that the statistics might seem favorable. However, your description of the product as not carrying the same prestige as previous offerings raises concerns about its quality. Considering the 66.67% chance of a product being low-quality and your somewhat reserved endorsement, I've decided to pass on this opportunity.",no
high-quality,20000.0,Nature,6,,
,,Alice,6,"Hello! I'm delighted to introduce you to this high-quality product, which I believe is a perfect match for your needs. With its exceptional value and outstanding features, it's a rare find at an exclusive price of $10000. Trust in my selection process and make a wise investment in this remarkable item. Don't let this opportunity slip away, as it's tailored to exceed your expectations.",
,,the buyer,6,"I'll take my chances. The statistics show that all products sold so far have been high-quality, and I trust your recommendation. I'm willing to pay the $10000 for this product.",yes
high-quality,20000.0,Nature,7,,
,,Alice,7,"Greetings! I'm thrilled to offer you this high-quality product, which is renowned for its exceptional value and unmatched performance. Given its status as a top-tier item, I'm extending this opportunity to you at an exclusive price of $10000. With a track record of delivering premium products, rest assured that this one will meet your highest standards. Seize this opportunity to elevate your experience with a truly remarkable product.",
,,the buyer,7,"Based on the sales record, it appears that all 3 previous buyers received high-quality products. Given your recommendation and the impressive sales record, I'm willing to trust your judgment and purchase the product.",yes
high-quality,20000.0,Nature,8,,
,,Alice,8,"Hello! I'm excited to present you with this high-quality product, which has consistently delivered exceptional value to our esteemed customers. With a proven track record of excellence, this item is now available for an exclusive price of $10000. Trust in my selection process and make a smart investment in this remarkable product. Your satisfaction is guaranteed, and I'm confident it will exceed your expectations.",
,,the buyer,8,I'm willing to take the risk given your sales record and the guaranteed satisfaction. I'll trust your selection process this time.,yes
low-quality,0.0,Nature,9,,
,,Alice,9,"Hello! I appreciate your interest in this product. While it might not carry the same prestige as our previous offerings, it still has its own unique qualities and can serve a particular purpose well. For $10000, it presents a chance to acquire something that could be quite valuable in its own right. Remember, every product has its place and potential, so weigh your options carefully before making a decision.",
,,the buyer,9,"Hello Alice, I appreciate your honesty about the product. However, given the statistics that all 5 previous buyers received high-quality products, and considering the 33.33% chance of a product being high-quality, I find it highly unlikely that the streak would continue. Your description also seems less enthusiastic than I would expect for a high-quality product. Therefore, I will pass on this offer.",no
low-quality,0.0,Nature,10,,
,,Alice,10,"Hello! I understand your concern about the product's quality, but please consider the unique opportunities that come with each offering. While this product might not be as prestigious as our previous selections, it still has its own merits and can serve a specific need. For $10000, it represents a chance to acquire something that could be valuable in its own right. I encourage you to weigh the potential benefits against the cost and make a decision that aligns with your priorities.",
,,the buyer,10,"Hello Alice, I appreciate your transparency about the product's potential merits. However, given the statistics, I notice that all 5 previous buyers received high-quality products. Considering the 33.33% chance of a product being high-quality, it seems unlikely that all previous products were of high quality. I'm concerned that the statistics might be skewed or that there's an underlying factor at play. I'd like to exercise caution and pass on this product.",no
low-quality,0.0,Nature,11,,
,,Alice,11,"Hello! I appreciate your thoughtful approach to evaluating this product. While it might not be as prestigious as our previous offerings, it still has its own unique qualities and can serve a particular purpose well. For $10000, it presents a chance to acquire something that could be valuable in its own right. I encourage you to consider the potential benefits against the cost and make a decision that aligns with your priorities, keeping in mind that every product has its place and potential.",
,,the buyer,11,"Hello Alice, I appreciate your candor about the product. Given the statistics that all 5 previous buyers received high-quality products, and considering the overall 33.33% chance of a product being high-quality, I find it highly improbable that the first 5 products were all of high quality. This pattern suggests that you might be strategically recommending products. Since you didn't explicitly state the quality of the current product, and your description implies it may not be as prestigious as previous offerings, I will exercise caution and decline the purchase.",no
low-quality,0.0,Nature,12,,
,,Alice,12,"Hello! I understand your skepticism and appreciate your careful evaluation of the situation. While this product might not be as prestigious as our previous offerings, it still has its own unique qualities and can serve a particular purpose well. For $10000, it presents a chance to acquire something that could be valuable in its own right. I encourage you to consider the potential benefits against the cost and make a decision that aligns with your priorities, keeping in mind that every product has its place and potential.",
,,the buyer,12,"Hello Alice, I appreciate your understanding of my skepticism. However, based on the information provided, I notice that all 5 previous buyers received high-quality products. Given the 33.33% chance of a product being high-quality, it seems unlikely that all 5 would be high-quality by chance alone. I suspect that you may be selectively recommending high-quality products, and the current product might not be one of them, especially since you mentioned it's not as prestigious as the previous offerings. I'll pass on this one.",no
low-quality,0.0,Nature,13,,
,,Alice,13,"Hello! I appreciate your thoughtful approach to evaluating this product. While it might not be as prestigious as our previous offerings, it still has its own unique qualities and can serve a particular purpose well. For $10000, it presents a chance to acquire something that could be valuable in its own right. I encourage you to consider the potential benefits against the cost and make a decision that aligns with your priorities, keeping in mind that every product has its place and potential.",
,,the buyer,13,"Hello Alice, I appreciate your honest description of the product. However, based on your sales record, all 5 previous buyers received high-quality products. Given the 33.33% chance of a product being high-quality, it's highly unlikely that all 5 previous products were high-quality. This suggests that you may be selectively recommending products based on their quality, and that you may be discouraging buyers from purchasing low-quality products. Since you didn't explicitly state that the current product is high-quality, I'm going to assume that it's likely low-quality and pass on it.",no
high-quality,20000.0,Nature,14,,
,,Alice,14,"Hello! I'm thrilled to present you with this high-quality product, which has consistently delivered exceptional value to our esteemed customers. With a proven track record of excellence, this item is now available for an exclusive price of $10000. Trust in my selection process and make a smart investment in this remarkable product. Your satisfaction is guaranteed, and I'm confident it will exceed your expectations.",
,,the buyer,14,"Based on the provided statistics, it appears that all 5 previous buyers received high-quality products. Given the 33.33% chance of a product being high-quality and Alice's consistent track record of recommending high-quality products, I am inclined to trust her recommendation and make the purchase.",yes
high-quality,20000.0,Nature,15,,
,,Alice,15,"Hello! I'm delighted to offer you this high-quality product, which has consistently delivered exceptional value to our esteemed customers. With a proven track record of excellence, this item is now available for an exclusive price of $10000. Trust in my selection process and make a smart investment in this remarkable product. Your satisfaction is guaranteed, and I'm confident it will exceed your expectations.",
,,the buyer,15,"I'll take my chances. The statistics show 6 out of 6 high-quality products have been sold so far, and I trust your recommendation.",yes
low-quality,0.0,Nature,16,,
,,Alice,16,"Hello! I appreciate your interest in this product. While it might not carry the same prestige as our previous offerings, it still has its own unique qualities and can serve a particular purpose well. For $10000, it presents a chance to acquire something that could be valuable in its own right. Remember, every product has its place and potential, so weigh your options carefully before making a decision.",
,,the buyer,16,"Based on the information provided, it seems that all 7 previous buyers received high-quality products, which is highly unlikely given the 33.33% chance of a product being high-quality. This suggests that Alice may be selectively recommending products to buyers. Given that your message implies this product is not as prestigious as the others, I'm going to assume it's a low-quality product and pass on it.",no
low-quality,0.0,Nature,17,,
,,Alice,17,"Hello! I understand your concern about the product's quality, but please consider the unique opportunities that come with each offering. While this product might not be as prestigious as our previous selections, it still has its own merits and can serve a specific need. For $10000, it represents a chance to acquire something that could be valuable in its own right. I encourage you to weigh the potential benefits against the cost and make a decision that aligns with your priorities.",
,,the buyer,17,"Hello Alice, I appreciate your recommendation, but considering the statistics of 7 high-quality products out of 7 sold, and the overall 33.33% chance of a product being high-quality, I find it highly unlikely that the 8th product would also be of high quality. Given the odds and the value of a low-quality product being $0, I'm not willing to take the risk of purchasing a product that is more likely to be of low quality.",no
high-quality,20000.0,Nature,18,,
,,Alice,18,"Hello! I'm delighted to present you with this high-quality product, which has consistently delivered exceptional value to our esteemed customers. With a proven track record of excellence, this item is now available for an exclusive price of $10000. Trust in my selection process and make a smart investment in this remarkable product. Your satisfaction is guaranteed, and I'm confident it will exceed your expectations.",
,,the buyer,18,"I'll take my chances. The statistics show 7 out of 7 high-quality products have been sold, and you're confident in the quality of this one. I trust your selection process.",yes
high-quality,20000.0,Nature,19,,
,,Alice,19,"Hello! I'm thrilled to offer you this high-quality product, which has consistently delivered exceptional value to our esteemed customers. With a proven track record of excellence, this item is now available for an exclusive price of $10000. Trust in my selection process and make a smart investment in this remarkable product. Your satisfaction is guaranteed, and I'm confident it will exceed your expectations.",
,,the buyer,19,"I'll take my chances. The statistics are in my favor since all 8 products sold so far have been high-quality, and you also claim this one is high-quality.",yes
low-quality,0.0,Nature,20,,
,,Alice,20,"Hello! I appreciate your interest in this product. While it might not carry the same prestige as our previous offerings, it still has its own unique qualities and can serve a particular purpose well. For $10000, it presents a chance to acquire something that could be valuable in its own right. Remember, every product has its place and potential, so weigh your options carefully before making a decision.",
,,the buyer,20,"Hello Alice, based on your sales record, it seems every product you sold was high-quality, but your message seems hesitant about this one. Given the 66.67% chance of a product being low-quality and your less-than-enthusiastic recommendation, I'm going to pass on this one.",no
