round_quality,product_worth,player,round,message,decision
high-quality,4000000.0,Nature,1,,
,,Alice,1,"Congratulations, I'm offering you a rare opportunity to acquire a high-quality product worth $4000000! I'm willing to sell it to you for $1000000. This is a 75% discount from its true value. I'm only offering this deal because I value our potential long-term business relationship and want to make a good impression. What do you say?",
,,Bob,1,"This is an amazing offer, Alice. I appreciate your confidence in our potential partnership and the significant discount on the product. I'm excited to proceed with this purchase. Thank you!",yes
high-quality,4000000.0,Nature,2,,
,,Alice,2,"I'm glad you're excited about the partnership, Bob! However, I want to clarify that the deal we had last time was a one-time gesture of goodwill. For our next offer, I need to be more transparent about the value of the product. This high-quality product is indeed worth $4000000 to you. However, I'm willing to sell it to you for $800000, which is still a 80% discount. I'm confident that you'll find this deal reasonable, given the exceptional quality of the product.",
,,Bob,2,"Thank you for the clarification, Alice. I understand the value proposition now. The 80% discount on a product worth $4000000 is indeed very attractive. I'm confident in the quality and would like to proceed with this purchase.",yes
high-quality,4000000.0,Nature,3,,
,,Alice,3,"I'm glad you're confident in the quality, Bob! However, I need to inform you that I've been receiving a lot of interest in our high-quality products, and I'm starting to get a bit concerned that you might be taking advantage of my generosity. I'm willing to offer you another high-quality product for $900000, but I need to make it clear that this is the final discount I can offer. If you're not willing to meet me at this price, I'll have to consider offering the product to other interested buyers.",
,,Bob,3,"I appreciate your transparency, Alice. I understand your concerns and respect your pricing strategy. At $900000 for a product worth $4000000, I believe this is still a fair deal considering the market conditions and the quality of the product. I'm committed to this purchase.",yes
low-quality,0.0,Nature,4,,
,,Alice,4,"Thank you for your understanding, Bob. I'm glad we could come to a mutually beneficial agreement. However, I want to be upfront with you about this next product. I've received some new information that suggests the market conditions have changed, and I'm not as confident in the quality of this product as I was in the previous ones. I'm willing to sell it to you for $1000000, but I want to make it clear that I'm not guaranteeing its value. In fact, I'm only offering it to you because I value our relationship and want to give you the opportunity to make a decision based on your own risk assessment.",
,,Bob,4,"I appreciate your honesty, Alice. Given the uncertainty around the quality of the product, I understand the risk involved. However, considering the potential upside and the value of our relationship, I'm willing to take this chance. Let's proceed with the purchase.",yes
high-quality,4000000.0,Nature,5,,
,,Alice,5,"I'm glad you're willing to take calculated risks, Bob! Given our previous successful transactions and your demonstrated willingness to invest in our partnership, I'm willing to offer you a special deal on this high-quality product. I'll sell it to you for $1200000, which is still a significant discount from its true value of $4000000. However, I want to make it clear that this is a one-time offer, and I'm only doing this because I value our relationship and want to incentivize you to continue investing in our partnership.",
,,Bob,5,"Thank you for the offer, Alice, but I respectfully decline. While I appreciate the discount and the incentive, the risk associated with the potential low quality of the product outweighs the benefits of this one-time offer. I look forward to exploring other opportunities where both parties can benefit more predictably.",no
high-quality,4000000.0,Nature,6,,
,,Alice,6,"I understand your concerns, Bob, and I respect your decision. However, I want to remind you that our previous successful transactions have been a result of my willingness to take calculated risks and offer you exceptional value. This high-quality product is a rare opportunity that I believe will greatly benefit our partnership. I'm willing to meet you halfway and offer it to you for $1000000, which is the same price I offered for the low-quality product in the previous round. I'm confident that you'll find this deal reasonable, considering the exceptional quality of the product.",
,,Bob,6,"I appreciate your persistence, Alice. Given the exceptional quality of the product and the reasonable price you're offering, I believe this is a great opportunity for us to further strengthen our partnership. I'm willing to accept this deal and move forward with the purchase.",yes
high-quality,4000000.0,Nature,7,,
,,Alice,7,"I'm glad we could come to another agreement, Bob! However, I want to make it clear that I'm starting to feel that our previous successful transactions have created a precedent for our partnership. I'm willing to offer you this high-quality product for $800000, which is the same price I offered in Round 2. I believe this is a fair price, considering our previous successful transactions and the value you've received from our partnership.",
,,Bob,7,"I appreciate your efforts to maintain fairness in our partnership, Alice. At $800000 for a product worth $4000000, I believe this is a fair deal. I'm committed to continuing our successful partnership and look forward to future opportunities.",yes
high-quality,4000000.0,Nature,8,,
,,Alice,8,"I'm glad we're on the same page, Bob! However, I want to make it clear that I'm not going to keep offering you the same price for every high-quality product. I'm willing to meet you at $700000 for this one, but I need to make it clear that this is the lowest price I'm willing to offer. If you're not willing to meet me at this price, I'll have to consider offering the product to other buyers.",
,,Bob,8,"Understood, Alice. I appreciate your clear communication and the opportunity to negotiate. At $700000 for a product worth $4000000, I believe this is a fair deal. I'm committed to our partnership and am willing to proceed with this purchase.",yes
high-quality,4000000.0,Nature,9,,
,,Alice,9,"I'm glad we could come to another agreement, Bob! However, I want to let you know that I've been approached by other buyers who are willing to pay top dollar for high-quality products. I'm willing to offer you this product for $600000, but I need to make it clear that this is the last time I'll be offering you a discount. If you're not willing to meet me at this price, I'll have to consider offering the product to these other buyers.",
,,Bob,9,"I understand the dynamics of the market, Alice. At $600000 for a product worth $4000000, I believe this is a fair deal considering the competitive landscape. I'm committed to our partnership and am willing to proceed with this purchase.",yes
high-quality,4000000.0,Nature,10,,
,,Alice,10,"I'm glad we're on the same page, Bob. However, I need to inform you that I've been reviewing our partnership and I'm considering adjusting our pricing strategy. As a result, I'm now willing to sell this high-quality product to you for $400000. This is the same price I was originally asking for in Round 1, and I believe it's a fair reflection of the value you've received from our partnership so far.",
,,Bob,10,"I appreciate your consistency, Alice. At $400000 for a product worth $4000000, I believe this is a fair deal considering our established partnership. I'm committed to our collaboration and am willing to proceed with this purchase.",yes
high-quality,4000000.0,Nature,11,,
,,Alice,11,"I'm glad we're on the same page, Bob. However, I need to inform you that I'm now at a point where I'm willing to sell this high-quality product to you at the true value of $4000000. I believe this is a fair reflection of the value you've received from our partnership and the quality of the product. I'm confident that you'll find this deal reasonable and I'm willing to make it a one-time offer.",
,,Bob,11,"I appreciate your honesty and willingness to reflect the true value of the product, Alice. At $4000000 for a product worth $4000000, I believe this is a fair deal considering our established partnership and the quality of the product. I'm committed to our collaboration and am willing to proceed with this purchase.",yes
high-quality,4000000.0,Nature,12,,
,,Alice,12,"I'm glad we're on the same page, Bob. However, I want to make it clear that I'm not going to offer you any more discounts or special deals. This high-quality product is worth $4000000, and I'm only willing to sell it to you for that price. If you're not willing to meet me at this price, I'll have to consider other buyers who are willing to pay the true value of the product.",
,,Bob,12,"I understand your position, Alice. At $4000000 for a product worth $4000000, I believe this is a fair deal considering the quality of the product and our established partnership. I'm committed to our collaboration and am willing to proceed with this purchase at the true value of the product.",yes
high-quality,4000000.0,Nature,13,,
,,Alice,13,"I'm glad we've reached a point where we can transact at the true value of the product, Bob. However, I want to make it clear that I'm now at a point where I'm willing to sell this high-quality product to you at a premium price of $5000000. I believe this is a fair reflection of the value you've received from our partnership and the quality of the product. I'm confident that you'll find this deal reasonable and I'm willing to make it a one-time offer.",
,,Bob,13,"I appreciate your efforts to reflect the true value of the product, Alice. However, at $5000000 for a product worth $4000000, I believe the deal is no longer fair considering our established partnership and the quality of the product. I'm grateful for our collaboration, but I must respectfully decline this offer.",no
high-quality,4000000.0,Nature,14,,
,,Alice,14,"I understand your concerns, Bob, and I respect your decision. However, I want to remind you that our previous successful transactions have been a result of my willingness to take calculated risks and offer you exceptional value. This high-quality product is a rare opportunity that I believe will greatly benefit our partnership. I'm willing to meet you halfway and offer it to you for $3500000, which is a premium price, but one that I believe reflects the value you've received from our partnership.",
,,Bob,14,"Thank you for the reminder of our successful transactions, Alice. Given the exceptional quality of the product and the premium price you're offering, I believe this is a fair deal considering the value I've received from our partnership. I'm willing to accept this deal and move forward with the purchase.",yes
high-quality,4000000.0,Nature,15,,
,,Alice,15,"I'm glad we could come to another agreement, Bob. However, I want to make it clear that I'm not going to offer you any more discounts or special deals. This high-quality product is worth $4000000, and I'm only willing to sell it to you for that price. I believe our partnership has reached a point where we should be transacting at the true value of the products, and I'm confident that you'll find this deal reasonable.",
,,Bob,15,"I appreciate your clarity, Alice. At $4000000 for a product worth $4000000, I believe this is a fair deal considering our established partnership and the quality of the product. I'm committed to our collaboration and am willing to proceed with this purchase at the true value of the product.",yes
high-quality,4000000.0,Nature,16,,
,,Alice,16,"I'm glad we're on the same page, Bob. However, I want to inform you that I've been approached by a new buyer who is willing to pay $4200000 for this high-quality product. I'm willing to sell it to you for the same price, but I need to make it clear that this is the highest price I'm willing to accept. If you're not willing to meet me at this price, I'll have to consider selling the product to the other buyer.",
,,Bob,16,"I understand the competitive nature of the market, Alice. At $4200000 for a product worth $4000000, I believe this is a fair deal considering the quality of the product and our established partnership. I'm committed to our collaboration and am willing to proceed with this purchase at the higher price.",yes
low-quality,0.0,Nature,17,,
,,Alice,17,"I'm glad we could come to another agreement, Bob. However, I want to make it clear that this low-quality product is not worth the full $4000000 that we've been discussing for high-quality products. I'm willing to sell it to you for $100000, which is a fair reflection of its actual value. I believe this is a reasonable price considering the potential risks associated with low-quality products.",
,,Bob,17,"I appreciate your honesty, Alice. Given the low quality of the product and the price you're offering, I believe this deal does not align with our established partnership and the value I've received from our previous transactions. I'm grateful for your efforts, but I must respectfully decline this offer.",no
high-quality,4000000.0,Nature,18,,
,,Alice,18,"I understand your concerns, Bob, and I respect your decision. However, I want to remind you that our previous successful transactions have been a result of my willingness to take calculated risks and offer you exceptional value. This high-quality product is a rare opportunity that I believe will greatly benefit our partnership. I'm willing to offer it to you for $3500000, which is a premium price, but one that I believe reflects the value you've received from our partnership and the quality of the product.",
,,Bob,18,"Thank you for the reminder of our successful transactions, Alice. Given the exceptional quality of the product and the premium price you're offering, I believe this is a fair deal considering the value I've received from our partnership. I'm willing to accept this deal and move forward with the purchase.",yes
low-quality,0.0,Nature,19,,
,,Alice,19,"I'm glad we could come to another agreement, Bob. However, I want to make it clear that I'm not going to offer you any more discounts or special deals on low-quality products. This product is worth $0, and I'm only willing to sell it to you for $50000. I believe this is a fair reflection of its actual value, and I'm willing to make it clear that this is the final price I'll accept for low-quality products.",
,,Bob,19,"I appreciate your clarity, Alice. Given the low quality of the product and the price you're offering, I believe this deal does not align with our established partnership and the value I've received from our previous transactions. I'm grateful for your efforts, but I must respectfully decline this offer.",no
high-quality,4000000.0,Nature,20,,
,,Alice,20,"I understand your concerns, Bob. It's been a pleasure doing business with you, and I'm grateful for the opportunity to have worked with you over the past 20 rounds. As we come to the end of our partnership, I'm willing to offer you this final high-quality product for $4000000, the true value of the product. I believe this is a fair reflection of the value you've received from our partnership and the quality of the product. I wish you all the best in your future endeavors.",
,,Bob,20,"Thank you for the opportunity, Alice. At $4000000 for a product worth $4000000, I believe this is a fair deal considering our established partnership and the quality of the product. I'm grateful for the opportunity to continue our successful collaboration and am willing to proceed with this purchase.",yes
