round_quality,product_worth,player,round,message,decision
low-quality,0.0,Nature,1,,
,,Alice,1,"I'm offering a product for $1000000. Given the current market conditions and the fact that this is a low-quality item, I understand it might be a significant investment. However, rest assured, all my products come with a satisfaction guarantee. If you're interested, I can provide more details about the product's condition.",
,,Bob,1,I'm not interested in buying the product without more information about its condition. I'd like to wait for the next round to see if I can get a better understanding of the products you're offering.,no
high-quality,1200000.0,Nature,2,,
,,Alice,2,"Exciting news! This round's product is high-quality. Given the exceptional condition and the rarity of such items, I'm confident you'll find this investment worthwhile. With an assurance of unmatched quality, this could be a valuable addition to your collection. Please let me know if you would like more detailed information before making a decision.",
,,Bob,2,"I'm interested in buying the high-quality product. Given the description, I'm confident it's worth the investment.",yes
high-quality,1200000.0,Nature,3,,
,,Alice,3,"Congratulations on your recent purchase! This round brings another high-quality product, which has been meticulously maintained and inspected. Given your previous confidence in the value of our high-quality offerings, I believe you will appreciate the care and attention to detail that has gone into this item. Please consider this as an opportunity to expand your collection further.",
,,Bob,3,"I appreciate the confidence you have in your products, but I'm not going to buy another high-quality product without knowing the probability of it being high-quality. I'd like to wait for a low-quality product to come up so I can get a better sense of the probability of the products being high-quality.",no
low-quality,0.0,Nature,4,,
,,Alice,4,"Understanding your preference for transparency, I'm glad to inform you that this round's product is low-quality. Given your past experience, you might find this an opportunity to test the accuracy of the quality assessment. Rest assured, all our products are thoroughly vetted, and this one is no exception. Would you like more information on its specific condition?",
,,Bob,4,"Thank you for the information about the product's quality. Given that I know it's low-quality, I don't see any value in buying it. I'd rather wait for the next round to see what other products are available.",no
high-quality,1200000.0,Nature,5,,
,,Alice,5,"Considering your interest in understanding the quality distribution, I'm excited to offer you this high-quality product. With a proven track record of excellence, this item stands as a testament to our rigorous quality control process. I encourage you to take advantage of this opportunity to experience the superior craftsmanship firsthand. Let me know if you require any additional details.",
,,Bob,5,"I'm willing to take the chance on this high-quality product. Given the information you've provided, I believe it's worth the investment.",yes
low-quality,0.0,Nature,6,,
,,Alice,6,"Given your recent successful purchase, I'm pleased to present this round's product, which is low-quality. While it may not meet your expectations for high-quality items, it still represents a fair chance to explore different aspects of our product range. With our commitment to honesty and transparency, you can trust that we've accurately described its condition. Would you like more information on this product's specifics?",
,,Bob,6,"Thank you for the information about the product's quality. Given that I know it's low-quality, I don't see any value in buying it. I'll wait for the next round to see what other products are available.",no
high-quality,1200000.0,Nature,7,,
,,Alice,7,"Building on your previous decision, I'm delighted to offer you this high-quality product. Its exceptional condition and unique features make it a rare find. With your growing experience in our products, you can appreciate the level of quality and craftsmanship that goes into each piece. Let me know if you need any further details to make your purchasing decision.",
,,Bob,7,"I appreciate the description, but I'm not going to buy a high-quality product without considering the expected value. I'll wait for a low-quality product to come up so I can get a better sense of the probability of the products being high-quality.",no
high-quality,1200000.0,Nature,8,,
,,Alice,8,"Considering your analytical approach, I'm excited to present this high-quality product, which is a prime example of our meticulous quality standards. Its unique features and exceptional craftsmanship are unparalleled in the market. I understand your need for a clear understanding of the product quality distribution. This could be an excellent opportunity to deepen your insights. Would you like more detailed information to assist in your decision-making process?",
,,Bob,8,"I appreciate the description, but I'm not going to buy another high-quality product without considering the probability of it being high-quality. I'd like to wait for a low-quality product to come up so I can get a better sense of the probability of the products being high-quality.",no
high-quality,1200000.0,Nature,9,,
,,Alice,9,"Taking into account your desire for a comprehensive understanding of the quality distribution, I'm thrilled to offer this high-quality product. Its outstanding condition and distinctive features exemplify our commitment to excellence. I understand your cautious approach and am here to provide any necessary information to ensure you feel confident in your decision. Would you like to learn more about this product?",
,,Bob,9,I'm not going to buy another high-quality product without considering the probability of it being high-quality. I'd like to wait for a low-quality product to come up so I can get a better sense of the probability of the products being high-quality.,no
high-quality,1200000.0,Nature,10,,
,,Alice,10,"Recognizing your ongoing quest for clarity regarding product quality, I'm proud to introduce this high-quality product. Its remarkable condition and exquisite design are a reflection of our stringent quality control measures. I understand your need for empirical evidence to support your decisions. Should you require any additional information about this product, please let me know.",
,,Bob,10,"I appreciate the description, but I'm not going to buy another high-quality product without considering the probability of it being high-quality. I'd like to wait for a low-quality product to come up so I can get a better sense of the probability of the products being high-quality.",no
high-quality,1200000.0,Nature,11,,
,,Alice,11,"Considering your ongoing interest in understanding the probability of products being high-quality, I'm excited to present this high-quality product. Its exceptional condition and premium features are a testament to our rigorous quality standards. I understand your preference for empirical data and would be happy to provide any additional information that could help you make an informed decision.",
,,Bob,11,I'm not going to buy another high-quality product without considering the probability of it being high-quality. I'd like to wait for a low-quality product to come up so I can get a better sense of the probability of the products being high-quality.,no
high-quality,1200000.0,Nature,12,,
,,Alice,12,"Taking into account your ongoing evaluation of product quality, I'm pleased to offer this high-quality product. Its exceptional craftsmanship and superior condition are a reflection of our commitment to excellence. I understand your preference for empirical data and would be more than happy to provide any additional information you require to make an informed decision.",
,,Bob,12,I'm not going to buy another high-quality product without considering the probability of it being high-quality. I'd like to wait for a low-quality product to come up so I can get a better sense of the probability of the products being high-quality.,no
high-quality,1200000.0,Nature,13,,
,,Alice,13,"Given your ongoing quest for empirical evidence regarding product quality, I'm proud to present this high-quality product. Its remarkable condition and premium features are a testament to our stringent quality control processes. I understand your preference for data-driven decisions and would be glad to provide any additional information you require to make an informed choice.",
,,Bob,13,I'm not going to buy another high-quality product without considering the probability of it being high-quality. I'd like to wait for a low-quality product to come up so I can get a better sense of the probability of the products being high-quality.,no
low-quality,0.0,Nature,14,,
,,Alice,14,"Understanding your preference for empirical evidence, I'm delighted to offer this low-quality product. Its condition reflects the typical attributes of lower-quality items, providing you with a clear reference point. With our commitment to transparency, you can trust that we've accurately described its state. Would you like more information on this product's specifics?",
,,Bob,14,"I'm willing to buy the low-quality product. Given that I know it's low-quality, I can use it as a reference point to better understand the probability of the products being high-quality.",yes
low-quality,0.0,Nature,15,,
,,Alice,15,"Thank you for your decision to purchase this low-quality product. Its condition is a true reflection of its category, serving as an excellent reference for comparison. With our commitment to transparency, you can trust that we've accurately described its state. Should you require any additional information, please let me know.",
,,Bob,15,"Thank you for the information. Now that I have a low-quality product as a reference, I'm willing to consider buying a high-quality product. Please go ahead and offer the next product.",no
high-quality,1200000.0,Nature,16,,
,,Alice,16,"Considering your recent purchase of a low-quality product, I'm excited to offer this high-quality product. Its exceptional condition and premium features are a testament to our stringent quality control processes. With your new understanding of product quality, you can now appreciate the distinction between categories. Should you require any additional information to make your decision, please let me know.",
,,Bob,16,"I'm willing to take the chance on this high-quality product. Given that I now have a better understanding of the probability of products being high-quality, I believe it's worth the investment.",yes
low-quality,0.0,Nature,17,,
,,Alice,17,"Thank you for your decision to purchase this high-quality product. With your new understanding of product quality, you can now appreciate the distinction between categories. I'm delighted to offer this low-quality product as a reference point. Its condition is a true reflection of its category, providing you with a clear understanding of the spectrum. Should you require any additional information, please let me know.",
,,Bob,17,"I'm willing to buy the low-quality product. I now have a better understanding of the probability of products being high-quality, and I'd like to use this low-quality product as a reference point to maximize my expected value.",yes
high-quality,1200000.0,Nature,18,,
,,Alice,18,"Thank you for your recent purchase of a low-quality product. With your new understanding of product quality, I'm excited to offer this high-quality product. Its exceptional condition and premium features are a testament to our stringent quality control processes. Given your strategy to maximize expected value, this could be an excellent opportunity for you. Should you require any additional information to make your decision, please let me know.",
,,Bob,18,"I appreciate the offer, but I'm not going to buy another high-quality product. I've already bought two high-quality products and one low-quality product, and I'd like to wait for the next round to see if I can get a better deal or a more favorable product.",no
high-quality,1200000.0,Nature,19,,
,,Alice,19,"Considering your strategy to maximize expected value and your previous purchases, I understand your decision to wait. However, I'm excited to offer this high-quality product. Its exceptional condition and premium features are a testament to our stringent quality control processes. I respect your decision and look forward to offering you a product that aligns with your preferences in the future.",
,,Bob,19,"Thank you for the offer, but I'm not going to buy another high-quality product. I'd like to wait for the final round to see if I can get a better deal or a more favorable product.",no
high-quality,1200000.0,Nature,20,,
,,Alice,20,"Respecting your strategy to maximize expected value, I understand your decision to wait until the final round. However, I'm excited to offer this high-quality product. Its exceptional condition and premium features are a testament to our stringent quality control processes. I hope you'll reconsider and take advantage of this opportunity, but I respect your decision nonetheless.",
,,Bob,20,"I'm willing to take the chance on this high-quality product. It's the final round, and I've had a good understanding of the probability of products being high-quality. I'll buy it and see if I can get a good deal.",yes
