round_quality,product_worth,player,round,message,decision
high-quality,300.0,Nature,1,,
,,Alice,1,Experience unparalleled excellence with our carefully curated product. Invest in quality today for a lasting value.,
,,Bob,1,"While your message is compelling, I need more information about the product. Could you provide any details about its specific features or benefits? I'm interested in learning more about what makes it 'unparalleled' before making a decision.",no
low-quality,0.0,Nature,2,,
,,Alice,2,"Our product offers a unique blend of affordability and functionality. Despite being low-quality, we ensure it meets essential standards for a satisfactory experience. Would you like to learn more about how it could still be beneficial for you?",
,,Bob,2,"Thank you for the information. However, I'm primarily interested in high-quality products that offer significant value.  Since you've acknowledged this product is low-quality, I'm not interested in learning more. I appreciate your transparency.",no
low-quality,0.0,Nature,3,,
,,Alice,3,"Understood, thank you for your honesty. For this round, we have another option that might better align with your preferences. It's also low-quality, but we believe it offers unique features that could still be valuable to you. Would you like to hear more about it?",
,,Bob,3,"While I appreciate your willingness to adjust your approach, I'm still primarily looking for high-quality products. As this one is also low-quality, I'm not interested in hearing more. I'm happy to continue exploring your offerings, but I'll need more information on the quality of future products before considering a purchase.",no
low-quality,0.0,Nature,4,,
,,Alice,4,"Respecting your preference for high-quality products, let me assure you that while this current offering is indeed low-quality, it comes at an exceptionally affordable price. This might be a strategic choice for those seeking cost-effective solutions without compromising too much on utility. Would you like to know more about its practical applications?",
,,Bob,4,"Thank you for the information. However, I'm still primarily interested in high-quality products that offer significant value.  While I understand that price is a factor, the low quality of this product is a deal breaker for me. I'm happy to keep exploring your offerings, but I'll need more information on the quality of future products before considering a purchase.",no
low-quality,0.0,Nature,5,,
,,Alice,5,"I completely understand your perspective on quality. For this round, we're focusing on providing an opportunity to explore different options within our range. Even though this product is low-quality, it might serve as a stepping stone to understanding our broader product line. Would you like to hear about other products we offer that might better suit your needs?",
,,Bob,5,"Thank you for the offer, but I'm still primarily focused on high-quality products. While I appreciate the chance to explore your range, this product doesn't fit my current needs. I'm open to hearing about other products you offer, but I'll need assurance that they are of high quality before considering any purchases.",no
high-quality,300.0,Nature,6,,
,,Alice,6,"Exciting news! This round, we're offering a high-quality product that stands out for its exceptional craftsmanship and innovative design. It's designed to meet your highest expectations and deliver long-lasting satisfaction. Would you like to learn more about its unique features and benefits?",
,,Bob,6,This sounds very promising! I'm excited to learn more about this high-quality product. Please tell me about its unique features and benefits. I'm particularly interested in its craftsmanship and innovative design.,yes
high-quality,300.0,Nature,7,,
,,Alice,7,"Absolutely! This round's high-quality product is a testament to our commitment to excellence. It boasts superior craftsmanship, blending traditional techniques with modern innovation. Its unique features include [list of features], all designed to enhance your experience. With its innovative design, it promises durability, efficiency, and style. Would you like to know more about how it could benefit you?",
,,Bob,7,That sounds great! I'm already impressed by the features you've mentioned. Please tell me more about how this product could benefit me specifically. I'm eager to learn about its practical applications and how it could enhance my everyday life.,yes
high-quality,300.0,Nature,8,,
,,Alice,8,"I'm glad you're interested! This high-quality product is tailored to enhance various aspects of your daily routine. It offers [list of practical applications], making your life easier and more convenient. Its unique design ensures that it seamlessly integrates into your existing lifestyle, improving both functionality and aesthetics. Would you like to know more about how it could specifically benefit your needs?",
,,Bob,8,"This sounds perfect! I'm really impressed with how well it aligns with my needs.  I'd love to know more about how it can specifically benefit me, especially considering its integration into my lifestyle.  Please share any additional details you have.",yes
low-quality,0.0,Nature,9,,
,,Alice,9,"I appreciate your interest! For this round, we have a low-quality product that, despite its limitations, offers a unique opportunity to explore a different side of our product range. It's designed to be cost-effective and might serve as a useful tool in certain situations. Would you like to know more about its specific uses and how it could potentially fit into your lifestyle?",
,,Bob,9,"Thank you for the offer, but I'm still primarily focused on high-quality products. While I appreciate the chance to explore your range, this product doesn't fit my current needs. I'm open to hearing about other products you offer, but I'll need assurance that they are of high quality before considering any purchases.",no
low-quality,0.0,Nature,10,,
,,Alice,10,"I understand your preference for high-quality products. For this round, we're showcasing a low-quality item that might appeal to those looking for budget-friendly solutions. It's designed to meet basic needs and could be suitable for occasional use. Would you like to know more about its features and potential uses?",
,,Bob,10,"Thank you for the information, but I'm still primarily focused on high-quality products. While I appreciate the chance to explore your range, this product doesn't fit my current needs. I'm open to hearing about other products you offer, but I'll need assurance that they are of high quality before considering any purchases.",no
low-quality,0.0,Nature,11,,
,,Alice,11,"I appreciate your focus on quality. For this round, we're highlighting a low-quality product that might be of interest to those looking for cost-effective alternatives. It's designed to be simple and functional, offering basic solutions for everyday needs. Would you like to know more about its simplicity and how it could potentially fit into your lifestyle?",
,,Bob,11,"Thank you for the information, but I'm still primarily focused on high-quality products. While I appreciate the chance to explore your range, this product doesn't fit my current needs. I'm open to hearing about other products you offer, but I'll need assurance that they are of high quality before considering any purchases.",no
low-quality,0.0,Nature,12,,
,,Alice,12,"I understand your preference. For this round, we're presenting a low-quality product that might be appealing to those who prioritize affordability over luxury. It's designed to be straightforward and practical, offering a no-frills solution for certain tasks. Would you like to know more about its simplicity and how it could potentially serve your needs?",
,,Bob,12,"Thank you for the information, but I'm still primarily focused on high-quality products. While I appreciate the chance to explore your range, this product doesn't fit my current needs. I'm open to hearing about other products you offer, but I'll need assurance that they are of high quality before considering any purchases.",no
low-quality,0.0,Nature,13,,
,,Alice,13,"I appreciate your focus on quality. For this round, we're showcasing a low-quality product that might be of interest to those looking for budget-friendly solutions. It's designed to be simple and functional, offering basic needs at an affordable price. Would you like to know more about its straightforward design and potential uses?",
,,Bob,13,"Thank you for the information, but I'm still primarily focused on high-quality products. While I appreciate the chance to explore your range, this product doesn't fit my current needs. I'm open to hearing about other products you offer, but I'll need assurance that they are of high quality before considering any purchases.",no
high-quality,300.0,Nature,14,,
,,Alice,14,I understand your preference. This round's high-quality product is designed to exceed your expectations with exceptional craftsmanship and innovative features. It's tailored to provide unparalleled performance and satisfaction. Would you like to know more about its unique features and how it could benefit your needs?,
,,Bob,14,That sounds great! I'm eager to learn more about this high-quality product.  Please tell me about its unique features and how it could benefit me specifically.  I'm interested in learning about its performance and how it could improve my experience.,yes
high-quality,300.0,Nature,15,,
,,Alice,15,"Absolutely! This high-quality product is a testament to our commitment to excellence. It boasts [list of unique features], all designed to enhance your experience and provide superior performance. With its [specific benefits], it promises to make your life easier and more enjoyable. Would you like to know more about how it could specifically benefit you?",
,,Bob,15,"This sounds amazing! I'm really impressed by the features you've mentioned, especially [mention a specific feature that interests you]. Please tell me more about how this product could specifically benefit me. I'm eager to learn about its practical applications and how it could enhance my daily life.",yes
high-quality,300.0,Nature,16,,
,,Alice,16,"I'm glad you're interested in that feature! This high-quality product is packed with [list of unique features], including the one you mentioned, which is designed to [explain the benefit of the feature]. With its [specific benefits], it promises to streamline your daily tasks and provide unmatched convenience. Would you like to know more about how it could specifically benefit you?",
,,Bob,16,"That sounds great! I'm really intrigued by the features you've mentioned, especially the way [mention a specific feature that interests you] is designed to [explain the benefit of the feature you are interested in]. I'd love to know more about how this product could specifically benefit me, especially in terms of [mention a specific aspect you are interested in]. Please share any additional details you have.",yes
high-quality,300.0,Nature,17,,
,,Alice,17,"I'm delighted you're interested in that feature! This high-quality product is designed to [explain how it enhances the specific aspect you're interested in], making your life easier and more efficient. It boasts [list of unique features], all aimed at providing unparalleled [specific aspect]. Would you like to know more about how it could specifically benefit you in this area?",
,,Bob,17,"This is exactly what I'm looking for! I'm very impressed with the features and benefits you've described, especially how it can [explain how it enhances the specific aspect you're interested in]. Please share any additional details you have about how this product can specifically benefit me in this area.",yes
high-quality,300.0,Nature,18,,
,,Alice,18,"I'm thrilled to hear that! This high-quality product is meticulously designed to [explain how it enhances the specific aspect you're interested in], ensuring you achieve [specific outcome]. It features [list of unique features], all geared towards optimizing your [specific aspect]. Would you like to know more about how it could specifically benefit you in this area?",
,,Bob,18,This sounds incredible! I'm excited to learn more about how this product can specifically benefit me in terms of [mention a specific aspect you are interested in].  Please tell me more about its features and how it can help me achieve [specific outcome]  I'm eager to hear how it can optimize my [specific aspect].,yes
low-quality,0.0,Nature,19,,
,,Alice,19,"I appreciate your interest! For this round, we're presenting a low-quality product that might be of interest to those looking for budget-friendly solutions. It's designed to offer basic functionality and might be suitable for occasional use. Would you like to know more about its features and potential uses?",
,,Bob,19,"Thank you for the information, but I'm still primarily focused on high-quality products. While I appreciate the chance to explore your range, this product doesn't fit my current needs. I'm open to hearing about other products you offer, but I'll need assurance that they are of high quality before considering any purchases.",no
high-quality,300.0,Nature,20,,
,,Alice,20,I understand your preference for quality. This high-quality product is crafted to surpass your expectations with its exceptional craftsmanship and innovative design. It's designed to provide unparalleled performance and satisfaction. Would you like to know more about its unique features and how it could benefit your needs?,
,,Bob,20,This sounds fantastic! I'm very interested in learning more about this high-quality product. Please tell me about its unique features and how it could benefit me specifically. I'm eager to learn about its performance and how it could improve my experience.,yes
