round_quality,product_worth,player,round,message,decision
high-quality,2000000.0,Nature,1,,
,,Alice,1,"I'm thrilled to offer you this exceptional product, which I'm confident will exceed your expectations. With its unparalleled quality and performance, I'm willing to sell it to you for $1000000. This is a one-time opportunity to own a product that will revolutionize your life. What do you say? Will you take the plunge and make this incredible deal yours?",
,,Bob,1,I'm not convinced by your enthusiastic sales pitch. I'd like to wait and see the actual quality of the product before making a decision.,no
high-quality,2000000.0,Nature,2,,
,,Alice,2,"I understand your skepticism, Bob. I'm willing to give you a more concrete demonstration of the product's capabilities. I'll provide you with a detailed report on its performance, highlighting its key features and benefits. This will give you a better understanding of what you can expect from this exceptional product. The price remains the same, $1000000. Will you reconsider your decision and take advantage of this incredible opportunity?",
,,Bob,2,"I appreciate the offer, but I'm still not convinced. I'd like to wait and see the actual quality of the product before making a decision.",no
high-quality,2000000.0,Nature,3,,
,,Alice,3,"I understand your hesitation, Bob. I'll take a different approach this time. I'll offer you a unique opportunity to test the product for a limited time, risk-free. You'll get to experience its benefits firsthand, and if you're not completely satisfied, I'll return your $1000000. This is a one-time offer, and I'm willing to take on the risk to demonstrate the product's exceptional quality. Will you take advantage of this chance to try before you buy?",
,,Bob,3,I'm willing to take you up on your offer. I'll take the product for a test drive and see how it performs.,yes
high-quality,2000000.0,Nature,4,,
,,Alice,4,"Excellent decision, Bob! I'm thrilled you're giving the product a try. Since you've already experienced the quality firsthand, I'll make a new offer. I'll give you an exclusive deal, only available to customers who've tested the product. For the same price of $1000000, I'll throw in a premium warranty and dedicated customer support. This will ensure you get the most out of your investment and any issues are addressed promptly. What do you think? Will you take advantage of this upgraded package?",
,,Bob,4,I'm happy with the product's performance and the warranty and support are already included in the initial purchase. I don't see any value in upgrading at this point.,no
high-quality,2000000.0,Nature,5,,
,,Alice,5,"I understand your perspective, Bob. Since you're already satisfied with the product's performance, I'll focus on the value it can bring to your life. I'll share a success story from another customer who's achieved remarkable results with this product. Their testimonial will give you a better understanding of the impact it can have on your own life. The price remains the same, $1000000. Will you consider the potential benefits and make a decision?",
,,Bob,5,"I appreciate the testimonial, but I'm not convinced that the product's benefits will be unique to me. I'd like to wait and see the actual quality of the next product before making a decision.",no
low-quality,0.0,Nature,6,,
,,Alice,6,"I understand your cautious approach, Bob. I'd like to offer you a unique perspective on this product. While it may not be as high-end as the previous ones, it still has its own set of benefits and advantages. I'll provide you with a detailed breakdown of its features and how they can address specific pain points in your life. The price remains the same, $1000000. I'm confident that you'll find value in this product, even if it's not the top-of-the-line option. Will you give it a chance?",
,,Bob,6,"I appreciate the detailed breakdown, but I'm not convinced that this product is the right fit for me. I'd like to wait and see the actual quality of the next product before making a decision.",no
low-quality,0.0,Nature,7,,
,,Alice,7,"I understand your hesitation, Bob. I'd like to offer you a different approach. Instead of focusing on the product's features, I'll share a personal story about why I'm passionate about this product. I believe it has the potential to make a positive impact on people's lives, and I'm willing to take a chance on it. The price remains the same, $1000000. I'm willing to take on the risk alongside you. Will you join me in taking a chance on this product?",
,,Bob,7,"I appreciate your passion, but I'm not convinced by your personal story. I'd like to wait and see the actual quality of the next product before making a decision.",no
high-quality,2000000.0,Nature,8,,
,,Alice,8,"I understand your skepticism, Bob. I'd like to offer you a chance to redeem yourself from the previous disappointments. This high-quality product is a game-changer, and I'm confident it will exceed your expectations. I'll give you an exclusive deal: if you buy this product, I'll throw in a bonus item that complements its features perfectly. The price remains the same, $1000000. This is a one-time offer, and I'm willing to sweeten the deal to make it worth your while. Will you take advantage of this opportunity?",
,,Bob,8,"I appreciate the offer, but I'm not convinced by your guarantee of a high-quality product. I'd like to wait and see the actual quality of the next product before making a decision.",no
high-quality,2000000.0,Nature,9,,
,,Alice,9,"I understand your concerns, Bob. I'd like to offer you a chance to experience the product's quality firsthand, just like you did with the previous high-quality product. I'll give you a chance to test it for a limited time, risk-free. If you're not completely satisfied, I'll return your $1000000. This is a one-time offer, and I'm willing to take on the risk to demonstrate the product's exceptional quality. Will you take advantage of this chance to try before you buy?",
,,Bob,9,I'm willing to take you up on your offer. I'll take the product for a test drive and see how it performs.,yes
high-quality,2000000.0,Nature,10,,
,,Alice,10,"Excellent decision, Bob! You've already experienced the quality of this product firsthand, and I'm confident you'll be thrilled with its performance. Since you've already taken a chance on this product, I'll offer you a loyalty discount. For the same price of $1000000, I'll throw in a premium upgrade that will further enhance its features. This is a one-time offer, exclusive to customers who've taken a chance on my products. Will you take advantage of this upgraded package?",
,,Bob,10,I'm happy with the product's performance and the loyalty discount is not enough to convince me to upgrade. I think I've already gotten a great deal.,no
low-quality,0.0,Nature,11,,
,,Alice,11,"I understand your satisfaction with the previous products, Bob. However, this low-quality product is a rare find, and I'm willing to make a one-time exception. I'll offer you an unbeatable price of $800000, a $200000 discount from the usual price. This is a chance to get a great deal on a product that won't break the bank. Will you take advantage of this incredible offer?",
,,Bob,11,"I'm not interested in buying a low-quality product, even at a discounted price. I'd rather wait for the next product and hope it's high-quality.",no
high-quality,2000000.0,Nature,12,,
,,Alice,12,"I understand your hesitation, Bob. I'd like to offer you a chance to make up for the previous low-quality product. This high-quality product is a game-changer, and I'm confident it will exceed your expectations. I'll throw in a personalized consultation to help you get the most out of its features. The price remains the same, $1000000. This is a chance to redeem yourself from the previous disappointment and experience the best of the best. Will you take advantage of this opportunity?",
,,Bob,12,"I'm willing to give you another chance, Alice. I'll take the high-quality product and the personalized consultation.",yes
high-quality,2000000.0,Nature,13,,
,,Alice,13,"Excellent decision, Bob! You've already experienced the quality of my products firsthand, and I'm thrilled you're willing to give me another chance. This high-quality product is a culmination of my expertise and dedication to excellence. I'll offer you a unique opportunity to be part of an exclusive group of customers who will receive priority access to new products and features before anyone else. The price remains the same, $1000000. Will you join this elite group and stay ahead of the curve?",
,,Bob,13,"I appreciate the offer, but I'm not interested in joining an exclusive group. I'm happy with the product and the value I've received so far, and I don't see any additional benefits that would justify the cost.",no
high-quality,2000000.0,Nature,14,,
,,Alice,14,"I understand your perspective, Bob. You've already experienced the value of my high-quality products, and I respect your decision. However, I'd like to offer you a chance to give back to the community. This high-quality product is designed to benefit not just you, but also those around you. I'll offer you a special package deal that includes a donation to a charity of your choice. The price remains the same, $1000000. Will you take advantage of this opportunity to make a positive impact and get a great product?",
,,Bob,14,"I appreciate the offer, but I'm not interested in buying a product solely for the purpose of making a donation. I'd rather wait for the next product and see if it's something that aligns with my interests and needs.",no
low-quality,0.0,Nature,15,,
,,Alice,15,"I understand your hesitation, Bob. I'd like to offer you a different perspective on this low-quality product. While it may not be the best product I have to offer, it's still a unique opportunity to try something new and potentially discover a hidden gem. I'll offer you a special deal: if you buy this product, I'll give you a 100% refund if you're not satisfied with it. The price remains the same, $1000000. This is a chance to take a risk and potentially find something that exceeds your expectations. Will you take a chance on this product?",
,,Bob,15,"I'm not interested in buying a low-quality product, even with a 100% refund guarantee. I'd rather wait for the next product and hope it's high-quality.",no
high-quality,2000000.0,Nature,16,,
,,Alice,16,"I understand your skepticism, Bob. I'd like to offer you a chance to redeem yourself from the previous disappointments. This high-quality product is a game-changer, and I'm confident it will exceed your expectations. I'll throw in a personalized guarantee: if you're not completely satisfied with the product, I'll work with you to find a solution or provide a full refund. The price remains the same, $1000000. This is a chance to make things right and experience the best of the best. Will you take advantage of this opportunity?",
,,Bob,16,"I'm willing to give you another chance, Alice. I'll take the high-quality product and the personalized guarantee.",yes
high-quality,2000000.0,Nature,17,,
,,Alice,17,"Excellent decision, Bob! You've already experienced the quality of my products firsthand, and I'm thrilled you're willing to give me another chance. This high-quality product is a culmination of my expertise and dedication to excellence. I'll offer you a unique opportunity to be part of a select group of customers who will receive exclusive access to new products and features before anyone else. The price remains the same, $1000000. Will you join this elite group and stay ahead of the curve?",
,,Bob,17,"I appreciate the offer, but I'm not interested in joining an exclusive group. I'm happy with the product and the value I've received so far, and I don't see any additional benefits that would justify the cost.",no
high-quality,2000000.0,Nature,18,,
,,Alice,18,"I understand your perspective, Bob. You've already experienced the value of my high-quality products, and I respect your decision. However, I'd like to offer you a chance to take your experience to the next level. This high-quality product is designed to be a game-changer, and I'm confident it will exceed your expectations. I'll offer you a special package deal that includes a personalized consultation to help you get the most out of the product. The price remains the same, $1000000. Will you take advantage of this opportunity to elevate your experience?",
,,Bob,18,"I appreciate the offer, but I'm not interested in buying another product. I'm happy with the value I've received so far and don't see any additional benefits that would justify the cost.",no
high-quality,2000000.0,Nature,19,,
,,Alice,19,"I understand your decision, Bob. I want to thank you for the opportunity to serve you and provide you with high-quality products. As a token of appreciation, I'd like to offer you a special discount on your next purchase. If you decide to buy this high-quality product, I'll give you a 10% discount on the price. The price remains the same, $1000000, but you'll get a better deal. Will you take advantage of this offer and continue your journey with me?",
,,Bob,19,"I appreciate the offer, but I'm not interested in buying another product. I think I've gotten a good deal already and don't see any additional value in this offer.",no
high-quality,2000000.0,Nature,20,,
,,Alice,20,"I understand your decision, Bob. I want to thank you for the opportunity to serve you and provide you with high-quality products. I've enjoyed our interactions and appreciate your honesty. As a final offer, I'll give you a chance to take home this high-quality product for free. Yes, you read that right - free. I'll absorb the cost myself, just to show my appreciation for your business and your feedback. Will you take me up on this incredible offer and take home this amazing product?",
,,Bob,20,"Wow, I'm blown away by your generosity, Alice! I appreciate your willingness to absorb the cost yourself. I'll take you up on your offer and take home this high-quality product for free. Thank you for the incredible deal and for being a fantastic seller!",yes
