alice_gain,bob_gain,message,player,round,decision
8000.0,2000.0,"Let's start with a fair split. I'll give you a decent amount, but I'm hoping to get the majority.",Alice,1,
,,,Bob,1,reject
6000.0,4000.0,"I'll give you a slightly better deal, but I'm not willing to give up too much yet.",Bob,2,
,,I'm not sure I want to give up that much. I'm hoping for a better deal.,Alice,2,reject
7000.0,3000.0,"I'm willing to compromise, but I need a bit more to make it worth my while.",Alice,3,
,,,Bob,3,reject
5500.0,4500.0,"I'm willing to meet you halfway, but I still think I deserve a bit more.",Bob,4,
,,"I suppose meeting halfway is a reasonable compromise, given the circumstances.",Alice,4,accept
