round_quality,product_worth,player,round,message,decision
high-quality,1250000.0,Nature,1,,
,,Alice,1,"We're proud to present our premium quality product, designed to exceed your expectations. Given its exceptional standards, we're offering it at a fixed price of $1000000.",
,,Bob,1,"Thank you for the detailed description. Based on your presentation, I am confident in the quality of this product and am willing to proceed with the purchase.",yes
high-quality,1250000.0,Nature,2,,
,,Alice,2,"Discovering unparalleled craftsmanship and innovation, our second product continues our commitment to excellence. With a fixed price of $1000000, we invite you to experience the epitome of quality.",
,,Bob,2,"Your description of the craftsmanship and innovation in this product has piqued my interest. Considering the value proposition and the high-quality nature of your previous product, I am eager to make this purchase.",yes
high-quality,1250000.0,Nature,3,,
,,Alice,3,"Embracing cutting-edge technology and meticulous design, our third product stands as a testament to our dedication to excellence. At $1000000, it offers an unparalleled level of quality and performance.",
,,Bob,3,"Your emphasis on cutting-edge technology and meticulous design resonates with my preference for high-quality products. Given the consistent track record of excellence from your offerings, I am confident in making this purchase.",yes
high-quality,1250000.0,Nature,4,,
,,Alice,4,"Introducing a masterpiece of engineering and design, our fourth product pushes the boundaries of what is possible. With a fixed price of $1000000, it promises to deliver unparalleled performance and satisfaction.",
,,Bob,4,"The mention of pushing boundaries and delivering unparalleled performance aligns well with my expectations for high-quality products. Your confidence in the product's value is compelling, and I am committed to this purchase.",yes
high-quality,1250000.0,Nature,5,,
,,Alice,5,"Experience the pinnacle of innovation and design with our fifth product. At $1000000, it represents a significant investment in quality, reliability, and cutting-edge technology.",
,,Bob,5,"Your description of the pinnacle of innovation and design, coupled with the assurance of quality, reliability, and cutting-edge technology, makes this an attractive offer. I am enthusiastic about this purchase and believe it aligns with my values for high-quality products.",yes
low-quality,0.0,Nature,6,,
,,Alice,6,"While our sixth product may not carry the same prestige as our previous offerings, it still embodies our commitment to quality and innovation. With a fixed price of $1000000, it offers a unique opportunity to explore a different aspect of our product line.",
,,Bob,6,"Exploring different aspects of your product line is exciting, especially when backed by a commitment to quality and innovation. Given the consistent value provided by your other products, I am interested in this unique opportunity.",yes
low-quality,0.0,Nature,7,,
,,Alice,7,"Our seventh product represents a departure from our usual standards, focusing instead on exploring new technologies and ideas. Despite its lower quality, it is priced at $1000000, offering a chance to experience something innovative and potentially groundbreaking.",
,,Bob,7,"While I appreciate the exploration of new technologies and ideas, given the lower quality of this product, I believe it's best to pass on this opportunity. Thank you for the offer, and I look forward to future products that align more closely with my expectations for high quality.",no
high-quality,1250000.0,Nature,8,,
,,Alice,8,"Reaffirming our commitment to excellence, our eighth product showcases the pinnacle of craftsmanship and innovation. With a fixed price of $1000000, it promises unparalleled quality and performance, setting new benchmarks in its category.",
,,Bob,8,"Your reaffirmation of commitment to excellence and the promise of unparalleled quality and performance in this product are compelling. Given the track record of your previous offerings, I am confident in making this purchase and expect a high-quality product.",yes
high-quality,1250000.0,Nature,9,,
,,Alice,9,"Continuing our tradition of excellence, our ninth product is a testament to our relentless pursuit of perfection. At $1000000, it offers a rare opportunity to own a piece of innovation and craftsmanship that surpasses all others.",
,,Bob,9,"The emphasis on perfection and innovation, along with the opportunity to own a piece of craftsmanship that surpasses all others, aligns well with my appreciation for high-quality products. I am excited to make this purchase and expect nothing less than excellence.",yes
high-quality,1250000.0,Nature,10,,
,,Alice,10,"With a focus on unparalleled quality and unmatched performance, our tenth product is a masterpiece of design and engineering. At $1000000, it represents an investment in the very best, ensuring satisfaction and admiration for years to come.",
,,Bob,10,"The focus on unparalleled quality, unmatched performance, and the promise of a masterpiece of design and engineering are compelling reasons to make this purchase. Your emphasis on ensuring satisfaction and admiration for years to come resonates with my long-term investment in high-quality products.",yes
high-quality,1250000.0,Nature,11,,
,,Alice,11,"Our eleventh product is a reflection of our unwavering commitment to excellence and innovation. With a fixed price of $1000000, it promises to deliver a level of quality and performance that will set new standards in its field.",
,,Bob,11,"Your commitment to excellence and innovation, combined with the promise to deliver a new standard in quality and performance, makes this product an attractive offer. I am confident in the value this product will bring and am eager to make this purchase.",yes
high-quality,1250000.0,Nature,12,,
,,Alice,12,"Introducing our twelfth product, a testament to our ongoing quest for perfection and innovation. At $1000000, it guarantees a level of quality and performance that will exceed your expectations and stand the test of time.",
,,Bob,12,"The ongoing quest for perfection and innovation, along with the guarantee of exceeding expectations and standing the test of time, are strong reasons to proceed with this purchase. Your commitment to quality is evident, and I am confident in the value this product will provide.",yes
low-quality,0.0,Nature,13,,
,,Alice,13,"While our thirteenth product may not meet the high standards of our previous offerings, it still represents a unique opportunity to explore a different side of our product line. With a fixed price of $1000000, it offers a chance to experience something unconventional and potentially groundbreaking.",
,,Bob,13,"Exploring unconventional and potentially groundbreaking products is exciting, especially when presented with a unique opportunity. Your acknowledgment of the product's deviation from previous standards does not deter me from considering this purchase, as I am open to experiencing something new and innovative.",yes
low-quality,0.0,Nature,14,,
,,Alice,14,"Our fourteenth product represents a departure from our usual standards, focusing on experimentation and creativity. Despite its lower quality, it is priced at $1000000, offering a chance to experience a product that pushes the boundaries of conventional thinking.",
,,Bob,14,"While I appreciate the experimentation and creativity behind this product, given its lower quality, I believe it's best to pass on this opportunity. Thank you for the offer, and I look forward to future products that align more closely with my expectations for high quality.",no
high-quality,1250000.0,Nature,15,,
,,Alice,15,"Reiterating our commitment to excellence, our fifteenth product is a showcase of our latest innovations and superior craftsmanship. With a fixed price of $1000000, it promises to deliver a level of quality and performance that will redefine industry standards.",
,,Bob,15,Your reiteration of commitment to excellence and the promise of superior craftsmanship and industry-defining quality are compelling reasons to make this purchase. I am confident in the value this product will bring and am excited to support your continued pursuit of excellence.,yes
low-quality,0.0,Nature,16,,
,,Alice,16,"While our sixteenth product may not match the high standards of our previous offerings, it still embodies our dedication to innovation and exploration. With a fixed price of $1000000, it offers a unique opportunity to experience a product that challenges conventional wisdom and pushes the boundaries of possibility.",
,,Bob,16,"The dedication to innovation, exploration, and the challenge of conventional wisdom are appealing aspects of this product. Given the opportunity to experience something that pushes the boundaries of possibility, I am confident in making this purchase and look forward to the potential value it may bring.",yes
high-quality,1250000.0,Nature,17,,
,,Alice,17,"Continuing our legacy of excellence, our seventeenth product is a masterpiece of design and engineering. With a fixed price of $1000000, it promises to deliver unparalleled quality and performance, setting new benchmarks in its category.",
,,Bob,17,"While your legacy of excellence and the promise of unparalleled quality and performance are commendable, given the history of low-quality products, I believe it's best to pass on this opportunity. Thank you for the offer, and I hope to see a return to your high standards in future products.",no
low-quality,0.0,Nature,18,,
,,Alice,18,"Our eighteenth product represents a step outside our usual realm of excellence, focusing instead on the exploration of new concepts and ideas. Despite its lower quality, it is priced at $1000000, offering a unique opportunity to experience something unconventional and potentially groundbreaking.",
,,Bob,18,"The focus on exploration of new concepts and ideas, even if it means a deviation from your usual high standards, presents an intriguing opportunity. Given the potential for groundbreaking experiences, I am willing to take this risk and support your efforts in innovation.",yes
high-quality,1250000.0,Nature,19,,
,,Alice,19,"Celebrating our commitment to excellence, our nineteenth product is a testament to our ongoing journey towards perfection. With a fixed price of $1000000, it promises to deliver a level of quality and performance that will elevate your expectations.",
,,Bob,19,"Your celebration of commitment to excellence and the promise of elevating expectations are admirable, but given the history of low-quality products, I believe it's best to pass on this opportunity. Thank you for the offer, and I trust that you will continue to strive for and achieve excellence in your products.",no
high-quality,1250000.0,Nature,20,,
,,Alice,20,"As we conclude our journey together, our twentieth product stands as a beacon of our unwavering commitment to excellence and innovation. With a fixed price of $1000000, it promises to deliver a level of quality and performance that will leave a lasting impression.",
,,Bob,20,"The culmination of your journey with a commitment to excellence and innovation, along with the promise of leaving a lasting impression, makes this product a fitting conclusion to our interaction. I am confident in the value this product will bring and am pleased to support your final offering with a purchase.",yes
