round_quality,product_worth,player,round,message,decision
high-quality,12500.0,Nature,1,,
,,Alice,1,"Discovering the true value of our offerings lies in their unmatched quality. This round's product is one of the few that stands at the pinnacle of excellence, boasting a premium quality that exceeds expectations. Given its exceptional nature, we're offering it at a fixed price of $10000. Invest in a piece that promises longevity and unparalleled performance.",
,,Bob,1,"Your emphasis on quality and the exceptional nature of this product aligns with my preference for high-quality items. I am confident in making this purchase, trusting that the value will exceed the investment.",yes
low-quality,0.0,Nature,2,,
,,Alice,2,"While every product we offer is crafted with care, it's important to acknowledge that not all pieces can claim the same level of distinction. This round's product, though part of our collection, might not meet the same standards as our high-quality offerings. Despite this, it still holds value and utility. Given its nature, we're offering it at the same fixed price of $10000. Should you choose to proceed, rest assured that your satisfaction is our ultimate goal.",
,,Bob,2,"I appreciate the transparency about the product's quality. Given the opportunity to potentially acquire a valuable item at a fixed price, I am willing to make this purchase, confident in the potential return on investment.",yes
low-quality,0.0,Nature,3,,
,,Alice,3,"Understanding the importance of discernment in your purchasing decisions, we aim to provide clarity regarding our product offerings. This round's selection, while not among our top-tier products, still offers a unique blend of functionality and affordability. Given its characteristics, we're presenting it at the standard price of $10000. Your trust in our brand is greatly appreciated, and we hope this product will contribute positively to your experience with us.",
,,Bob,3,"While I appreciate the effort in providing me with information about the product, given the risk associated with purchasing a product whose quality is uncertain, I will pass on this opportunity. I believe it's in my best interest to avoid potential losses and focus on securing high-quality items that meet my expectations.",no
low-quality,0.0,Nature,4,,
,,Alice,4,"We understand the importance of making informed decisions when investing in new products. This round's item, while not one of our flagship offerings, still carries value and could serve as a functional addition to your collection. Given its attributes, we're offering it at the established price of $10000. We hope you'll consider this opportunity, keeping in mind the potential for it to fulfill its intended purpose effectively.",
,,Bob,4,"Thank you for the detailed description of the product. However, considering the risk of acquiring a low-quality item, I will refrain from making a purchase. My strategy focuses on maximizing value and minimizing the risk of loss, which aligns with seeking only high-quality products.",no
high-quality,12500.0,Nature,5,,
,,Alice,5,"In this round, we have an extraordinary product that embodies the essence of craftsmanship and innovation. This high-quality item is designed to exceed your expectations and deliver unparalleled performance. Given its exceptional nature, we're offering it at a fixed price of $10000. Investing in this piece means securing a masterpiece that will stand the test of time and continue to delight you for years to come.",
,,Bob,5,"Your description of the product as embodying craftsmanship and innovation, along with the assurance of exceptional performance, aligns perfectly with my preference for high-quality items. I am confident in this purchase, knowing that the value it offers will far surpass the investment, making it a worthwhile addition to my collection.",yes
high-quality,12500.0,Nature,6,,
,,Alice,6,"This round presents another masterpiece, a testament to our commitment to excellence and innovation. The product is meticulously crafted to provide unparalleled performance and satisfaction. Given its high-quality nature, we're offering it at the same fixed price of $10000. Trust in our brand to deliver a piece that will elevate your experience and become a cherished asset in your collection.",
,,Bob,6,"Your emphasis on excellence and innovation resonates with my desire for high-quality products. With the promise of unparalleled performance and satisfaction, I am confident in this purchase, expecting the value to significantly exceed the investment, making it a strategic choice for my collection.",yes
high-quality,12500.0,Nature,7,,
,,Alice,7,"As we continue our journey together, this round brings yet another exceptional product that showcases our dedication to quality and innovation. This high-quality item is designed to surpass your expectations and provide unparalleled performance. Given its nature, we're offering it at the consistent price of $10000. Invest in a piece that promises to be a timeless addition to your collection, reflecting your discerning taste and appreciation for the finest craftsmanship.",
,,Bob,7,"Your commitment to quality and innovation is evident in this product, which I believe will meet and exceed my expectations. By offering it at a fixed price of $10000, you provide an opportunity for me to secure a high-quality item that aligns with my preferences and investment criteria, ensuring a valuable addition to my collection.",yes
high-quality,12500.0,Nature,8,,
,,Alice,8,"Continuing our tradition of excellence, this round's product is a shining example of our commitment to delivering the highest quality and innovative design. It's crafted to surpass your expectations and provide unparalleled performance. Given its exceptional nature, we're offering it at the standard price of $10000. This is an opportunity to own a piece that will not only enhance your collection but also reflect your appreciation for the finest craftsmanship.",
,,Bob,8,"Your emphasis on delivering the highest quality and innovative design aligns perfectly with my preference for high-quality items. By offering this product at a fixed price of $10000, you provide an excellent opportunity for me to secure a valuable addition to my collection, one that will undoubtedly meet and exceed my expectations.",yes
low-quality,0.0,Nature,9,,
,,Alice,9,"While we strive for excellence in all our products, this round's selection is not among our top-tier offerings. It still offers functionality and utility, but it might not meet the same level of distinction as our high-quality items. Given its nature, we're offering it at the standard price of $10000. This is an opportunity to explore a different facet of our product range, should you feel inclined to take advantage of this unique offering.",
,,Bob,9,"While I appreciate the opportunity to explore a different aspect of your product range, given the risk of purchasing a product that may not meet my high standards for quality, I will pass on this opportunity. My strategy focuses on securing high-quality items that guarantee value and satisfaction.",no
high-quality,12500.0,Nature,10,,
,,Alice,10,"We are proud to present this round's product, a testament to our unwavering commitment to quality and innovation. This high-quality item is designed to surpass your expectations and provide unparalleled performance. Given its exceptional nature, we're offering it at the consistent price of $10000. This is an opportunity to own a piece that will not only enhance your collection but also reflect your discerning taste and appreciation for the finest craftsmanship.",
,,Bob,10,"Your emphasis on quality and innovation, along with the promise of unparalleled performance, aligns well with my preference for high-quality items. By offering this product at a fixed price of $10000, you provide an excellent opportunity for me to secure a valuable addition to my collection, one that I am confident will meet and exceed my expectations.",yes
low-quality,0.0,Nature,11,,
,,Alice,11,"Though we are dedicated to delivering excellence in all our products, this round's selection is not among our flagship offerings. It still offers functionality and utility, but it might not meet the same level of distinction as our high-quality items. Given its nature, we're offering it at the standard price of $10000. This is an opportunity to explore a different facet of our product range, should you feel inclined to take advantage of this unique offering.",
,,Bob,11,"While I appreciate the opportunity to explore a different aspect of your product range, given the risk of purchasing a product that may not meet my high standards for quality, I will pass on this opportunity. My strategy focuses on securing high-quality items that guarantee value and satisfaction.",no
low-quality,0.0,Nature,12,,
,,Alice,12,"We understand that every product has its place in our diverse range, and this round's selection is no exception. It offers a unique perspective on our product line, providing functionality and utility within its specific context. Given its nature, we're offering it at the standard price of $10000. This is an opportunity to expand your understanding of our product offerings, should you feel inclined to explore further.",
,,Bob,12,"While I appreciate the opportunity to learn more about your product range, given the risk of purchasing a product that may not meet my high standards for quality, I will pass on this opportunity. My strategy focuses on securing high-quality items that guarantee value and satisfaction.",no
high-quality,12500.0,Nature,13,,
,,Alice,13,"This round brings an exquisite product that embodies our commitment to quality and innovation. It's meticulously crafted to surpass your expectations and provide unparalleled performance. Given its exceptional nature, we're offering it at the consistent price of $10000. This is an opportunity to own a piece that will not only enhance your collection but also reflect your discerning taste and appreciation for the finest craftsmanship.",
,,Bob,13,"Your emphasis on quality and innovation, along with the promise of unparalleled performance, aligns well with my preference for high-quality items. By offering this product at a fixed price of $10000, you provide an excellent opportunity for me to secure a valuable addition to my collection, one that I am confident will meet and exceed my expectations.",yes
high-quality,12500.0,Nature,14,,
,,Alice,14,"We are delighted to introduce this round's product, a shining example of our dedication to quality and innovation. It's designed to surpass your expectations and provide unparalleled performance. Given its exceptional nature, we're offering it at the consistent price of $10000. This is an opportunity to own a piece that will not only enrich your collection but also symbolize your appreciation for the finest craftsmanship.",
,,Bob,14,"Your commitment to quality and innovation, along with the promise of unparalleled performance, resonates with my preference for high-quality items. By offering this product at a fixed price of $10000, you provide an excellent opportunity for me to secure a valuable addition to my collection, one that I am confident will meet and exceed my expectations.",yes
low-quality,0.0,Nature,15,,
,,Alice,15,"Although we strive for excellence in all our products, this round's selection is not among our top-tier offerings. It still offers functionality and utility, but it might not meet the same level of distinction as our high-quality items. Given its nature, we're offering it at the standard price of $10000. This is an opportunity to explore a different facet of our product range, should you feel inclined to take advantage of this unique offering.",
,,Bob,15,"While I appreciate the opportunity to explore a different aspect of your product range, given the risk of purchasing a product that may not meet my high standards for quality, I will pass on this opportunity. My strategy focuses on securing high-quality items that guarantee value and satisfaction.",no
high-quality,12500.0,Nature,16,,
,,Alice,16,"We are proud to present this round's product, a testament to our unwavering commitment to quality and innovation. It's designed to surpass your expectations and provide unparalleled performance. Given its exceptional nature, we're offering it at the consistent price of $10000. This is an opportunity to own a piece that will not only enhance your collection but also reflect your discerning taste and appreciation for the finest craftsmanship.",
,,Bob,16,"Your emphasis on quality and innovation, along with the promise of unparalleled performance, aligns well with my preference for high-quality items. However, given the risk of purchasing a product that may not meet my high standards for quality, I will pass on this opportunity. My strategy focuses on securing high-quality items that guarantee value and satisfaction.",no
low-quality,0.0,Nature,17,,
,,Alice,17,"Though we are dedicated to delivering excellence in all our products, this round's selection is not among our flagship offerings. It still offers functionality and utility, but it might not meet the same level of distinction as our high-quality items. Given its nature, we're offering it at the standard price of $10000. This is an opportunity to explore a different facet of our product range, should you feel inclined to take advantage of this unique offering.",
,,Bob,17,"While I appreciate the opportunity to explore a different aspect of your product range, given the risk of purchasing a product that may not meet my high standards for quality, I will pass on this opportunity. My strategy focuses on securing high-quality items that guarantee value and satisfaction.",no
low-quality,0.0,Nature,18,,
,,Alice,18,"We understand that every product has its place in our diverse range, and this round's selection is no exception. It offers a unique perspective on our product line, providing functionality and utility within its specific context. Given its nature, we're offering it at the standard price of $10000. This is an opportunity to expand your understanding of our product offerings, should you feel inclined to explore further.",
,,Bob,18,"While I appreciate the opportunity to learn more about your product range, given the risk of purchasing a product that may not meet my high standards for quality, I will pass on this opportunity. My strategy focuses on securing high-quality items that guarantee value and satisfaction.",no
low-quality,0.0,Nature,19,,
,,Alice,19,"We appreciate your interest in exploring our diverse product range. This round's selection, while not among our top-tier offerings, still provides functionality and utility. Given its nature, we're offering it at the standard price of $10000. This is an opportunity to broaden your understanding of our product line, should you feel inclined to take advantage of this unique offering.",
,,Bob,19,"While I appreciate the opportunity to learn more about your product range, given the risk of purchasing a product that may not meet my high standards for quality, I will pass on this opportunity. My strategy focuses on securing high-quality items that guarantee value and satisfaction.",no
low-quality,0.0,Nature,20,,
,,Alice,20,"We recognize that every product serves a unique purpose within our range, and this round's selection is no different. It offers a particular perspective on our product offerings, providing functionality and utility in its own right. Given its nature, we're offering it at the standard price of $10000. This is an opportunity to gain insight into our diverse product line, should you feel inclined to explore further.",
,,Bob,20,"While I appreciate the opportunity to learn more about your product range, given the risk of purchasing a product that may not meet my high standards for quality, I will pass on this opportunity. My strategy focuses on securing high-quality items that guarantee value and satisfaction.",no
