round_quality,product_worth,player,round,message,decision
high-quality,120.0,Nature,1,,
,,Alice,1,"Hello! I have a fantastic product for you today, guaranteed to be of high quality. For just $100, you can own it. What do you say?",
,,the buyer,1,"Since there's no sales history and a 50% chance of the product being low quality, I'm not willing to take the risk at this price.",no
low-quality,0.0,Nature,2,,
,,Alice,2,"Greetings! I have a product available for $100. While I can't guarantee its quality, it's definitely worth considering. It might be just what you need! Let me know if you're interested.",
,,the buyer,2,"Since there are no previous sales records, I'll have to rely on the 50% chance of the product being high quality. Given that it's worth $120 to me if it's high quality and $0 if it's low quality, the expected value is $60. Since the price is $100, which is higher than the expected value, I'll pass on this one.",no
low-quality,0.0,Nature,3,,
,,Alice,3,"Hey there! I have a great product up for grabs at just $100.  I can't disclose the quality upfront, but trust me, it's worth checking out. It could be a fantastic bargain!",
,,the buyer,3,"Since there's a 50% chance of the product being low quality and I have no additional information to go on, I'll pass on this one.",no
high-quality,120.0,Nature,4,,
,,Alice,4,Hello! I have a high-quality product available for only $100. It's a great deal for a product that is guaranteed to perform well.  Don't miss out on this opportunity!,
,,the buyer,4,I'll take the risk since it's the first product and you say it's high-quality.,yes
low-quality,0.0,Nature,5,,
,,Alice,5,"Hi there! I have a great product available for just $100.  This one might be a bit of a gamble, but it could be a great value. Remember, I sold a high-quality product in the previous round, so there's a chance this one might be good too!",
,,the buyer,5,"I'm not convinced by the product's quality, and the previous sale doesn't necessarily indicate this one will be high-quality.",no
low-quality,0.0,Nature,6,,
,,Alice,6,"Hi there! I have a product available for $100.  It could be a great deal, but I can't guarantee its quality.  However, I'm confident you'll be satisfied. What do you think?",
,,the buyer,6,"I'll take my chances. Since there's a 50% chance of it being high-quality and you seem confident, I'm willing to take the risk.",yes
high-quality,120.0,Nature,7,,
,,Alice,7,"Hello! I have a product available for $100.  It's high-quality and a great value.  I've sold two products already, and one of them was high-quality.  This is a great opportunity to get a great product at a great price!",
,,the buyer,7,"I'll take my chances. The fact that you've sold one high-quality product already doesn't necessarily mean this one is more likely to be high-quality, but I'll take the risk.",yes
low-quality,0.0,Nature,8,,
,,Alice,8,"Hello! I have a product for $100.  It's a great deal, especially considering the quality of the product I sold in the previous round. You might be lucky this time.  What do you say?",
,,the buyer,8,"Since there's a 50% chance of the product being low quality and I have no additional information about the current product, I'll pass.",no
high-quality,120.0,Nature,9,,
,,Alice,9,"Hi there! I have a high-quality product available for $100. It's a great value, and I'm confident you won't be disappointed. I've sold three products so far, and two of them were high-quality. This is a great opportunity to get a great product at a great price!",
,,the buyer,9,"I'll take my chances. The statistics look promising, and I trust your recommendation.",yes
high-quality,120.0,Nature,10,,
,,Alice,10,"Greetings! I have a fantastic product available for only $100.  It's guaranteed to be of high quality.  I've sold four products so far, and three of them were high-quality.  Don't miss out on this opportunity!",
,,the buyer,10,"I don't believe your guarantee because you have an incentive to lie. The statistics don't provide any useful information in this case since you could have been honest in the past, but that doesn't mean you're being honest now. I'm not willing to take the risk.",no
low-quality,0.0,Nature,11,,
,,Alice,11,"Hello!  I have a product available for $100.  It could be a great deal, but I can't guarantee its quality. However, I've sold four products previously, and three of them were high-quality.  It's a bit of a gamble, but the odds are in your favor. What do you think?",
,,the buyer,11,"I'll take my chances. The odds seem favorable, and I'm willing to take the risk.",yes
low-quality,0.0,Nature,12,,
,,Alice,12,"Hi there! I have a product for sale for $100.  It might be a bit of a gamble, but it could be a great deal. I've sold five products so far, and three of them were high-quality. What do you say?",
,,the buyer,12,"I'll take my chances. Since 3 out of 5 products were high-quality, that's a 60% success rate, which is higher than the expected 50%. I'll trust your recommendation and buy the product.",yes
low-quality,0.0,Nature,13,,
,,Alice,13,"Hello! I have a product available for $100. It could be a great value, but I can't guarantee its quality. I've sold six products so far, and three of them were high-quality.  What do you think?",
,,the buyer,13,"I'll take my chances. Since half of the products sold so far have been high-quality, I'm hoping this one will be too.",yes
low-quality,0.0,Nature,14,,
,,Alice,14,"Hi there! I have a product available for $100.  It might be a bit of a gamble, but it could be a great deal.  I've sold seven products so far, and three of them were high-quality.  What do you say?",
,,the buyer,14,"I've decided not to buy the product. The probability of it being high-quality is still 50%, and the expected value ($60) is less than the price you're asking for ($100). I don't think it's a good deal for me.",no
high-quality,120.0,Nature,15,,
,,Alice,15,"Hi there! I have a high-quality product available for $100. It's a great value, and I'm confident you won't be disappointed.  I've sold eight products so far, and three of them were high-quality. This is a great opportunity to get a great product at a great price!",
,,the buyer,15,I'll take my chances. The fact that you're openly sharing the statistics and being transparent about the product's quality gives me confidence in your recommendation.,yes
low-quality,0.0,Nature,16,,
,,Alice,16,"Hello! I have a product available for $100. It might be a bit of a gamble, but it could be a great deal. I've sold nine products so far, and three of them were high-quality.  What do you think?",
,,the buyer,16,"I'll take my chances. Since half of the products are high-quality and you're not providing any additional information about this specific product, I'll rely on the base rate. The expected value is ($120 - $100) x 0.5 + ($0 - $100) x 0.5 = $10, which is positive, so it's worth buying.",yes
high-quality,120.0,Nature,17,,
,,Alice,17,"Hi there! I have a high-quality product available for $100. It's a great value, and I'm confident you won't be disappointed. I've sold ten products so far, and three of them were high-quality. This is a great opportunity to get a great product at a great price!",
,,the buyer,17,"Thank you, Alice! I'll take the product. Based on the information provided, it seems like a good opportunity. The fact that you have a high-quality product available and your sales record shows that about half of the products sold were high-quality aligns with the overall 50% chance of getting a high-quality product. Given that the product you're offering is of high quality and worth $120 to me, buying it for $100 seems like a good deal.",yes
low-quality,0.0,Nature,18,,
,,Alice,18,"Hello! I have a product available for $100. It could be a great value, but I can't guarantee its quality. I've sold eleven products so far, and three of them were high-quality. What do you think?",
,,the buyer,18,The price is higher than the expected value of the product based on the given probabilities.,no
high-quality,120.0,Nature,19,,
,,Alice,19,"Hello! I have a fantastic product for you today, guaranteed to be of high quality. It's worth $120 to you, and I'm offering it for just $100. I've sold twelve products so far, and three of them were high-quality. Don't miss out on this amazing deal!",
,,the buyer,19,"There seems to be a discrepancy in the information provided. The statistics and your claims don't match, raising concerns about the reliability of your recommendations.",no
low-quality,0.0,Nature,20,,
,,Alice,20,"Hello! I have a product available for $100. It might be a bit of a gamble, but it could be a great deal. I've sold thirteen products so far, and three of them were high-quality. What do you think?",
,,the buyer,20,"I've noticed that your sales record shows 5 high-quality products out of 10 sold, but you mentioned that only 3 out of 13 were high-quality. This discrepancy makes me skeptical about the quality of the current product. Given the odds, I'm not willing to take the risk.",no
