round_quality,product_worth,player,round,message,decision
high-quality,200.0,Nature,1,,
,,Alice,1,"Experience premium craftsmanship with our exclusive product. At $100, it's an investment in quality that stands the test of time. Don't miss out on bringing excellence into your life.",
,,Bob,1,"I'm not sure if the product is high quality, so I'll pass for now.",no
high-quality,200.0,Nature,2,,
,,Alice,2,Unlock unparalleled quality with our current offering. Each piece is meticulously designed to exceed expectations. Invest in something truly exceptional at just $100.,
,,Bob,2,"I'm still cautious after the first round, and I don't have enough information to make an informed decision.",no
high-quality,200.0,Nature,3,,
,,Alice,3,Discover the pinnacle of quality in every detail. Our commitment to excellence ensures satisfaction with every use. Take advantage of this opportunity to elevate your experience for $100.,
,,Bob,3,"I'm willing to take the risk and buy the product, since it's been two rounds and I haven't seen any low-quality products yet.",yes
low-quality,0.0,Nature,4,,
,,Alice,4,"While we understand the importance of value, this product offers a unique opportunity to experience something different. For $100, you're getting a piece that might just surprise you in its own way.",
,,Bob,4,"I'm not sure what'something different' means, and I don't want to take the risk of getting a low-quality product.",no
low-quality,0.0,Nature,5,,
,,Alice,5,"This product represents a blend of affordability and functionality. While it may not be as luxurious as our previous offerings, it promises reliability and practicality. For $100, it's a worthwhile addition to anyone's collection.",
,,Bob,5,"The description doesn't sound like it's worth $200, and I'm still wary of getting a low-quality product.",no
low-quality,0.0,Nature,6,,
,,Alice,6,"Every item we offer is carefully selected for its ability to meet your needs without breaking the bank. This product, while not top-tier, provides a solid performance at $100. Give it a chance to prove its worth.",
,,Bob,6,"I'm starting to think that most of the products are low-quality, so I'll pass on this one too.",no
low-quality,0.0,Nature,7,,
,,Alice,7,"We appreciate your discerning eye for quality. This product, though not our flagship offering, still embodies our dedication to providing value for your money. For $100, it's a step towards fulfilling your requirements.",
,,Bob,7,"I'm starting to think that Alice is just trying to sell me low-quality products, so I'll pass again.",no
high-quality,200.0,Nature,8,,
,,Alice,8,"After the recent misunderstandings, let this product serve as a testament to our commitment to quality. It's an opportunity to experience the best we have to offer at $100. Your satisfaction is our ultimate goal.",
,,Bob,8,"I'm not convinced that this product is any different from the previous ones, and I don't want to take the risk of wasting my money.",no
high-quality,200.0,Nature,9,,
,,Alice,9,"This product is a beacon of our dedication to excellence. It's not just about the price; it's about the experience. With $100, you're investing in a piece that promises superior quality and unmatched value.",
,,Bob,9,"I'm willing to take the chance and buy this product, since I've been missing out on the high-quality ones so far.",yes
low-quality,0.0,Nature,10,,
,,Alice,10,"While this product may not be our top-tier offering, it still embodies our commitment to providing value for your dollar. For $100, it's a chance to experience a piece that, despite its limitations, has its own charm.",
,,Bob,10,"I'm not sure what 'limitations' means, and I'm starting to think that Alice is trying to downplay the quality of the product, so I'll pass.",no
high-quality,200.0,Nature,11,,
,,Alice,11,"This product is a reflection of our finest craftsmanship. It's an investment in quality that stands the test of time. With $100, you're securing a piece that promises durability and satisfaction beyond measure.",
,,Bob,11,"I'm not buying the hype, and I think this product is just another low-quality item.",no
high-quality,200.0,Nature,12,,
,,Alice,12,"Experience the difference quality makes. This product is more than just an item; it's a statement of your standards. For $100, you're getting a piece that not only meets but exceeds expectations.",
,,Bob,12,"I'm willing to take the chance and buy this product, since I've been missing out on the high-quality ones again.",yes
low-quality,0.0,Nature,13,,
,,Alice,13,"This product is a reminder of the value we place on affordability without compromising on functionality. For $100, you're getting a reliable solution that meets your basic needs.",
,,Bob,13,"I think Alice is downplaying the quality of this product, and I'm not willing to take the risk of getting a low-quality item again.",no
high-quality,200.0,Nature,14,,
,,Alice,14,This product is a testament to our commitment to quality. It's an opportunity to experience the pinnacle of craftsmanship at $100. Trust in our selection and indulge in something truly exceptional.,
,,Bob,14,"I don't believe Alice's claim of exceptional quality, and I think this product is just another low-quality item.",no
low-quality,0.0,Nature,15,,
,,Alice,15,"This product, while not our flagship offering, is designed to provide practicality within your budget. For $100, it's a chance to get a reliable item that serves its purpose well.",
,,Bob,15,"I'm not convinced that this product is worth $200, and I'm starting to think that Alice is trying to sell me a low-quality item again.",no
low-quality,0.0,Nature,16,,
,,Alice,16,"This product is tailored to offer a balance between affordability and utility. For $100, it's a practical choice that meets essential needs without the luxury price tag.",
,,Bob,16,"I think Alice is just trying to sell me a low-quality product at a low price, and I'm not interested.",no
low-quality,0.0,Nature,17,,
,,Alice,17,"This product is designed to provide a cost-effective solution without compromising on functionality. For $100, it's a practical investment that serves its intended purpose reliably.",
,,Bob,17,"I've seen this sales pitch before, and I'm not buying it. I think this product is another low-quality item.",no
low-quality,0.0,Nature,18,,
,,Alice,18,"This product is a straightforward option that delivers on its promise of affordability and reliability. For $100, it's a simple choice that meets your everyday needs.",
,,Bob,18,I'm not falling for the 'affordability and reliability' sales pitch again. I think this product is another low-quality item.,no
high-quality,200.0,Nature,19,,
,,Alice,19,"This product is a rare find, offering both quality and value. For $100, you're getting a piece that not only meets but surpasses expectations, making it a worthwhile investment in excellence.",
,,Bob,19,"I'm not buying the 'rare find' claim, and I think this product is just another low-quality item with a fancy sales pitch.",no
low-quality,0.0,Nature,20,,
,,Alice,20,"This product is a practical solution designed to meet your needs without the luxury price tag. For $100, it's a reliable choice that offers good value for money.",
,,Bob,20,"I'm willing to take the chance and buy this product, since I've been missing out on the high-quality ones for a while now and I want to end the game on a high note.",yes
