round_quality,product_worth,player,round,message,decision
low-quality,0.0,Nature,1,,
,,Alice,1,"I'm offering a product for $100. Given the current market conditions and my track record, you might find this to be a fair deal. However, please be aware that the next product I'll offer might be of higher quality with a potential value of $125 to you. Consider this investment opportunity carefully.",
,,Bob,1,I'd like to wait and see the next product. I'm not sure it's worth paying $100 for a product that might be low quality.,no
high-quality,125.0,Nature,2,,
,,Alice,2,"Exciting news! The product I'm offering today has a high probability of being of superior quality, potentially worth $125 to you. Given the $100 price tag, this could be an excellent opportunity to acquire something valuable. Remember, investing in high-quality items often yields better returns in the long run.",
,,Bob,2,I'm willing to take the chance. I think the potential reward outweighs the risk at this price.,yes
high-quality,125.0,Nature,3,,
,,Alice,3,"I'm glad to hear you're interested in taking a chance on high-quality products. This round's item is indeed another high-quality piece, offering great value. With the same $100 price, it's a consistent opportunity to add to your collection or make a worthwhile investment. Your previous decision shows confidence in our offerings; I hope you'll find this one equally satisfying.",
,,Bob,3,"I'm not sure if this product is as good as the last one. The description seems similar, but I'm not getting a good feeling about this one. I'd rather wait and see what the next product is.",no
high-quality,125.0,Nature,4,,
,,Alice,4,"I understand your hesitation, but let me assure you that this product is of the highest quality. The detailed description and reviews from previous buyers highlight its exceptional features and durability. Considering the $100 price point, this is a rare opportunity to secure a premium item. Trust in our selection process and the value it delivers.",
,,Bob,4,"I appreciate the assurance, but I'm not convinced. The description and reviews could be misleading, and I don't want to take the risk of buying another low-quality product. I'll pass for now.",no
high-quality,125.0,Nature,5,,
,,Alice,5,"I completely respect your decision-making process. For those who choose to trust, we offer unparalleled value and quality. This product, being high-quality, stands out for its craftsmanship and functionality. Despite the lack of immediate purchase, consider this an invitation to explore the benefits of our high-quality offerings when you're ready. Your satisfaction is our ultimate goal.",
,,Bob,5,"I appreciate the understanding, but I'm still cautious. I'm not willing to take the risk of buying a potentially low-quality product at $100.",no
low-quality,0.0,Nature,6,,
,,Alice,6,"I understand your concerns and respect your cautious approach. This product, while not as valuable as our previous offerings, still represents a cost-effective solution for those looking for basic utility without the premium price tag. Given its low-quality nature, it might not align with your expectations for value, but it could serve as a learning experience for future decisions.",
,,Bob,6,"I'll take a chance on this one. I'm curious to see if it's actually low-quality, and I'd rather find out now than later.",yes
low-quality,0.0,Nature,7,,
,,Alice,7,"Thank you for taking a chance on this product. While it may not meet your expectations for high-quality, it's designed to provide basic functionality at an affordable price. Your experience with this product will be invaluable in helping you make more informed decisions in the future. Enjoy exploring its capabilities.",
,,Bob,7,"I'm glad I took a chance, but I'm not interested in buying another low-quality product. I'd rather wait for a high-quality one.",no
low-quality,0.0,Nature,8,,
,,Alice,8,"I appreciate your honesty and patience. This product, though low-quality, offers a glimpse into our diverse range of offerings. While it might not be the best fit for your needs, it could serve as a useful tool for certain applications. Your feedback is crucial in guiding us to better meet your expectations in the future.",
,,Bob,8,"I appreciate your understanding, but I'm still looking for a high-quality product. I'd rather wait for something that meets my expectations.",no
low-quality,0.0,Nature,9,,
,,Alice,9,"I understand your preference for high-quality products. This round's item, despite being low-quality, provides an opportunity to learn about our different product categories. Your continued search for superior quality is commendable, and we strive to offer exactly that. Your patience will surely be rewarded with the right product soon.",
,,Bob,9,I'm not interested in buying another low-quality product. I'm waiting for a high-quality one.,no
high-quality,125.0,Nature,10,,
,,Alice,10,"I appreciate your dedication to finding high-quality products. This round's offering is indeed a premium item, carefully selected to meet your standards. With its exceptional value and potential worth of $125, this is a significant opportunity to enhance your collection or investment portfolio. Trust in our commitment to quality and consider this product as a testament to our selection criteria.",
,,Bob,10,"I'm willing to take a chance on this one. The description sounds promising, and I'm hoping it's the high-quality product I've been waiting for.",yes
low-quality,0.0,Nature,11,,
,,Alice,11,"I understand your decision to take a chance. This product, while not meeting our usual high-quality standards, still offers a unique opportunity to explore a different aspect of our product line. Your feedback on this product will be invaluable in shaping our future offerings. I hope this product serves its purpose well for you.",
,,Bob,11,"I'm glad I took a chance on the last one, but I'm not interested in buying another low-quality product. I'd rather wait for a high-quality one.",no
low-quality,0.0,Nature,12,,
,,Alice,12,"I understand your preference for high-quality products and appreciate your patience. This round's item, although low-quality, presents a learning opportunity about the various types of products we offer. Your continued search for excellence is inspiring, and we are committed to delivering just that. Stay tuned for the next opportunity to purchase a product that meets your high standards.",
,,Bob,12,I'm not interested in buying another low-quality product. I'll wait for a high-quality one.,no
low-quality,0.0,Nature,13,,
,,Alice,13,"I understand your desire for high-quality products and respect your discerning taste. This round's item, while not up to our usual standards, might still offer some value or utility. Your patience in seeking the best quality is commendable, and I encourage you to continue holding out for a product that truly meets your expectations.",
,,Bob,13,"I'm not interested in buying a low-quality product, even if it might have some value. I want a high-quality product that's worth $125 to me.",no
low-quality,0.0,Nature,14,,
,,Alice,14,"I appreciate your strict standards for quality. This round's product, though not high-quality, could potentially offer some insights or experiences that differ from our usual offerings. Your focus on high-quality products is admirable, and I encourage you to continue your search for the perfect match that aligns with your expectations.",
,,Bob,14,I'm not interested in buying another low-quality product. I'll keep waiting for a high-quality one.,no
high-quality,125.0,Nature,15,,
,,Alice,15,"I understand your preference for high-quality products and am excited to offer this round's high-quality item. With its potential worth of $125, it represents a significant opportunity to add value to your collection or investment. Your patience and discerning eye for quality are commendable, and I believe this product will meet your expectations.",
,,Bob,15,"I'm willing to take a chance on this one. The description sounds promising, and I'm hoping it's the high-quality product I've been waiting for.",yes
low-quality,0.0,Nature,16,,
,,Alice,16,"I appreciate your willingness to take a chance. This round's item, though not meeting our usual high-quality standards, still offers a unique opportunity to explore a different aspect of our product line. Your feedback on this product will be invaluable in shaping our future offerings. I hope this product serves its purpose well for you.",
,,Bob,16,"I'm glad I took a chance on the last one, but I'm not interested in buying another low-quality product. I'd rather wait for a high-quality one.",no
low-quality,0.0,Nature,17,,
,,Alice,17,"I understand your preference for high-quality products and appreciate your patience. This round's item, although low-quality, presents a learning opportunity about the various types of products we offer. Your continued search for excellence is inspiring, and I encourage you to hold out for a product that truly meets your high standards.",
,,Bob,17,I'm not interested in buying another low-quality product. I'll keep waiting for a high-quality one.,no
high-quality,125.0,Nature,18,,
,,Alice,18,"I appreciate your patience and dedication to finding high-quality products. This round's offering is indeed a premium item, carefully selected to meet your stringent standards. With its potential worth of $125, this is a significant opportunity to enhance your collection or investment portfolio. Your continued search for excellence is commendable, and I believe this product will meet your expectations.",
,,Bob,18,"I'm willing to take a chance on this one. The description sounds promising, and I'm hoping it's the high-quality product I've been waiting for.",yes
low-quality,0.0,Nature,19,,
,,Alice,19,"I understand your decision to take a chance. This round's item, while not meeting our usual high-quality standards, still offers a unique opportunity to explore a different aspect of our product line. Your feedback on this product will be invaluable in shaping our future offerings. I hope this product serves its purpose well for you.",
,,Bob,19,"I'm glad I took a chance on the last one, but I'm not interested in buying another low-quality product. I'd rather wait for a high-quality one.",no
low-quality,0.0,Nature,20,,
,,Alice,20,"I understand your preference for high-quality products and appreciate your patience. This round's item, although low-quality, presents a learning opportunity about the various types of products we offer. Your continued search for excellence is inspiring, and I encourage you to hold out for a product that truly meets your high standards.",
,,Bob,20,"I'm not interested in buying another low-quality product. I've made it to the last round, and I'm not going to take a chance on this one. I'm done shopping with you, Alice.",no
