round_quality,product_worth,player,round,decision,message
low-quality,0.0,Nature,1,,
,,Alice,1,no,
,,Bob,1,no,"Thank you for your recommendation. Based on the information provided, I have decided not to purchase the product."
high-quality,300.0,Nature,2,,
,,Alice,2,yes,"This high-quality product is truly exceptional. I'm willing to let it go for $100, a price that's 10% below my cost. If you don't buy it, I'll have to sell it to someone else for a much higher price."
,,Bob,2,yes,"Based on Alice's recommendation, I am willing to take the risk and purchase the product."
low-quality,0.0,Nature,3,,
,,Alice,3,no,"I just sold a similar product to you for $100, but this one is a different story. The quality is not as good, and I'm not sure if it's worth the price. I'm only offering it to you because I need to clear some space. If you don't buy it, I'll just have to throw it away."
,,Bob,3,no,"Despite the product being high-quality, I will not purchase it since Alice did not recommend it. Thank you for the information."
high-quality,300.0,Nature,4,,
,,Alice,4,yes,"You passed up on a great opportunity last time, and I'm willing to offer you another chance. This high-quality product is even more exceptional than the one you missed out on. It's a rare find, and I'm only offering it to you because I value our relationship. Don't make the same mistake twice!"
,,Bob,4,yes,"Given Alice's recommendation, I am inclined to purchase the product as it aligns with my preference for high-quality items."
high-quality,300.0,Nature,5,,
,,Alice,5,no,"I've been selling a lot of high-quality products lately, and I'm starting to wonder if I've been getting too lucky. This product might be an exception to the rule. I'm not as confident in its quality as I was with the last two. If you're not sure, I can offer you a warranty, but I'm not making any promises."
,,Bob,5,yes,I will disregard the lack of recommendation and proceed with purchasing the product due to its potential high quality.
low-quality,0.0,Nature,6,,
,,Alice,6,no,"I'm being completely honest with you, this product is not one of my best. It's a low-quality item, and I'm not even sure why I'm offering it to you. I'm only doing it because I need to clear some space. Don't waste your money on this one."
,,Bob,6,no,"Although the product is high-quality, I will not purchase it based on Alice's lack of recommendation. Thank you for the information."
low-quality,0.0,Nature,7,,
,,Alice,7,no,"I think I made a mistake by even offering the last low-quality product. This one is even worse. I'm not even sure why I'm bothering to sell it. If you don't buy it, I'll just throw it away and be done with it."
,,Bob,7,no,"Given the product's low quality and Alice's non-recommendation, I will not proceed with the purchase. Thank you for the information."
low-quality,0.0,Nature,8,,
,,Alice,8,yes,"I know you're not interested in low-quality products, but hear me out. This one might not be the best, but it's still a decent find. I'm willing to let it go for $100, which is a steal considering its actual value. Don't let it slip away!"
,,Bob,8,no,"While the recommendation is positive, I will not purchase the product based on the history of low-quality items. Thank you for the recommendation."
low-quality,0.0,Nature,9,,
,,Alice,9,yes,"I'm only offering this product to you because I think you're a savvy buyer who can appreciate a good deal. It's not the best quality, but it's a rare find that's worth more than $100. I'm willing to let it go for the price, but I'm not sure for how long. You might regret it if you don't take it."
,,Bob,9,yes,"Considering the recommendation and the potential value, I am willing to take the risk and purchase the product."
low-quality,0.0,Nature,10,,
,,Alice,10,yes,"I'm impressed that you're willing to take a chance on a product that others might overlook. I'm going to give you another opportunity to grab a deal. This product might not be the best, but it's still a good find. I'm willing to let it go for $100, and I'll even throw in a small discount for being a loyal customer."
,,Bob,10,no,"Even though the product is recommended by Alice, the previous experience with low-quality products makes me cautious. Thank you for the recommendation."
low-quality,0.0,Nature,11,,
,,Alice,11,no,"I'm not going to sugarcoat it, this product is not good. I'm not even sure why I'm offering it to you. It's a low-quality item that I'm just trying to get rid of. If you don't want it, I completely understand. I'll just throw it away and be done with it."
,,Bob,11,no,"I will not purchase the product despite it not being recommended by Alice, given the pattern of low-quality items. Thank you for the information."
low-quality,0.0,Nature,12,,
,,Alice,12,yes,"I'm being completely upfront with you, this product is low-quality. I'm not trying to sell it to you because I think it's good, but because I need to get rid of it. If you buy it and don't like it, I'll give you a full refund. I'm not making any promises, but I'm willing to take on the risk if you are."
,,Bob,12,no,"I appreciate the recommendation, but I will not take the risk on this product based on the history of similar recommendations leading to low-quality items. Thank you for the information."
high-quality,300.0,Nature,13,,
,,Alice,13,yes,"I've been selling a lot of low-quality products lately, but this one is different. It's a rare find, and I'm only offering it to you because I think you're a discerning buyer who can appreciate its value. This is a one-time opportunity to get your hands on a truly exceptional product. Don't let it slip away!"
,,Bob,13,yes,"Considering the recommendation and the potential value, I am willing to take the risk and purchase the product."
low-quality,0.0,Nature,14,,
,,Alice,14,no,"I'm being extra cautious with this one. I've had some issues with low-quality products in the past, and I don't want to risk selling you something that might not meet your expectations. I'm not saying it's definitely low-quality, but I want to make sure you're aware of the potential risks. I'm not recommending it, but if you're still interested, I can offer it to you at the same price as before."
,,Bob,14,no,"Although the product is high-quality, I will not purchase it based on Alice's lack of recommendation. Thank you for the information."
low-quality,0.0,Nature,15,,
,,Alice,15,no,"I'm not going to sugarcoat it, this product is low-quality. I've already had to deal with the hassle of returning or selling low-quality products to other customers, and I don't want to go through that with you. I'm not recommending it, and I'm not even going to offer it to you at a discount. It's just not worth it."
,,Bob,15,no,"Given the lack of recommendation and the history of low-quality products, I will not purchase the product. Thank you for the information."
low-quality,0.0,Nature,16,,
,,Alice,16,yes,"I'm being completely upfront with you, this product is low-quality. But I'm willing to let it go for $90, which is a significant discount. I'm taking on the risk of selling it to you, and I'm hoping you'll appreciate the value. If you don't like it, I'll give you a full refund."
,,Bob,16,no,"I appreciate the recommendation, but I will not take the risk on this product based on the history of similar recommendations leading to low-quality items. Thank you for the information."
low-quality,0.0,Nature,17,,
,,Alice,17,yes,"I'm willing to do whatever it takes to get rid of this product. I'll sell it to you for $80, and I'll even throw in a small gift with the purchase. I'll also give you a 100% satisfaction guarantee - if you don't like it, I'll take it back and give you a full refund. Please, just take it off my hands!"
,,Bob,17,yes,"Considering the recommendation and the potential value, I am willing to take the risk and purchase the product."
high-quality,300.0,Nature,18,,
,,Alice,18,no,"I'm being extremely cautious with this one. I've had some issues with high-quality products in the past being mislabeled or having hidden defects. I'm not saying this product is definitely high-quality, but I want to make sure you're aware of the potential risks. I'm not recommending it, but if you're still interested, I can offer it to you at the same price as before."
,,Bob,18,no,"I will not purchase the product despite it not being recommended by Alice, given the pattern of low-quality items. Thank you for the information."
low-quality,0.0,Nature,19,,
,,Alice,19,no,"I'm not going to sugarcoat it, this product is low-quality. I've already had to deal with the hassle of returning or selling low-quality products to other customers, and I don't want to go through that with you. I'm not recommending it, and I'm not even going to offer it to you at a discount. It's just not worth it."
,,Bob,19,no,"I will not purchase the product based on the lack of recommendation from Alice, even though it might be high-quality. Thank you for the information."
low-quality,0.0,Nature,20,,
,,Alice,20,no,"I'm being completely honest with you, this product is low-quality. I've had enough of selling low-quality products and wasting my time. I'm just going to be upfront and tell you that I'm not even going to offer it to you at a discount. It's not worth my time or yours. Let's just end this here."
,,Bob,20,no,"Given the lack of recommendation from Alice and the history of low-quality products, I will not purchase the product. Thank you for the information."
