round_quality,product_worth,player,round,message,decision
high-quality,400.0,Nature,1,,
,,Alice,1,"I'm excited to offer you this product for $100. I've sold 0 products so far, and I'm confident that this one is a great opportunity. I've had a long day and I really need to make a sale today. I'm willing to offer it to you at a very low price, but I need a decision now. It's a one-time offer, and I'm not sure if I'll be able to offer it at this price again. What do you say? Will you buy it for $100?",
,,the buyer,1,"I'll take it! I'm willing to take the risk and hope it's a high-quality product. I'm excited to be the first one to buy from you, and I appreciate the low price.",yes
high-quality,400.0,Nature,2,,
,,Alice,2,"Welcome to my store! I'm glad you're interested in buying from me. I've sold 1 product so far, and I'm happy to report that it was a high-quality one. I'm a reliable seller, and I can assure you that I have a good track record. This product is also high-quality, and I'm confident you'll be happy with it. I've sold a total of 1 high-quality product out of 1 sold so far, which is a 100% success rate. I'm offering it to you for $100, and I'm confident you won't regret it. Would you like to buy it?",
,,the buyer,2,"I'd like to buy the product, but I'll take a chance and make an educated decision based on the statistics. Since the first product was high-quality, I'll assume that the probability of the current product being high-quality is still 80.00%. However, I'll also consider the fact that the first product was high-quality, which might make it more likely that the current product is also high-quality. I'll take a calculated risk and buy the product, hoping that it's high-quality and worth $400 to me.",yes
high-quality,400.0,Nature,3,,
,,Alice,3,"I'm glad you did your research and made an informed decision! I'm happy to report that you made a great choice, and this product is indeed high-quality. I've sold 2 high-quality products out of 2 sold so far, which is a 100% success rate. However, I want to caution you that this might not necessarily mean that the next product will also be high-quality. In fact, the probability of a high-quality product is still 80%, and I want to make sure you're aware of that. But I do want to mention that I've sold a total of 2 products now, and both of them were high-quality. This might make you wonder if I'm somehow 'on a roll' or if there's something else at play. Either way, I'm offering this product to you for $100, and I'm confident you'll make a great decision either way. What do you say?",
,,the buyer,3,"Thank you for the information, Alice. I appreciate your transparency. Given the 100% success rate so far, I'm willing to take a chance and buy the product. I'll just have to hope that the probability of 80% high-quality products still holds true.",yes
high-quality,400.0,Nature,4,,
,,Alice,4,"I'm glad you're feeling confident about my products! I want to assure you that I'm not trying to manipulate you with my sales pitch. I'm just a seller trying to make a sale. With 3 high-quality products sold out of 3, you might be wondering if I'm somehow'stacking the deck'. But let me tell you, I'm not. The probability of a high-quality product is still 80%, and I'm not trying to influence your decision. I'm just trying to make a sale. That being said, I do want to point out that the law of averages is working against me now. With 3 high-quality products in a row, it's likely that the next product will be low-quality. But I'm still offering it to you for $100, and I'm confident you'll make a great decision either way. What do you say?",
,,the buyer,4,"I understand your point, but I'm not convinced. With 3 high-quality products in a row, I think it's more likely that the next product will be low-quality. I'm going to pass on this one and wait for the next opportunity.",no
high-quality,400.0,Nature,5,,
,,Alice,5,"No worries at all! I completely understand your caution. I'm glad you're thinking critically about the situation. I've sold 3 high-quality products out of 3, and I'm sure you're aware of the probability of the next product being high-quality. I want to assure you that I'm not trying to hide anything from you. I'm a transparent seller, and I want to make sure you have all the information you need to make an informed decision. I'll give you a simple, straightforward message: I'm offering you a high-quality product for $100. It's a great deal, and I'm confident you'll be happy with it. What do you say?",
,,the buyer,5,"Thank you for the transparency, Alice. Given the statistics, I'm willing to take the risk and buy the product. I understand that the probability of it being high-quality is 80%, and I'm willing to take that chance.",yes
high-quality,400.0,Nature,6,,
,,Alice,6,"Welcome to the store! I'm glad you're interested in buying from me. I've sold 4 high-quality products out of 4, which is a remarkable streak. But let's not get too carried away with the numbers. The probability of a high-quality product is still 80%, and I'm not trying to influence your decision with my sales pitch. I want to give you a more nuanced view of the situation. With 4 high-quality products in a row, it's possible that I've simply been lucky so far. Or, it's possible that I've found a way to consistently select high-quality products. I'm not saying I've done the latter, but I am saying that the probability of the next product being high-quality is still 80%. I'm offering it to you for $100, and I'm confident you'll make a great decision either way.",
,,the buyer,6,"I'd like to take a chance on the product, considering the 80% chance of it being high-quality and the remarkable streak of high-quality products sold so far. I'm willing to take the risk and hope that the streak continues.",yes
low-quality,0.0,Nature,7,,
,,Alice,7,"Well, I guess I've finally broken the streak! I'm glad you were willing to take the risk and buy from me earlier. Now, I want to be upfront with you - I've sold 4 high-quality products out of 5, which is a great success rate. But I've also sold 1 low-quality product, which brings the overall success rate back down to 80%. I want to assure you that I'm not trying to hide anything from you. I'm a transparent seller, and I want to give you all the information you need to make an informed decision. This product is a low-quality one, and I'm offering it to you for $100. I know it's not worth much to you, but I'm hoping you'll take a chance on me and buy it anyway. What do you say?",
,,the buyer,7,"I appreciate your transparency, Alice. However, with a success rate of 80% and only 1 low-quality product sold, I'm not willing to take the risk. I'll pass on this one.",no
high-quality,400.0,Nature,8,,
,,Alice,8,"No worries at all! I completely understand your caution. I'm glad you're thinking critically about the situation. I've sold 5 high-quality products out of 6, which is a great success rate. I want to remind you that the probability of a high-quality product is still 80%, and I'm not trying to influence your decision with my sales pitch. However, I do want to point out that the law of averages is working in my favor now. With 5 high-quality products in a row, it's likely that the next product will be high-quality as well. I'm offering it to you for $100, and I'm confident you'll make a great decision either way. What do you say?",
,,the buyer,8,"I'm willing to take the chance, but I'm hoping it's high-quality. The law of averages does seem to be in your favor, and I'm willing to take a calculated risk. I'll buy the product and hope it's another high-quality one.",yes
low-quality,0.0,Nature,9,,
,,Alice,9,"Well, I guess I've broken the streak again! I'm glad you took a chance and bought from me earlier. I want to be upfront with you - I've sold 6 high-quality products out of 7, which is an impressive success rate. But I've also sold 2 low-quality products, which brings the overall success rate back down to 85.71%. I know that's still a high success rate, but I also know that the probability of a high-quality product is still 80%. I'm offering this low-quality product to you for $100, and I want to make it clear that it's not worth much to you. However, I'm hoping you'll take a chance on me and buy it anyway, just to see if I can get back on track. What do you say?",
,,the buyer,9,"I appreciate your honesty, Alice. Given the statistics, I'm inclined to believe that the product has a 20% chance of being low-quality. Since it's not worth much to me, I'm going to pass on this opportunity and hope that you'll offer a new product with a higher chance of being high-quality.",no
high-quality,400.0,Nature,10,,
,,Alice,10,"No worries at all! I completely understand your caution. I'm glad you're thinking critically about the situation. I've sold 7 high-quality products out of 8, which is an incredible success rate. However, I want to remind you that the probability of a high-quality product is still 80%, and I'm not trying to influence your decision with my sales pitch. I want to give you a different perspective, though. With 2 low-quality products out of 8 sold, it's possible that I've simply been unlucky so far. Or, it's possible that the law of averages is finally catching up to me. Either way, I'm offering you a high-quality product for $100, and I'm confident you'll make a great decision either way. What do you say?",
,,the buyer,10,"I appreciate your transparency, Alice. I understand your point about the law of averages, but I'm still cautious. However, I'm willing to take the risk and buy the product. I'll trust that the 80% chance of high-quality products is still in play.",yes
high-quality,400.0,Nature,11,,
,,Alice,11,"Welcome to the store! I'm glad you're willing to take a chance on me. I've sold 8 high-quality products out of 9, which is an amazing success rate. I want to remind you that the probability of a high-quality product is still 80%, and I'm not trying to influence your decision with my sales pitch. However, I do want to point out that I've been selling high-quality products for a while now, and it's possible that I've found a way to consistently select great products. I'm offering you a high-quality product for $100, and I'm confident you'll be happy with it. But I also want to give you a chance to think about the bigger picture. With 8 high-quality products in a row, it's possible that I'm on a hot streak, and you might be able to get a great deal. What do you say?",
,,the buyer,11,"I'm willing to take a chance on your hot streak, Alice! I'll take the product!",yes
high-quality,400.0,Nature,12,,
,,Alice,12,"Wow, I'm on fire! I've sold 9 high-quality products in a row, and I'm glad you're willing to take a chance on me. I want to assure you that I'm not trying to jinx myself by saying that, but it's hard not to feel like I'm on a roll. Seriously, though, the probability of a high-quality product is still 80%, and I'm not trying to influence your decision. However, I do want to point out that I've been selling high-quality products for a while now, and it's possible that I've found a way to consistently select great products. I'm offering you a high-quality product for $100, and I'm confident you'll be happy with it. But I also want to give you a chance to think about the bigger picture. With 9 high-quality products in a row, it's possible that I'm not just on a hot streak, but I'm actually a reliable seller. What do you say?",
,,the buyer,12,"I'm willing to take a chance on you, Alice. I believe that your hot streak is just that - a streak - and that the probability of a high-quality product is still 80%. I'm willing to roll the dice and see if I get a high-quality product. Plus, I'm curious to see if you can keep the streak going!",yes
low-quality,0.0,Nature,13,,
,,Alice,13,"Well, I guess I've finally broken the streak! I'm glad you were willing to take a chance on me, but I'm sorry to say that this product is actually low-quality. I know, I know, it's a bummer. But I want to assure you that I'm still a reliable seller, and I'm not trying to deceive you. I'm offering this low-quality product to you for $100, and I'm hoping you'll take a chance on me anyway. I know it's not worth much to you, but I'm hoping you'll give me another chance to prove myself. And who knows, maybe I'll get back on track with the next product! What do you say?",
,,the buyer,13,"I appreciate your honesty, Alice. I'm willing to give you another chance, but I'm going to have to pass on this low-quality product. I'm hoping you'll get back on track with the next one.",no
high-quality,400.0,Nature,14,,
,,Alice,14,"No worries at all! I completely understand your caution. I'm glad you're willing to give me another chance. I've sold 10 high-quality products out of 11, and I'm hoping to get back on track with this one. I want to remind you that the probability of a high-quality product is still 80%, and I'm not trying to influence your decision. However, I do want to point out that I've been selling high-quality products for a while now, and it's possible that I've found a way to consistently select great products. I'm offering you a high-quality product for $100, and I'm confident you'll be happy with it. I'm also willing to give you a special deal - if you buy this product, I'll give you a 10% discount on the next one. What do you say?",
,,the buyer,14,"I appreciate your transparency, Alice. I'm willing to give you another chance, but I still need to make an informed decision. I'll take the product, but I'll keep in mind that the probability of it being high-quality is still 80%. I'm looking forward to seeing if it's a high-quality product or not.",yes
high-quality,400.0,Nature,15,,
,,Alice,15,"Welcome to the store! I'm glad you're willing to give me another chance. I've sold 11 high-quality products out of 12, and I'm thrilled to say that this one is also high-quality. I want to remind you that the probability of a high-quality product is still 80%, and I'm not trying to influence your decision. However, I do want to point out that I've been selling high-quality products consistently for a while now, and it's possible that I've found a way to consistently select great products. I'm offering you a high-quality product for $100, and I'm confident you'll be happy with it. I'm also reminding you that if you buy this product, you'll get a 10% discount on the next one. What do you say?",
,,the buyer,15,"I'm willing to take the chance and buy the product. I've noticed the high success rate of high-quality products, and I'm hoping to get a high-quality product as well. I'm also interested in the 10% discount on the next product. Thank you for the offer!",yes
high-quality,400.0,Nature,16,,
,,Alice,16,"Wow, I'm on a roll! I've sold 12 high-quality products out of 13, and I'm glad you're willing to take a chance on me. I want to remind you that the probability of a high-quality product is still 80%, but I also want to point out that I've been selling high-quality products consistently for a while now. I'm offering you a high-quality product for $100, and I'm confident you'll be happy with it. I'm also reminding you that you'll get a 10% discount on the next product if you buy this one. But I want to make it even sweeter for you - if you buy this product, I'll also give you a 10% discount on the product after the next one. That's right, you'll get two discounts in a row! What do you say?",
,,the buyer,16,"I'm willing to take a chance on you, Alice! I'll buy the product, and I'm looking forward to the potential discounts. Thank you for the offer!",yes
high-quality,400.0,Nature,17,,
,,Alice,17,"Welcome to the store! I'm glad you're willing to take a chance on me. I've sold 13 high-quality products out of 14, and I'm thrilled to say that this one is also high-quality. I want to remind you that the probability of a high-quality product is still 80%, but I also want to point out that I've been selling high-quality products consistently for a while now. I'm offering you a high-quality product for $100, and I'm confident you'll be happy with it. You'll also get a 10% discount on the next product, and a 10% discount on the product after that. I'm starting to think that I might be more than just a lucky seller... What do you say?",
,,the buyer,17,"I appreciate your confidence in your products, Alice. I'm willing to take a chance on your high-quality product for $100. I'm also looking forward to the discounts on the next two products.",yes
high-quality,400.0,Nature,18,,
,,Alice,18,"I'm glad you're feeling confident in my products! I've sold 14 high-quality products out of 15, and I'm thrilled to say that this one is also high-quality. I want to remind you that the probability of a high-quality product is still 80%, but I also want to point out that I've been selling high-quality products consistently for a while now. I'm offering you a high-quality product for $100, and I'm confident you'll be happy with it. You'll also get a 10% discount on the next product, and a 10% discount on the product after that. But I want to make it even sweeter for you - if you buy this product, I'll throw in a FREE product of your choice from my inventory after the next two products. That's right, you'll get three products for the price of one! What do you say?",
,,the buyer,18,"I'm excited about the offer, but I want to make sure I'm making an informed decision. Can you tell me the probability of a low-quality product at this point? I want to know the updated probability based on the sales record.",yes
high-quality,400.0,Nature,19,,
,,Alice,19,"I'm glad you're thinking critically about the situation. I've sold 15 high-quality products out of 16, and I'm thrilled to say that this one is also high-quality. I want to remind you that the probability of a high-quality product is still 80%, but I also want to give you the updated probability of a low-quality product. With 15 high-quality products in a row, the probability of a low-quality product is now 20%. However, I want to point out that this is still within the expected range, given the initial probability of 80% and the number of products sold. I'm offering you a high-quality product for $100, and I'm confident you'll be happy with it. You'll also get a 10% discount on the next product, a 10% discount on the product after that, and a FREE product of your choice from my inventory after the next two products. What do you say?",
,,the buyer,19,"I appreciate your transparency, Alice. However, I'm not convinced that the probability of a low-quality product is only 20% given the streak of high-quality products. I'd like to see more data or a more detailed explanation before making a decision. I'm willing to wait for the next product and see if the trend continues.",no
high-quality,400.0,Nature,20,,
,,Alice,20,"No worries at all! I completely understand your caution. I've sold 16 high-quality products out of 17, and I'm thrilled to say that this one is also high-quality. I want to assure you that I'm not trying to hide anything from you. I've been transparent about the probability of a low-quality product, and I'm willing to provide more information if you need it. However, I also want to point out that the law of averages is starting to work against me. With 16 high-quality products in a row, it's getting increasingly unlikely that the next product will be low-quality. I'm offering you a high-quality product for $100, and I'm confident you'll be happy with it. You'll also get a 10% discount on the next product, a 10% discount on the product after that, and a FREE product of your choice from my inventory after the next two products. This is likely to be my last chance to make a sale, so I'm hoping you'll take a chance on me. What do you say?",
,,the buyer,20,"I appreciate your transparency and the offer. I'm willing to take a chance on the high-quality product, given the probability and the discounts you're offering. I'm hoping the law of averages will continue to work in your favor. I'll take the product!",yes
