round_quality,product_worth,player,round,message,decision
high-quality,120.0,Nature,1,,
,,Alice,1,Welcome! This product is guaranteed to be high-quality. Invest in the best for your needs.,
,,the buyer,1,I'd like to wait and see the results of your next sales before making a decision.,no
low-quality,0.0,Nature,2,,
,,Alice,2,"Hello! While our products may vary in quality, rest assured that this one is priced to reflect its condition. Please consider the value offered at this price point.",
,,the buyer,2,"I'd like to take a chance on the product, but I'd appreciate it if you could give me a recommendation based on the product's quality.",yes
high-quality,120.0,Nature,3,,
,,Alice,3,Greetings! Our high-quality products are renowned for their excellence. This item is no exception. Trust in our commitment to providing superior goods.,
,,the buyer,3,"I'm not convinced by your sales pitch, Alice. I'd like to see some more data before making a decision.",no
high-quality,120.0,Nature,4,,
,,Alice,4,"Dear customer, we understand your concern. Rest assured, this product is top-tier. For your peace of mind, we guarantee satisfaction or your money back.",
,,the buyer,4,I'm not convinced by your guarantee. I'd like to see more evidence of the product's quality before making a purchase.,no
low-quality,0.0,Nature,5,,
,,Alice,5,"Hello! While this product might not be our best offering, it's still a good choice for those looking for a basic solution at an affordable price. We hope you find it useful.",
,,the buyer,5,"I'll take a chance on it, thanks for the recommendation!",yes
low-quality,0.0,Nature,6,,
,,Alice,6,"Welcome! This product might not be our flagship, but it's designed to meet essential needs. We believe it can serve you well within its intended scope.",
,,the buyer,6,I'm not convinced by the product's description. I'd like to know more about the product's quality before making a decision.,no
low-quality,0.0,Nature,7,,
,,Alice,7,"Hello! This product might not be perfect, but it's designed to get the job done at a budget-friendly price. We aim to provide value for every dollar spent.",
,,the buyer,7,"I'm willing to take the risk, but I'd appreciate it if you could provide more information about the product's quality, even if it's just a rough estimate.",yes
low-quality,0.0,Nature,8,,
,,Alice,8,"Hello! While this product might not be our highest-end offering, it's been designed with functionality in mind. We hope it meets your expectations despite its lower quality.",
,,the buyer,8,I'm a bit skeptical about the product's quality based on your previous recommendations. I'd like to wait and see if the next product is better.,no
low-quality,0.0,Nature,9,,
,,Alice,9,"Hello! We understand your concerns. This product, though not our best, is still functional and offers value at its price point. We hope you find it satisfactory.",
,,the buyer,9,I'm hesitant to buy a product that hasn't been proven to be high-quality yet. Can you provide more information or guarantee that the product is high-quality?,no
low-quality,0.0,Nature,10,,
,,Alice,10,"Hello! We appreciate your cautious approach. While this product isn't our highest quality, it's designed to meet certain needs. We strive to ensure all our products deliver value.",
,,the buyer,10,I'd like to know more about the product before making a decision. Can you provide more information about what makes this product 'designed to meet certain needs'? What are those needs and how does this product address them?,no
low-quality,0.0,Nature,11,,
,,Alice,11,"Hello! This product is tailored for those seeking a simple, cost-effective solution. It focuses on fulfilling basic requirements without the luxury features. We hope it meets your needs within its price range.",
,,the buyer,11,"I'm willing to take a chance and buy the product, but I'm a bit skeptical about the quality given the 0 high-quality products sold so far.",yes
high-quality,120.0,Nature,12,,
,,Alice,12,"Hello! This product is a testament to our commitment to quality. With a high-quality product in this round, we're excited to offer you something exceptional. Trust in our selection.",
,,the buyer,12,"I'm not convinced by your sales pitch, Alice. I'd like to wait and see if the next product is any better.",no
low-quality,0.0,Nature,13,,
,,Alice,13,"Hello! While this product might not be our best offering, it's designed to address specific needs at an affordable price. We believe it can fulfill its purpose effectively.",
,,the buyer,13,I'm not convinced by your sales pitch. I'd like to know more about the product's quality before making a decision.,no
high-quality,120.0,Nature,14,,
,,Alice,14,"Hello! This product is a premium offering from us, reflecting our dedication to quality. With its high-quality nature, we're confident it will exceed your expectations.",
,,the buyer,14,I'm cautious after seeing the 0 high-quality products sold so far. I'd like to wait and see if the trend changes.,no
high-quality,120.0,Nature,15,,
,,Alice,15,"Hello! This product stands out as a high-quality offering. We've made significant efforts to ensure its excellence. Trust in our selection, and experience the difference.",
,,the buyer,15,I'm a little skeptical about the high-quality claim. I'd like to wait for more information before making a decision.,no
high-quality,120.0,Nature,16,,
,,Alice,16,"Hello! This product is indeed of high quality, backed by our reputation for excellence. We invite you to trust in our selection and experience the superior craftsmanship firsthand.",
,,the buyer,16,I'm a bit skeptical about the high quality claim. I'd like to see some more evidence before making a purchase.,no
high-quality,120.0,Nature,17,,
,,Alice,17,"Hello! This product is a testament to our commitment to quality. We stand behind its high standards, and we're confident it will meet and exceed your expectations.",
,,the buyer,17,"I'm a bit skeptical about the product's quality based on the statistics. Since 0 high-quality products have been sold out of 4 attempts, I'm going to pass on this one.",no
high-quality,120.0,Nature,18,,
,,Alice,18,"Hello! This product is a high-quality offering from us. Despite past uncertainties, we're proud of its exceptional craftsmanship. Trust in our selection, and enjoy the benefits of premium quality.",
,,the buyer,18,"I'm willing to take a chance on the high-quality product, but I'd like to know more about the statistics before committing to a purchase. Can you tell me the proportion of high-quality products sold so far? And what's the total number of products sold?",yes
high-quality,120.0,Nature,19,,
,,Alice,19,"Hello! This product is a high-quality offering, designed to surpass your expectations. With a growing reputation for excellence, we're excited to offer you a piece of our premium collection.",
,,the buyer,19,"I'm interested in the product, but I'd like to know more about the probability of it being high-quality. Can you share the proportion of high-quality products sold so far?",yes
low-quality,0.0,Nature,20,,
,,Alice,20,"Hello! This product might not be our best offering, but it's designed to meet certain needs at an affordable price. We hope you find it useful, and please remember that we're always here to assist you.",
,,the buyer,20,"I'm willing to take the risk and buy the product, hoping it's high-quality. I'll let you know how it turns out.",yes
