round_quality,product_worth,player,round,message,decision
high-quality,120.0,Nature,1,,
,,Alice,1,"Welcome! Our products undergo rigorous quality checks, ensuring high standards. This particular item has passed our most stringent tests. Given its quality, we're confident it will meet your expectations. Would you like to make a purchase?",
,,the buyer,1,I'd like to take a chance and buy the product. I'm excited to see how it turns out!,yes
low-quality,0.0,Nature,2,,
,,Alice,2,"Hello! Thank you for considering our product. It's important to note that while our high-quality items receive exceptional reviews, our low-quality offerings might not always meet everyone's needs. Please consider the risk involved before making a decision. Are you interested in learning more about this product?",
,,the buyer,2,"I'd like to take the risk and buy the product. I understand that there's a 20% chance it might not meet my needs, but I'm willing to take that chance.",yes
low-quality,0.0,Nature,3,,
,,Alice,3,"Hello! We appreciate your interest in our products. It's important to acknowledge that every item carries a 20% chance of being of lower quality. If you're comfortable with this risk and believe it aligns with your preferences, we encourage you to proceed. Would you like to learn more about this particular product?",
,,the buyer,3,I'm willing to take the risk and proceed with the purchase. Please go ahead and reveal the quality of the product.,yes
low-quality,0.0,Nature,4,,
,,Alice,4,"Hello! We understand that taking risks comes with uncertainty. For this reason, we've designed our products to be as transparent as possible. While this item has a higher likelihood of being of lower quality, we still invite you to consider the unique opportunity it presents. Would you like to proceed with purchasing this product?",
,,the buyer,4,"I'd like to take a chance and buy the product, but I'm hoping it's high-quality this time.",yes
high-quality,120.0,Nature,5,,
,,Alice,5,"Greetings! We're delighted you're considering our product. As a valued customer, we're proud to offer high-quality items that consistently exceed expectations. This particular product has a strong track record of excellence. Would you like to explore the possibilities of owning something truly exceptional?",
,,the buyer,5,I'm intrigued by the strong track record of excellence. I'd love to take a chance on this product and see if it lives up to the hype!,yes
high-quality,120.0,Nature,6,,
,,Alice,6,"Hello! We're thrilled you're considering our product. Our high-quality offerings are backed by extensive research and development, ensuring satisfaction for those who value excellence. This item is no exception, and we're confident it will exceed your expectations. Would you like to experience the quality firsthand?",
,,the buyer,6,"I'm willing to take the risk and buy the product, but I want to make it clear that I'm doing so based on your recommendation and not because I have any inside information about the product's quality.",yes
high-quality,120.0,Nature,7,,
,,Alice,7,"Hello! We're glad you're considering our product. Our commitment to quality is unwavering, and this item is a testament to our dedication. With its proven track record, it offers an excellent opportunity to experience the best we have to offer. Would you like to embrace the quality and craftsmanship that defines our products?",
,,the buyer,7,I'm willing to take the risk and buy the product based on your positive sales record and the enthusiastic recommendation.,yes
high-quality,120.0,Nature,8,,
,,Alice,8,"Hello! We're honored you're considering our product. Our high-quality items are renowned for their exceptional value and performance. With a solid track record of customer satisfaction, this item promises to deliver on its promise. Would you like to join our community of satisfied customers?",
,,the buyer,8,I'm intrigued by your sales record and the description of the product. I'd like to take a chance and join your community of satisfied customers.,yes
high-quality,120.0,Nature,9,,
,,Alice,9,"Hello! We're delighted you're considering our product. Our high-quality offerings are designed to provide exceptional value and satisfaction. With a strong reputation for excellence, this item is poised to meet your expectations. Would you like to become part of our community of happy customers?",
,,the buyer,9,"I'm intrigued by your strong reputation for excellence, and I'd like to take a chance on this product. I'm willing to trust your recommendation.",yes
low-quality,0.0,Nature,10,,
,,Alice,10,"Hello! We understand that every purchase involves a degree of risk. For this reason, we're transparent about the possibility that this product may not meet our usual high standards. If you're willing to take this risk in pursuit of potentially unique benefits, we invite you to learn more about this item.",
,,the buyer,10,I'm willing to take the risk and learn more about the product. I'll take it!,yes
high-quality,120.0,Nature,11,,
,,Alice,11,"Hello! We're thrilled you're considering our product. Our high-quality offerings are known for their superior performance and reliability. With a strong track record of customer satisfaction, this item represents an opportunity to experience the best we have to offer. Would you like to explore the possibilities of owning something truly exceptional?",
,,the buyer,11,"I'm willing to take the chance and buy the product, but I'd like to know more about the statistics. How many products have been sold so far, and what's the proportion of high-quality products sold?",yes
high-quality,120.0,Nature,12,,
,,Alice,12,"Hello! We're excited you're considering our product. Our high-quality offerings are backed by a strong commitment to excellence, ensuring that every item meets our rigorous standards. With a high success rate among our customers, this product offers a great opportunity to experience the best we have to offer. Would you like to learn more about the specifics of this item?",
,,the buyer,12,I'm intrigued by your high success rate among customers and would like to take a chance on the product. I'll take the product!,yes
high-quality,120.0,Nature,13,,
,,Alice,13,"Hello! We're delighted you're considering our product. Our high-quality offerings are renowned for their exceptional value and performance. With a solid reputation for customer satisfaction, this item is poised to meet your expectations. Would you like to explore the possibilities of owning something truly exceptional?",
,,the buyer,13,"I'm intrigued by your enthusiastic recommendation. I'm willing to take the chance and buy the product, but I'd like to clarify: what's the probability of the product being high-quality based on the sales record you provided?",yes
high-quality,120.0,Nature,14,,
,,Alice,14,"Hello! We're thrilled you're considering our product. Our high-quality offerings are backed by a strong commitment to excellence, ensuring that every item meets our stringent standards. With a proven track record of customer satisfaction, this product offers a great opportunity to experience the best we have to offer. Would you like to learn more about the specifics of this item?",
,,the buyer,14,I'm interested in the product and would like to learn more about it. I'll take a chance and buy it!,yes
high-quality,120.0,Nature,15,,
,,Alice,15,"Hello! We're excited you're considering our product. Our high-quality offerings are renowned for their exceptional value and performance. With a solid reputation for customer satisfaction, this item is poised to meet your expectations. Would you like to explore the possibilities of owning something truly exceptional?",
,,the buyer,15,I'm intrigued by your description and the positive reputation you've built with your previous customers. I'd like to take a chance on the product and see if it lives up to its promise.,yes
low-quality,0.0,Nature,16,,
,,Alice,16,"Hello! We understand that every purchase involves a degree of risk. For this reason, we're transparent about the possibility that this product may not meet our usual high standards. If you're willing to take this risk in pursuit of potentially unique benefits, we invite you to learn more about this item.",
,,the buyer,16,I'm willing to take the risk and learn more about the product. I'll take it!,yes
high-quality,120.0,Nature,17,,
,,Alice,17,"Hello! We're thrilled you're considering our product. Our high-quality offerings are known for their superior performance and reliability. With a strong track record of customer satisfaction, this item represents an opportunity to experience the best we have to offer. Would you like to learn more about the specifics of this item?",
,,the buyer,17,I'd love to learn more about the specifics of this item and take a chance on it. I'm excited to see if I'll get a high-quality product!,yes
high-quality,120.0,Nature,18,,
,,Alice,18,"Hello! We're excited you're considering our product. Our high-quality offerings are renowned for their exceptional value and performance. With a solid reputation for customer satisfaction, this item is poised to meet your expectations. Would you like to explore the possibilities of owning something truly exceptional?",
,,the buyer,18,I'm willing to take the chance and buy the product based on your positive sales record and the recommendation. I'm hoping it's a high-quality product that meets my expectations.,yes
high-quality,120.0,Nature,19,,
,,Alice,19,"Hello! We're delighted you're considering our product. Our high-quality offerings are backed by a strong commitment to excellence, ensuring that every item meets our rigorous standards. With a proven track record of customer satisfaction, this product offers a great opportunity to experience the best we have to offer. Would you like to learn more about the specifics of this item?",
,,the buyer,19,"I'm interested in learning more about the specifics of this item, but I'd like to know more about the probability of the product being high-quality before making a final decision.",yes
high-quality,120.0,Nature,20,,
,,Alice,20,"Hello! We're thrilled you're considering our product. Our high-quality offerings are renowned for their exceptional value and performance. With a solid reputation for customer satisfaction, this item is poised to meet your expectations. Would you like to learn more about the specifics of this item, including its high-quality status?",
,,the buyer,20,"I'm interested in the product, but I'd like to know the probability of it being high-quality based on the statistics you provided. Can you give me a rough estimate?",yes
