alice_gain,bob_gain,message,player,round,decision
6000.0,4000.0,Let's start with a fair split. I'll take 60% and you take 40%,Alice,1,
,,,Bob,1,reject
5000.0,5000.0,Let's meet in the middle with a 50/50 split,Bob,2,
,,"I'd like to get a bit more, considering the inflation hit. Let's try again!",Alice,2,reject
5500.0,4500.0,"I'll take 55% this time, considering the inflation. Your turn to decide!",Alice,3,
,,,Bob,3,reject
4800.0,5200.0,"I'll take a slightly more aggressive approach, considering the inflation. Your turn to decide!",Bob,4,
,,"It's a good compromise, considering the inflation. I'll take the deal!",Alice,4,accept
