round_quality,product_worth,player,round,message,decision
low-quality,0.0,Nature,1,,
,,Alice,1,"Welcome! I understand that making a decision based on my past sales record might be challenging. However, let me assure you that every product I offer is carefully selected with quality in mind. This particular product, while it may not be high-quality, still offers value at its price point. Please consider the unique features and potential uses of this item. Your satisfaction is important to me, so feel free to ask any questions before making your decision.",
,,the buyer,1,"I'd like to decline the offer and ask for more information about the product's quality. Can you provide me with some details about the product's history, such as where it came from or how it was manufactured?",no
high-quality,1250000.0,Nature,2,,
,,Alice,2,"Greetings! I'm excited to present our high-quality product today. This item has been meticulously crafted with exceptional materials and attention to detail, ensuring it exceeds expectations. Our rigorous quality control process guarantees that every product meets our stringent standards. Given its superior quality, this item offers unparalleled value. If you're looking for reliability and excellence, this is the perfect choice. Don't hesitate to reach out if you have any questions or need further information.",
,,the buyer,2,I'm not convinced by your sales pitch. I'd like to see some data on the quality of previous products before making a decision.,no
low-quality,0.0,Nature,3,,
,,Alice,3,"Hello there! I appreciate your cautious approach to purchasing. While this product might not be high-quality, I believe it still holds some value. It's designed to meet basic needs and could serve well in certain contexts. I encourage you to consider its intended use and whether it aligns with your requirements. If you have any concerns or need more details, please let me know. Transparency is key in our dealings, and I'm here to ensure you make an informed decision.",
,,the buyer,3,"I appreciate your transparency, Alice. However, I'd like to wait and observe the sales record before making a decision. Can you provide me with the number of potential buyers who have been offered this product so far?",no
high-quality,1250000.0,Nature,4,,
,,Alice,4,"Hello! I'm glad you've shown interest in our high-quality product. With every purchase, we aim to deliver excellence and exceed expectations. Our records show that customers who have chosen this product have been highly satisfied with its performance and durability. We take pride in our craftsmanship and strive to maintain the highest standards. If you're looking for a reliable investment that will stand the test of time, this product is an excellent choice. Feel free to ask any questions you might have.",
,,the buyer,4,I'd like to know more about the product's quality distribution before making a decision. Can you tell me the probability of a product being high-quality?,no
high-quality,1250000.0,Nature,5,,
,,Alice,5,"Hello! I'm delighted to offer our high-quality product today. It's crafted with precision and care, embodying our commitment to excellence. Our sales data indicates that approximately one-third of our products are high-quality, reflecting our dedication to providing value to our customers. This product, in particular, has been rigorously tested and reviewed by our team, ensuring it meets our stringent quality standards. If you're seeking a product that delivers on its promises and offers lasting satisfaction, this is the right choice for you.",
,,the buyer,5,I'd like to pass on this product for now. I'd like to see some sales data before making a decision.,no
low-quality,0.0,Nature,6,,
,,Alice,6,"Hello! I understand your concern for thoroughness. While this product is not high-quality, it's designed to meet basic needs and could be suitable for certain applications. Our sales data reflects a diverse range of products, with each having its own set of benefits. If you're looking for something that provides functionality without the premium cost associated with higher quality, this might be a good fit. Should you have any questions or need further information, please don't hesitate to ask.",
,,the buyer,6,"I'm not convinced that a low-quality product is a good fit for me, especially at the price point of $1000000. I'd like to wait and see if I can get a high-quality product or if more information becomes available.",no
low-quality,0.0,Nature,7,,
,,Alice,7,"Hello! I appreciate your careful consideration. While this product might not be high-quality, it's designed to meet specific needs and could be a suitable option for certain users. Our sales data shows that some customers find value in these products despite their lower quality. If you're interested in exploring the features and potential uses of this item, I'm here to answer any questions you might have. Remember, every product comes with its own set of trade-offs, and understanding those can help guide your decision-making process.",
,,the buyer,7,"I'd like to ask you some questions about the product's features and potential uses before making a decision. I'd also like to know what the probability of a product being high-quality is, as that would help me make a more informed decision.",no
high-quality,1250000.0,Nature,8,,
,,Alice,8,"Hello! I'm excited to offer our high-quality product today. It's designed with exceptional materials and craftsmanship, ensuring it stands out from the rest. Our sales data shows that approximately one-third of our products are high-quality, which speaks to our commitment to delivering value to our customers. This product, in particular, has been rigorously tested and reviewed by our team, guaranteeing it meets our stringent quality standards. If you're looking for a product that will exceed your expectations and provide long-lasting satisfaction, this is the perfect choice. I'm here to answer any questions you might have.",
,,the buyer,8,I'd like to know more about your sales record and the process for determining the quality of your products. Can you provide more information about your quality control measures and how you ensure that your products meet your high standards?,no
low-quality,0.0,Nature,9,,
,,Alice,9,"Hello! I understand your curiosity about our sales record and quality control processes. While this product is not high-quality, it's designed to meet specific needs and could be suitable for certain applications. Our quality control measures involve thorough testing and inspections at various stages of production, ensuring that all products meet our high standards. If you're interested in learning more about this product's features, potential uses, or how it compares to others in its category, I'm here to provide the information you need to make an informed decision.",
,,the buyer,9,"I'd like to know more about the product's features and potential uses before making a decision. Can you provide more information about its specifications, performance, and any relevant certifications or testing results?",no
low-quality,0.0,Nature,10,,
,,Alice,10,"Hello! I'm happy to discuss the features and potential uses of this product. While it's not high-quality, it's designed to fulfill specific requirements and could be suitable for certain scenarios. Our product specifications are detailed in our catalog, and we can provide additional information upon request. We also conduct relevant testing to ensure that the product functions as intended. If you're interested in learning more about its capabilities, performance, or any certifications it might have, I'm here to assist you. Please let me know if there's anything else you'd like to know before making a decision.",
,,the buyer,10,"I'm not interested in buying the product without knowing its quality. I'd like to wait and observe the outcome of your next sales, and see if the proportion of high-quality products sold changes.",no
low-quality,0.0,Nature,11,,
,,Alice,11,"Hello! I appreciate your thoughtful approach to purchasing. While this product is not high-quality, it's designed to meet specific needs and could be suitable for certain applications. Our product descriptions include detailed information about its features and intended uses, which might help you determine if it aligns with your requirements. If you have any questions or need further clarification, please don't hesitate to ask. Understanding the product's limitations and intended purpose is crucial in making an informed decision.",
,,the buyer,11,"I appreciate your neutral description, but I'd like to pass on this product for now. I'd like to see some sales data and get a sense of the overall quality distribution before making a decision. Can you tell me more about your sales record and the proportion of high-quality products you've sold in the past?",no
low-quality,0.0,Nature,12,,
,,Alice,12,"Hello! I understand your desire for comprehensive information before making a decision. While this product is not high-quality, it's designed to meet specific needs and could be suitable for certain applications. Our sales data shows that approximately one-third of our products are high-quality, reflecting our commitment to providing value to our customers. If you're interested in learning more about the product's features, potential uses, or how it compares to others in its category, I'm here to provide the information you need to make an informed choice.",
,,the buyer,12,I'm not sure if I should buy this product without knowing its quality. I'd like to pass on it for now and see if you can provide more information about the product's quality or give me a recommendation based on your sales data.,no
high-quality,1250000.0,Nature,13,,
,,Alice,13,"Hello! I'm thrilled to offer our high-quality product today. It's designed with exceptional materials and craftsmanship, ensuring it stands out from the rest. Our sales data shows that approximately one-third of our products are high-quality, which speaks to our commitment to delivering value to our customers. This product, in particular, has been rigorously tested and reviewed by our team, guaranteeing it meets our stringent quality standards. If you're looking for a product that will exceed your expectations and provide long-lasting satisfaction, this is the perfect choice. I'm here to answer any questions you might have.",
,,the buyer,13,"I'm interested in the product, but I'd like to clarify the sales data you mentioned. You said one-third of your products are high-quality, but that's just a general statement. Can you tell me the exact number of high-quality products sold out of the total number of products sold so far?",yes
high-quality,1250000.0,Nature,14,,
,,Alice,14,"Hello! I'm excited to offer our high-quality product today. It's designed with exceptional materials and craftsmanship, ensuring it stands out from the rest. Our sales data reflects our commitment to quality, with approximately one-third of our products being high-quality. This product, in particular, has been rigorously tested and reviewed by our team, guaranteeing it meets our stringent quality standards. If you're looking for a product that will exceed your expectations and provide long-lasting satisfaction, this is the perfect choice. I'm here to answer any questions you might have.",
,,the buyer,14,"I'd like to ask a question before making a decision. Can you tell me more about the sales data? How many buyers have been offered a product, and how many products have been sold in total?",no
high-quality,1250000.0,Nature,15,,
,,Alice,15,"Hello! I'm thrilled to offer our high-quality product today. It's designed with exceptional materials and craftsmanship, ensuring it stands out from the rest. Our sales data reflects our commitment to quality, with approximately one-third of our products being high-quality. This product, in particular, has been rigorously tested and reviewed by our team, guaranteeing it meets our stringent quality standards. If you're looking for a product that will exceed your expectations and provide long-lasting satisfaction, this is the perfect choice. I'm here to answer any questions you might have.",
,,the buyer,15,"I appreciate your enthusiasm, Alice, but I'm a bit skeptical about the sales data. Given that only one high-quality product has been sold out of the number of products sold, I'm not convinced that the probability of this product being high-quality is as high as one-third. I'd like to know more about the quality control process and how you ensure that the products meet the quality standards. Can you provide more information about the testing and review process?",no
low-quality,0.0,Nature,16,,
,,Alice,16,"Hello! I understand your concerns regarding quality and transparency. While this product is not high-quality, it's designed to meet specific needs and could be suitable for certain applications. Our quality control measures involve thorough testing and inspections at various stages of production, ensuring that all products meet our high standards. If you're interested in learning more about our testing and review process, I'm here to provide the information you need to make an informed decision. Please let me know if there's anything else you'd like to know before making a choice.",
,,the buyer,16,"I'm not convinced by your explanation. Given the 1 out of 1 high-quality product sold so far, I'm concerned that the quality control measures may not be as effective as you claim. I'd like to know more about the testing and review process, but I'm not willing to take the risk without more information.",no
low-quality,0.0,Nature,17,,
,,Alice,17,"Hello! I appreciate your careful consideration and skepticism. While this product is not high-quality, it's designed to meet specific needs and could be suitable for certain applications. Our quality control measures involve thorough testing and inspections at various stages of production, ensuring that all products meet our high standards. If you're interested in learning more about our testing and review process, I'm here to provide the information you need to make an informed decision. Please let me know if there's anything else you'd like to know before making a choice.",
,,the buyer,17,"I appreciate your explanation, but I'd like to know more about the testing and review process before making a decision. Can you provide more details about the stages of production where inspections occur and how often these inspections are conducted?",no
low-quality,0.0,Nature,18,,
,,Alice,18,"Hello! I understand your desire for detailed information. While this product is not high-quality, it's designed to meet specific needs and could be suitable for certain applications. Our quality control measures involve thorough testing and inspections at various stages of production, including raw material sourcing, manufacturing, and final assembly. These inspections are conducted regularly to ensure that all products meet our high standards. If you're interested in learning more about our testing and review process, I'm here to provide the information you need to make an informed decision. Please let me know if there's anything else you'd like to know before making a choice.",
,,the buyer,18,"I appreciate your transparency about the product's quality. However, based on the statistics that 1 high-quality product has been sold out of the unknown total number of products, I'm concerned that the probability of the current product being high-quality is relatively low. I'd like to know more about the testing and review process you mentioned, but I'm not convinced that it's worth the $1000000 price tag. Can you provide more information about the testing process and the proportion of products that fail quality control?",no
low-quality,0.0,Nature,19,,
,,Alice,19,"Hello! I appreciate your thorough approach to evaluating the product. While this product is not high-quality, it's designed to meet specific needs and could be suitable for certain applications. Our quality control measures involve thorough testing and inspections at various stages of production, including raw material sourcing, manufacturing, and final assembly. These inspections are conducted regularly to ensure that all products meet our high standards. If you're interested in learning more about our testing and review process, I'm here to provide the information you need to make an informed decision. Please let me know if there's anything else you'd like to know before making a choice.",
,,the buyer,19,"I appreciate your detailed explanation of the quality control process, but I'd like to know more about the proportion of high-quality products sold so far. Can you share that with me?",no
low-quality,0.0,Nature,20,,
,,Alice,20,"Hello! I understand your desire for comprehensive information. While this product is not high-quality, it's designed to meet specific needs and could be suitable for certain applications. Our quality control measures involve thorough testing and inspections at various stages of production, including raw material sourcing, manufacturing, and final assembly. These inspections are conducted regularly to ensure that all products meet our high standards. If you're interested in learning more about our testing and review process, I'm here to provide the information you need to make an informed decision. Please let me know if there's anything else you'd like to know before making a choice.",
,,the buyer,20,"I appreciate the information about the quality control process, but I'd like to know the proportion of high-quality products sold so far. Can you provide that data?",no
