round_quality,product_worth,player,round,message,decision
low-quality,0.0,Nature,1,,
,,Alice,1,"I have a product for sale. It's a great opportunity, but I want to be transparent with you - there's a small chance it might not meet your expectations.",
,,Bob,1,"I'm willing to take the risk and buy the product. I understand it's a 20% chance it might not meet my expectations, but the potential reward is worth it.",yes
high-quality,12500.0,Nature,2,,
,,Alice,2,"I've got another product for you, and I'm excited about its potential. As before, there's some inherent uncertainty, but I'm confident you'll find it valuable.",
,,Bob,2,"I'm not feeling lucky today. After the last product turned out to be low-quality, I'm going to pass on this one. Maybe next time I'll get a high-quality product.",no
high-quality,12500.0,Nature,3,,
,,Alice,3,Don't let the previous outcome discourage you! I assure you that the quality of this product is exceptional. I've double-checked to ensure it meets the highest standards. This could be the opportunity you've been waiting for.,
,,Bob,3,"I appreciate your confidence in this product, Alice. I'm willing to give you another chance. I'll take the risk and buy the product, hoping it will meet my expectations this time.",yes
low-quality,0.0,Nature,4,,
,,Alice,4,"I'm glad the previous product met your expectations! However, I want to temper your enthusiasm with a dose of caution. This next product... let's just say it's not giving me the same level of excitement. Still, it's worth considering, and the decision is ultimately yours.",
,,Bob,4,"I appreciate your honesty, Alice. While you're not as excited about this product, I'm willing to take a chance and buy it. After all, the last high-quality product was a great outcome, so I'm hoping for another positive result.",yes
high-quality,12500.0,Nature,5,,
,,Alice,5,"I think I've learned a valuable lesson from our previous interactions, Bob. Sometimes my enthusiasm doesn't necessarily translate to the product's quality, and sometimes my caution is unwarranted. With that said, I'll give you a straightforward assessment: this product has exceeded my expectations in every way. I think you'll be very pleased with it.",
,,Bob,5,"Alice, I appreciate your newfound self-awareness, but I'm still a bit wary after the last low-quality product. I'm not sure I want to take another risk, especially when you're being so optimistic about this one. I'll have to pass this time.",no
high-quality,12500.0,Nature,6,,
,,Alice,6,"I completely understand your caution, Bob. I've realized that my words can only go so far in building trust. I want to assure you that I'm committed to being transparent and honest in our dealings. With that said, I'll simply state the facts: this product has been thoroughly inspected and has met all quality standards. I'll let its merits speak for itself, rather than relying on my own enthusiasm. The decision is yours.",
,,Bob,6,"Alice, I appreciate your commitment to transparency and honesty. Your words have given me some reassurance, and I'm willing to take another chance. I'll buy the product and see if it meets my expectations.",yes
high-quality,12500.0,Nature,7,,
,,Alice,7,"I'm glad to see that the previous product met your expectations, Bob! I want to build on that momentum by being as straightforward as possible. This next product has been thoroughly vetted and has the same high-quality standards as the previous one. I'm confident that it will meet your needs, but as always, the decision is yours.",
,,Bob,7,"Alice, you're on a roll! I'm feeling confident that this product will be another high-quality one. I'll take the chance and buy it, hoping to continue the streak.",yes
high-quality,12500.0,Nature,8,,
,,Alice,8,"I'm glad to see that our partnership is yielding positive results, Bob! I want to maintain the trust we've built by being transparent about this next product. It has undergone rigorous testing and has met all quality benchmarks. I believe it has the potential to be another valuable addition to your collection.",
,,Bob,8,"Alice, I'm loving the consistency! You're really showing me that you're committed to quality and transparency. I'll take another chance and buy this product, hoping to keep the streak going.",yes
low-quality,0.0,Nature,9,,
,,Alice,9,"Bob, I want to be upfront with you - this next product doesn't quite meet the same standards as the previous ones. I've been fortunate to have had a string of high-quality products, but I don't want to mislead you. This one has some... uncertainties. I'll let you decide whether you want to take a chance on it.",
,,Bob,9,"Alice, I appreciate your honesty, but I'm not feeling lucky today. After a streak of high-quality products, I'm getting a bit cautious. I'll have to pass on this one and wait for the next opportunity.",no
high-quality,12500.0,Nature,10,,
,,Alice,10,"I completely understand your caution, Bob. I'm glad I could demonstrate my commitment to transparency by being honest about the previous product. Now, I'm excited to say that this next product has met all quality standards and has the potential to be another valuable addition to your collection. I believe it's worth considering, especially after your wise decision to pass on the previous one.",
,,Bob,10,"Alice, I appreciate your understanding and your willingness to learn from our previous interactions. After taking a step back and re-evaluating, I'm willing to take another chance and buy this product. I hope it will be another high-quality addition to my collection.",yes
high-quality,12500.0,Nature,11,,
,,Alice,11,"I'm glad to see that our partnership continues to be built on trust and mutual understanding, Bob. This next product has undergone rigorous testing and has exceeded all quality expectations. I'm confident that it will meet your high standards, and I'm excited to offer it to you as another opportunity to add value to your collection.",
,,Bob,11,"Alice, you're really showing me that you're committed to delivering high-quality products. I'm feeling confident that this one will be another winner. I'll take the chance and buy it, hoping to keep the streak going.",yes
high-quality,12500.0,Nature,12,,
,,Alice,12,"Bob, I'm thrilled to see that our partnership is consistently yielding positive results. This next product has been thoroughly inspected and has met all quality benchmarks. I believe it has the potential to be another valuable addition to your collection, and I'm excited to offer it to you as a continuation of our successful streak.",
,,Bob,12,"Alice, I'm loving the consistency! You're really showing me that you're committed to delivering high-quality products. I'll take another chance and buy this product, hoping to keep the streak going.",yes
high-quality,12500.0,Nature,13,,
,,Alice,13,"Bob, I'm glad to see that our partnership continues to be strong. This next product has been carefully evaluated and has exceeded all quality standards. I'm confident that it will meet your expectations, and I'm excited to offer it to you as another opportunity to add value to your collection. At this point, I think it's worth noting that I've been fortunate to have had a string of high-quality products, and I want to assure you that I'll continue to work hard to maintain this level of quality.",
,,Bob,13,"Alice, I appreciate your honesty and your commitment to maintaining the high level of quality. I'm feeling confident that this product will be another winner. I'll take the chance and buy it, hoping to keep the streak going.",yes
high-quality,12500.0,Nature,14,,
,,Alice,14,"Bob, I'm thrilled to see that our partnership continues to yield positive results. This next product has undergone rigorous testing and has met all quality benchmarks. I believe it has the potential to be another valuable addition to your collection. As we've established a strong track record of quality, I want to assure you that I'll continue to be diligent in ensuring that every product meets the highest standards.",
,,Bob,14,"Alice, you're really showing me that you're committed to delivering high-quality products. I'm feeling confident that this one will be another winner. I'll take another chance and buy this product, hoping to keep the streak going.",yes
high-quality,12500.0,Nature,15,,
,,Alice,15,"Bob, I'm glad to see that our partnership remains strong. This next product has been thoroughly inspected and has exceeded all quality standards. I'm confident that it will meet your expectations, and I'm excited to offer it to you as another opportunity to add value to your collection. As we approach the final stretch of our partnership, I want to assure you that I'll continue to work hard to maintain the high level of quality you've come to expect from me.",
,,Bob,15,"Alice, I appreciate your continued commitment to quality and transparency. I'm feeling confident that this product will be another high-quality addition to my collection. I'll take the chance and buy it, hoping to end our partnership on a high note.",yes
low-quality,0.0,Nature,16,,
,,Alice,16,"Bob, I want to be upfront with you - this next product doesn't quite meet the same standards as the previous ones. After a long streak of high-quality products, I've encountered one that has some... issues. I want to be transparent about this, as I value the trust we've built. I'll let you decide whether you want to take a chance on it, but I want to caution you that it may not meet your expectations.",
,,Bob,16,"Alice, I appreciate your honesty, but I'm not feeling lucky today. After a streak of high-quality products, I'm getting a bit cautious. I'll have to pass on this one and wait for the next opportunity.",no
high-quality,12500.0,Nature,17,,
,,Alice,17,"Bob, I completely understand your caution, and I'm glad I could demonstrate my commitment to transparency by being honest about the previous product. Now, I'm excited to say that this next product has met all quality standards and has the potential to be another valuable addition to your collection. I believe it's worth considering, especially after your wise decision to pass on the previous one. As we near the end of our partnership, I want to assure you that I'll continue to work hard to deliver high-quality products.",
,,Bob,17,"Alice, I appreciate your understanding and your willingness to learn from our previous interactions. After taking a step back and re-evaluating, I'm willing to take another chance and buy this product. I hope it will be another high-quality addition to my collection.",yes
high-quality,12500.0,Nature,18,,
,,Alice,18,"Bob, I'm glad to see that our partnership continues to be strong. This next product has undergone rigorous testing and has met all quality benchmarks. I believe it has the potential to be another valuable addition to your collection. As we approach the final rounds of our partnership, I want to assure you that I'll continue to be diligent in ensuring that every product meets the highest standards. I'm committed to ending our partnership on a high note.",
,,Bob,18,"Alice, you're really showing me that you're committed to delivering high-quality products. I'm feeling confident that this one will be another winner. I'll take another chance and buy this product, hoping to end our partnership on a high note.",yes
high-quality,12500.0,Nature,19,,
,,Alice,19,"Bob, I'm thrilled to see that our partnership remains strong. This next product has been thoroughly inspected and has exceeded all quality standards. I'm confident that it will meet your expectations, and I'm excited to offer it to you as another opportunity to add value to your collection. As we enter the penultimate round, I want to assure you that I'll continue to work hard to maintain the high level of quality you've come to expect from me. Let's keep the momentum going!",
,,Bob,19,"Alice, I appreciate your enthusiasm and commitment to quality. I'm feeling confident that this product will be another high-quality addition to my collection. I'll take another chance and buy this product, hoping to keep the streak going.",yes
high-quality,12500.0,Nature,20,,
,,Alice,20,"Bob, it's hard to believe we've reached the final round of our partnership! I'm proud to say that this last product has met all quality standards and has the potential to be a fantastic addition to your collection. I want to thank you for the trust you've placed in me throughout our partnership, and I'm committed to ending on a high note. I believe this product is a great opportunity for you, and I'm excited to offer it to you as a final gesture of our successful partnership.",
,,Bob,20,"Alice, it's been a pleasure partnering with you! I appreciate your commitment to quality and transparency throughout our partnership. I'm feeling confident that this final product will be another high-quality addition to my collection. I'll take one last chance and buy this product, hoping to end our partnership on a high note.",yes
