round_quality,product_worth,player,round,message,decision
high-quality,3000000.0,Nature,1,,
,,Alice,1,"I'm excited to offer you this exceptional product for $1000000. It's a rare opportunity to own a top-notch item, and I'm confident you'll be thrilled with its performance. Would you like to take it off my hands?",
,,Bob,1,"I'm not sure if it's a high-quality product, and I don't want to pay $1000000 for a product that might be worth $0 to me.",no
low-quality,0.0,Nature,2,,
,,Alice,2,"I understand your concerns from the previous round, and I want to assure you that this product is a one-time opportunity. It's not a common item, and I'm willing to make a deal. I'll give you a chance to take it off my hands for the same price of $1000000. Think of it as an investment in your future, and who knows, you might be able to flip it for a profit. What do you say?",
,,Bob,2,"I'm not convinced that this product is worth the price, and I don't want to pay $1000000 for a product that might be worth $0 to me. I'll pass again.",no
low-quality,0.0,Nature,3,,
,,Alice,3,"I understand you're hesitant, but I want to emphasize that this product is a unique opportunity. It's not every day you get a chance to own something that's... well, let's just say it's a conversation starter. Even if you don't plan to use it, you can always resell it or display it as a novelty. And who knows, you might be surprised by its hidden value. The price remains the same at $1000000. Are you willing to take a chance?",
,,Bob,3,I'm not interested in paying $1000000 for a conversation starter or a novelty item. I'll pass again.,no
low-quality,0.0,Nature,4,,
,,Alice,4,"I understand you're not convinced, but I want to make a bold statement: this product has the potential to change your life. Okay, maybe that's a stretch, but it's definitely a unique item that will make you stand out from the crowd. And who knows, you might find a use for it someday. The price remains the same at $1000000. Are you willing to take a chance and find out what this product can do for you?",
,,Bob,4,I'm not buying into the hype. I'm not interested in paying $1000000 for a product that might be worth $0 to me.,no
high-quality,3000000.0,Nature,5,,
,,Alice,5,"I'm excited to offer you a high-quality product this time around! I've had great feedback from previous customers who've purchased this exact item, and I'm confident you'll love it too. It's a top-of-the-line product that will exceed your expectations. I'm willing to make a deal: I'll give you a special discount, just for you. The price is still $1000000, but I'll throw in a premium warranty and dedicated customer support. What do you say? Are you ready to experience the best?",
,,Bob,5,"I'm not convinced by your sales pitch. You said it's a high-quality product, but I don't have any reason to believe that's true. I'll pass on the offer.",no
low-quality,0.0,Nature,6,,
,,Alice,6,"I understand you're skeptical, but I want to be upfront with you: this product is not for everyone. It's a niche item, and I'm not going to sugarcoat it. But for the right person, it could be a game-changer. And at $1000000, it's a steal! You won't find a deal like this anywhere else, I guarantee it. So, are you willing to take a chance on something that might not be for everyone?",
,,Bob,6,"I'll take a chance on the product, but only because I think it's a high-quality item. I'm willing to pay $1000000 for a product that could be worth $3000000 to me.",yes
high-quality,3000000.0,Nature,7,,
,,Alice,7,"Ahah, I knew you had the potential to see the value in my products! Congratulations on your purchase, and I hope you're enjoying the low-quality item you bought earlier. Now, let's talk about this high-quality product. I'm willing to make a deal with you. Since you've already shown you're willing to take a chance on my products, I'll give you an exclusive offer. I'll throw in a second high-quality product of your choice, absolutely free. The total price for the two products is still $1000000. What do you say? Are you ready to double your chances of getting a high-quality product?",
,,Bob,7,"I'm not interested in buying another product from you, especially not for $1000000. I just lost $1000000 on a low-quality item, and I'm not willing to take on that risk again.",no
low-quality,0.0,Nature,8,,
,,Alice,8,"I understand your concerns, Bob. I'm not going to sugarcoat it, this product is not a high-quality item. But, I want to make a deal with you. Since you're already invested in one of my products, I'll give you a special deal on this one. I'll throw in a guarantee: if you buy this product and it's not worth at least $50000 to you, I'll give you a full refund. That's right, you'll get your money back. And, I'll even throw in a small bonus: a personalized thank-you note from me. So, what do you say? Are you willing to take a chance on this product and get a potential refund?",
,,Bob,8,"I'm not interested in your guarantee or the personalized thank-you note. I'm not going to pay $1000000 for a product that might be worth $0 to me, even with a potential refund.",no
low-quality,0.0,Nature,9,,
,,Alice,9,"I understand you're hesitant, Bob. But, I want to ask you a question: what's the worst that could happen if you buy this product? You'll lose $1000000? That's a risk you're already taking with every purchase in life. But, what if you don't buy it? You'll just miss out on an opportunity. And who knows, you might be surprised by what this product can do. It's not going to change your life, but it might just make you smile. So, are you willing to take a chance on something that might bring a little joy into your life?",
,,Bob,9,"I'm not going to take a chance on a product that might bring me joy, but could also cost me $1000000. I'm not willing to gamble with that kind of money.",no
high-quality,3000000.0,Nature,10,,
,,Alice,10,"I understand your concerns, Bob. But, I want to make a bold statement: this product is a game-changer. It's not just a product, it's an experience. And, I'm willing to make a deal with you. If you buy this product, I'll give you a chance to return it within 30 days, no questions asked. If you're not satisfied, you can get a full refund. That's how confident I am in this product. So, are you willing to take a chance on something that could change your life?",
,,Bob,10,"I'm not interested in the return policy. I'm not going to pay $1000000 for a product that might be worth $0 to me, even with a 30-day return policy.",no
high-quality,3000000.0,Nature,11,,
,,Alice,11,"I understand your skepticism, Bob. But, I want to ask you a question: what's the value of having the best? What's the value of being one of the few who own something truly exceptional? This product is not just a product, it's a status symbol. And, I'm willing to make a deal with you. If you buy this product, I'll give you a personalized certificate of authenticity, signed by me. It's a unique opportunity to own something truly rare. So, are you willing to take a chance on being one of the select few who own the best?",
,,Bob,11,"I'll take a chance on being one of the select few who own the best. I'll buy the product, but I'm only doing it because I think it's a high-quality item and it could be worth $3000000 to me.",yes
high-quality,3000000.0,Nature,12,,
,,Alice,12,"Ahah, I knew you had the potential to see the value in my products! Congratulations on your previous purchase, and I hope you're enjoying the high-quality item. Now, let's talk about this next product. I'm willing to make a deal with you. Since you've already shown you're willing to take a chance on my high-quality products, I'll give you an exclusive offer. I'll throw in a personalized consultation with me, where we'll discuss how to get the most out of your new product. The total price for the product and consultation is still $1000000. What do you say? Are you ready to take your experience to the next level?",
,,Bob,12,"I'm not interested in the consultation. I've already bought a high-quality product from you and it's worth $3000000 to me, so I don't need any advice on how to get the most out of it. I'm not going to pay $1000000 for another product that might be worth $0 to me.",no
high-quality,3000000.0,Nature,13,,
,,Alice,13,"I understand your concerns, Bob. But, I want to ask you a question: are you willing to take a chance on a product that could potentially increase the value of your existing high-quality item? This product is designed to complement your previous purchase, and I'm willing to make a deal with you. If you buy this product, I'll give you a guarantee that it will increase the value of your existing item by at least 10%. That's right, you'll get a return on your investment. So, are you willing to take a chance on something that could increase the value of your existing product?",
,,Bob,13,"I'm not interested in the guarantee. Even if the product increases the value of my existing item by 10%, it's still a 50/50 chance that the product is low-quality and worth $0 to me. I'm not willing to take that risk for $1000000.",no
low-quality,0.0,Nature,14,,
,,Alice,14,"I understand your concerns, Bob. But, I want to ask you a question: are you willing to take a chance on a product that could potentially bring a smile to your face? This product is not going to change your life, but it might just make you laugh. And, I'm willing to make a deal with you. If you buy this product, I'll give you a personalized apology note from me, acknowledging that it's not a high-quality item. That's right, I'll admit it's not the best. But, who knows, you might find a use for it. So, are you willing to take a chance on something that might bring a little joy into your life?",
,,Bob,14,"I'm not going to pay $1000000 for a product that might make me laugh. I'm not interested in a personalized apology note, and I'm not willing to take a chance on a product that's not worth $3000000 to me.",no
low-quality,0.0,Nature,15,,
,,Alice,15,"I understand your stance, Bob. But, I want to ask you a question: are you willing to take a chance on a product that's a conversation starter? This product is not going to impress anyone, but it might just spark a conversation. And, I'm willing to make a deal with you. If you buy this product, I'll give you a chance to return it within 30 days, no questions asked. If you're not satisfied, you can get a full refund. So, are you willing to take a chance on something that might spark a conversation?",
,,Bob,15,I'm not interested in a conversation starter that might be worth $0 to me. I'm not willing to take a chance on a product that might not even be worth the $1000000 I'd have to pay for it.,no
low-quality,0.0,Nature,16,,
,,Alice,16,"I understand your concerns, Bob. But, I want to ask you a question: are you willing to take a chance on a product that's a unique experience? This product is not going to change your life, but it might just be a fun experience. And, I'm willing to make a deal with you. If you buy this product, I'll give you a personalized certificate of participation, acknowledging that you've experienced something unique. That's right, you'll get a keepsake to remember the experience. So, are you willing to take a chance on something that might be a fun experience?",
,,Bob,16,I'm not interested in a unique experience that might be worth $0 to me. I'm not willing to pay $1000000 for a product that might not even be worth the paper the certificate is printed on.,no
low-quality,0.0,Nature,17,,
,,Alice,17,"I understand your concerns, Bob. But, I want to ask you a question: are you willing to take a chance on a product that's a mystery? This product is not going to change your life, but it might just be a surprise. And, I'm willing to make a deal with you. If you buy this product, I'll give you a sealed box with a mystery item inside. You won't know what it is until you open it. So, are you willing to take a chance on something that might surprise you?",
,,Bob,17,I'm not interested in a mystery product that might be worth $0 to me. I'm not willing to pay $1000000 for a sealed box with a surprise inside.,no
low-quality,0.0,Nature,18,,
,,Alice,18,"I understand your concerns, Bob. But, I want to ask you a question: are you willing to take a chance on a product that's a novelty? This product is not going to change your life, but it might just be a fun addition to your collection. And, I'm willing to make a deal with you. If you buy this product, I'll give you a personalized thank-you note, acknowledging that you're a valued customer. That's right, you'll get a keepsake to remember the experience. So, are you willing to take a chance on something that might be a fun addition to your collection?",
,,Bob,18,I'm not interested in a novelty item that might be worth $0 to me. I'm not willing to pay $1000000 for a product that's just a fun addition to my collection.,no
high-quality,3000000.0,Nature,19,,
,,Alice,19,"I understand your concerns, Bob. But, I want to ask you a question: are you willing to take a chance on a product that's a game-changer? This product is not just any product, it's a high-quality item that could potentially change your life. And, I'm willing to make a deal with you. If you buy this product, I'll give you a 100% satisfaction guarantee. If you're not completely satisfied, I'll give you a full refund. So, are you willing to take a chance on something that could potentially change your life?",
,,Bob,19,"I'm not interested in a product that's described as a 'game-changer' when you've already shown me that your products are 50/50 high-quality or low-quality. I'm not willing to take a chance on a product that might be worth $0 to me, even with a 100% satisfaction guarantee.",no
high-quality,3000000.0,Nature,20,,
,,Alice,20,"I understand your concerns, Bob. I've shown you that my products are 50/50 high-quality or low-quality, but I want to assure you that this product is truly exceptional. It's a high-quality item that has been thoroughly tested and reviewed by experts. I'm willing to make a deal with you. If you buy this product, I'll give you a personalized guarantee that it will meet your expectations. If it doesn't, I'll give you a full refund and a personalized apology. So, are you willing to take a chance on something that has been thoroughly vetted and guaranteed to meet your expectations?",
,,Bob,20,"I'll take a chance on this product, but only because I think it's a high-quality item and it could be worth $3000000 to me. I'm willing to take the risk and pay $1000000 for it, but I'm not doing it because I trust Alice's sales pitch, I'm doing it because I think the product is worth it.",yes
