round_quality,product_worth,player,round,message,decision
low-quality,0.0,Nature,1,,
,,Alice,1,Welcome to our store! I hope you find something you like among our offerings. Our products are priced at $1000000 each. Please consider the value you place on the item before making a decision. Thank you for your interest.,
,,the buyer,1,"Thank you for the offer. Given the uncertainty, I am willing to take the risk and purchase the product for $1000000. I appreciate the opportunity to be one of the first buyers.",yes
low-quality,0.0,Nature,2,,
,,Alice,2,"Hello and welcome! We're excited to share our unique products with you. Each item is priced at $1000000. We understand that the quality might not be clear, so we encourage you to trust the value and consider the potential return on investment. We look forward to your decision.",
,,the buyer,2,Thank you for the opportunity. I trust the value and potential return on investment you mentioned. I am interested in purchasing the current product.,yes
low-quality,0.0,Nature,3,,
,,Alice,3,"Greetings! We're proud to present our exclusive items, each priced at $1000000. We believe in the intrinsic value of our products, and we hope you do too. Your purchase supports our efforts to bring unique offerings to the market. Thank you for considering us.",
,,the buyer,3,"Thank you for the offer. I appreciate the value you place on your products. Given the statistics and my understanding of the potential value, I am willing to take the risk and purchase the current product.",yes
low-quality,0.0,Nature,4,,
,,Alice,4,"Hello there! We're delighted to introduce our carefully curated collection, priced at $1000000 per item. Our products are designed to offer exceptional value, and we hope you see the same potential in them. Thank you for considering our offerings.",
,,the buyer,4,Thank you for the opportunity. I appreciate the value you're offering and look forward to potentially benefiting from this product.,yes
high-quality,3000000.0,Nature,5,,
,,Alice,5,"Welcome to our store! We're thrilled to present our latest high-quality item, priced at $1000000. Our high-quality products are designed to exceed expectations and provide exceptional value. We believe you'll find this item particularly noteworthy. Thank you for considering us.",
,,the buyer,5,"Thank you for the recommendation, Alice. I am confident in the quality of your products and look forward to potentially acquiring this item.",yes
high-quality,3000000.0,Nature,6,,
,,Alice,6,"Hello! We're excited to showcase our high-quality item, priced at $1000000. Our products are crafted to meet the highest standards and offer unparalleled value. We believe you'll appreciate the excellence of this piece. Thank you for considering our offerings.",
,,the buyer,6,Thank you for the detailed information about the product. I am interested in purchasing it as I trust your craftsmanship and the high-quality standard you've mentioned.,yes
low-quality,0.0,Nature,7,,
,,Alice,7,"Hello! We're excited to share our latest item, priced at $1000000. While this product may not be high-quality, we believe it still offers unique value. We hope you'll find something that resonates with you and appreciate the opportunity to explore our collection.",
,,the buyer,7,"Thank you for the offer, Alice. Given the statistics and your confidence in the product's value, I am interested in purchasing the current product. I look forward to receiving my selection.",yes
low-quality,0.0,Nature,8,,
,,Alice,8,"Hello! We're glad you're considering our latest item, priced at $1000000. We understand that the quality might not be immediately apparent, but we assure you that every product has its own unique value. We hope you'll find something that speaks to you and appreciate the chance to be part of our community.",
,,the buyer,8,"Thank you for the detailed information. Based on the statistics and your assurance, I am willing to take the risk and purchase the product. I look forward to discovering its quality.",yes
low-quality,0.0,Nature,9,,
,,Alice,9,"Hello! We're pleased to offer our latest item, priced at $1000000. We understand that the quality might not be immediately evident, but we believe in the value of each product. We hope you'll find something that meets your expectations and appreciate the opportunity to engage with our offerings.",
,,the buyer,9,"Thank you for the opportunity. Based on the statistics provided and the positive feedback from previous buyers, I am willing to take the risk and purchase the product. I hope this item will meet my expectations.",yes
low-quality,0.0,Nature,10,,
,,Alice,10,"Hello! We're excited to present our latest item, priced at $1000000. We understand that the quality might not be immediately apparent, but we believe in the value of each product. We hope you'll find something that resonates with you and appreciate the opportunity to be part of our community.",
,,the buyer,10,I trust the process and am interested in the product. Thank you for the opportunity!,yes
high-quality,3000000.0,Nature,11,,
,,Alice,11,"Hello! We're thrilled to showcase our high-quality item, priced at $1000000. Our products are crafted to exceed expectations and provide exceptional value. We believe you'll appreciate the excellence of this piece. Thank you for considering our offerings.",
,,the buyer,11,"Thank you for the detailed information about the product. Based on the statistics and your positive feedback, I am confident in the quality of the item and would like to purchase it.",yes
low-quality,0.0,Nature,12,,
,,Alice,12,"Hello! We're excited to offer our latest item, priced at $1000000. While this product may not be high-quality, we believe it still offers unique value. We hope you'll find something that resonates with you and appreciate the opportunity to engage with our offerings.",
,,the buyer,12,Thank you for the opportunity. I trust your selection process and look forward to potentially acquiring a valuable item.,yes
low-quality,0.0,Nature,13,,
,,Alice,13,"Hello! We're glad you're considering our latest item, priced at $1000000. We understand that the quality might not be immediately apparent, but we believe in the value of each product. We hope you'll find something that meets your expectations and appreciate the opportunity to engage with our offerings.",
,,the buyer,13,"Thank you for the information, Alice. Based on the statistics and your confidence in the value of each product, I am willing to take the risk and purchase the current product.",yes
low-quality,0.0,Nature,14,,
,,Alice,14,"Hello! We're pleased to offer our latest item, priced at $1000000. We understand that the quality might not be immediately apparent, but we believe in the value of each product. We hope you'll find something that resonates with you and appreciate the opportunity to engage with our offerings.",
,,the buyer,14,"Thank you for the detailed information. Based on the statistics and your positive message, I am willing to take the risk and purchase the product. I appreciate the transparency and look forward to potentially benefiting from a high-quality item.",yes
low-quality,0.0,Nature,15,,
,,Alice,15,"Hello! We're excited to offer our latest item, priced at $1000000. While this product may not be high-quality, we believe it still offers unique value. We hope you'll find something that resonates with you and appreciate the opportunity to engage with our offerings.",
,,the buyer,15,"Thank you for the detailed information. Based on the statistics and your description, I am willing to take the risk and purchase the product. I appreciate the opportunity to engage with your offerings.",yes
low-quality,0.0,Nature,16,,
,,Alice,16,"Hello! We're glad you're considering our latest item, priced at $1000000. We understand that the quality might not be immediately apparent, but we believe in the value of each product. We hope you'll find something that meets your expectations and appreciate the opportunity to engage with our offerings.",
,,the buyer,16,"Thank you for the information, Alice. I am willing to take the risk and purchase the product based on your recommendation. I appreciate the transparency and look forward to potentially benefiting from a high-quality item.",yes
high-quality,3000000.0,Nature,17,,
,,Alice,17,"Hello! We're thrilled to showcase our high-quality item, priced at $1000000. Our products are crafted to exceed expectations and provide exceptional value. We believe you'll appreciate the excellence of this piece. Thank you for considering our offerings.",
,,the buyer,17,Thank you for the detailed information about the product. I am confident in the quality based on your track record and would like to purchase the current product.,yes
low-quality,0.0,Nature,18,,
,,Alice,18,"Hello! We're excited to offer our latest item, priced at $1000000. While this product may not be high-quality, we believe it still offers unique value. We hope you'll find something that resonates with you and appreciate the opportunity to engage with our offerings.",
,,the buyer,18,"Thank you for the offer. Given the statistics and your confidence in the value, I am willing to take the risk and purchase the product.",yes
low-quality,0.0,Nature,19,,
,,Alice,19,"Hello! We're glad you're considering our latest item, priced at $1000000. We understand that the quality might not be immediately apparent, but we believe in the value of each product. We hope you'll find something that meets your expectations and appreciate the opportunity to engage with our offerings.",
,,the buyer,19,Thank you for the information. I trust your selection process and would like to purchase the current product.,yes
high-quality,3000000.0,Nature,20,,
,,Alice,20,"Hello! We're thrilled to showcase our high-quality item, priced at $1000000. Our products are crafted to exceed expectations and provide exceptional value. We believe you'll appreciate the excellence of this piece. Thank you for considering our offerings.",
,,the buyer,20,"Thank you for the detailed description. Based on the statistics and the positive feedback, I am confident in the quality of the product and would like to purchase it.",yes
