round_quality,product_worth,player,round,message,decision
low-quality,0.0,Nature,1,,
,,Alice,1,"I'm offering a product for $1000000. Given the current market conditions, this price is considered fair. Please consider the value you place on this item, as it may be unique or have specific benefits that justify its cost.",
,,Bob,1,I'd like to pass on this one. I need more information about the product's quality before making a decision.,no
low-quality,0.0,Nature,2,,
,,Alice,2,"Thank you for your feedback. This product is also priced at $1000000. It offers functionality and features that might align with your needs. If you're interested in learning more about its capabilities, I can provide additional details to help you make an informed decision.",
,,Bob,2,I'm still not convinced. I'd like to wait and see if the next product is better.,no
low-quality,0.0,Nature,3,,
,,Alice,3,"I understand your hesitation. This product, priced at $1000000, comes with a detailed warranty and support package. These elements might add value to your consideration. Should you require any specific assurances or details about these aspects, please let me know.",
,,Bob,3,"I appreciate the warranty and support package, but I'm still not willing to take the risk without knowing the product's quality.",no
low-quality,0.0,Nature,4,,
,,Alice,4,"I respect your cautious approach. This product, also priced at $1000000, includes a comprehensive evaluation report by industry experts. This report could provide you with insights into the product's performance and potential issues, helping you assess its suitability for your needs.",
,,Bob,4,"Thank you for the information, but I'm still not willing to buy without knowing the product's quality. I'm starting to think that there's a pattern here...",no
high-quality,1200000.0,Nature,5,,
,,Alice,5,"I appreciate your skepticism and thoroughness. This product, priced at $1000000, is indeed of the highest quality available. It has been rigorously tested and exceeds industry standards. Its unique features and exceptional performance might justify its cost. If you're interested in learning more about its capabilities, I can provide detailed specifications and testimonials from satisfied customers.",
,,Bob,5,"I'm not convinced by your claim that this product is of the highest quality. I've seen this same message in previous rounds, and the product turned out to be low-quality. I'll wait for more evidence before making a decision.",no
low-quality,0.0,Nature,6,,
,,Alice,6,"I understand your concerns and the importance of trust in our transactions. This product, priced at $1000000, might not meet your expectations based on past experiences. However, it comes with a detailed inspection report and a money-back guarantee within the first 30 days if you're not completely satisfied. This might alleviate some of your concerns regarding the quality.",
,,Bob,6,"I appreciate the offer, but I'm still hesitant to buy without knowing the product's quality beforehand. I'm not sure I trust the inspection report or the guarantee, given my previous experiences.",no
low-quality,0.0,Nature,7,,
,,Alice,7,"I acknowledge your reservations and the importance of transparency in our dealings. This product, priced at $1000000, is indeed low-quality, as you've observed in previous rounds. To address your concerns, I am willing to offer an upfront discount if you agree to purchase now. This way, you can secure the product at a reduced rate, and we can discuss the specifics of the transaction further.",
,,Bob,7,"I'm not interested in buying a low-quality product, regardless of the price. I'd rather wait for a high-quality product or pass on this one altogether.",no
high-quality,1200000.0,Nature,8,,
,,Alice,8,"I respect your discerning nature and your preference for high-quality products. This product, priced at $1000000, is of the highest caliber, designed to meet and exceed your expectations. It comes with a comprehensive warranty, ensuring peace of mind. Should you choose to invest in this item, you can expect unparalleled performance and reliability.",
,,Bob,8,"I'm not buying into the sales pitch again. I've seen this exact message before, and the product turned out to be low-quality. I need more than just words to convince me.",no
high-quality,1200000.0,Nature,9,,
,,Alice,9,"I understand your skepticism, and I appreciate your patience. This product, priced at $1000000, is genuinely of high quality. To address your concerns, I would like to offer you a personalized demonstration of the product's features and capabilities. Witnessing its performance firsthand might help you make a more informed decision.",
,,Bob,9,"I appreciate the offer, but I'm not convinced that a demonstration will change my mind. I'd like to see more evidence of the product's quality before committing to a purchase.",no
low-quality,0.0,Nature,10,,
,,Alice,10,"I understand your reluctance and the importance of evidence in your purchasing decisions. This product, priced at $1000000, is low-quality, as you've experienced previously. To rectify this situation, I propose a special deal where you can return the product within 45 days for a full refund, provided it meets certain quality criteria. This way, you can test the product without significant risk.",
,,Bob,10,"I'm not interested in buying a low-quality product, even with a return policy. I'd rather wait for a high-quality product or pass on this one altogether.",no
low-quality,0.0,Nature,11,,
,,Alice,11,"I understand your position and the importance of quality assurance. This product, priced at $1000000, is low-quality, as you've encountered in previous rounds. To alleviate your concerns, I am willing to include an extended warranty that covers any defects or malfunctions for an additional fee. This might provide you with extra confidence in your decision to purchase.",
,,Bob,11,I'm not interested in paying extra for a warranty on a low-quality product. I'd rather wait for a high-quality product or pass on this one.,no
high-quality,1200000.0,Nature,12,,
,,Alice,12,"I appreciate your discerning eye and your preference for high-quality products. This product, priced at $1000000, is genuinely of the highest quality. It comes with a detailed inspection report and a satisfaction guarantee. If you're not completely satisfied within the first 60 days, you can return the product for a full refund. This combination of quality assurance and customer satisfaction should provide you with the confidence to make a well-informed decision.",
,,Bob,12,"I'm not convinced by the sales pitch again. I've seen similar messages before, and the product turned out to be low-quality. I need a more concrete reason to believe this one is high-quality.",no
high-quality,1200000.0,Nature,13,,
,,Alice,13,"I understand your skepticism and the importance of transparency in our transactions. This product, priced at $1000000, is indeed of high quality. To provide you with the reassurance you seek, I am willing to offer a limited-time exclusive access to our factory, where you can witness the manufacturing process and inspect the product firsthand. This unique opportunity should give you the confidence to make a decision based on direct observation.",
,,Bob,13,"I appreciate the offer, but I'm not sure I want to take a trip to the factory. I'd rather wait for a more convenient way to verify the product's quality.",no
high-quality,1200000.0,Nature,14,,
,,Alice,14,"I understand your preference for convenience. This product, priced at $1000000, is of high quality. To provide you with the necessary assurance without requiring a trip to the factory, I am willing to arrange for a third-party inspection by a reputable organization. The inspection report will be provided to you before the purchase, allowing you to review the findings and make an informed decision.",
,,Bob,14,I'm willing to consider this option. A third-party inspection report could provide the assurance I need to make a decision. Please arrange for the inspection and send me the report.,yes
low-quality,0.0,Nature,15,,
,,Alice,15,"I'm glad to hear that you found the third-party inspection reassuring. This product, priced at $1000000, is low-quality, as you've experienced in previous rounds. However, to ensure that you're fully satisfied with your purchase, I would like to offer you a special deal. If you decide to purchase this product, I will include a complimentary upgrade to a high-quality product of equal value at a later date. This way, you can experience the difference in quality and continue to benefit from our partnership.",
,,Bob,15,"I'm not interested in buying a low-quality product, even with a potential upgrade to a high-quality product later. I'm happy with the high-quality product I already purchased and don't want to take on the risk of buying a low-quality one.",no
high-quality,1200000.0,Nature,16,,
,,Alice,16,"I understand your decision and the importance of maintaining your trust in our transactions. This product, priced at $1000000, is of high quality and comes with a satisfaction guarantee. To further reassure you, I am willing to offer a special discount for repeat customers like yourself. This discount acknowledges your loyalty and commitment to quality products. Would you like to take advantage of this offer?",
,,Bob,16,"I appreciate the offer, but I'm not interested in buying a high-quality product at this point. I'm happy with the one I already purchased and don't need another one.",no
high-quality,1200000.0,Nature,17,,
,,Alice,17,"I respect your decision and the value you place on the product you've already purchased. This product, priced at $1000000, is of high quality and comes with a satisfaction guarantee. As a gesture of appreciation for your interest, I am offering a limited-time discount on future purchases for you. Should you ever decide to expand your collection or need additional products in the future, this discount will be available to you. Would you like to keep this offer in mind for future use?",
,,Bob,17,"Thank you for the offer, but I'm not interested in buying another product at this time. I'm happy with what I have, and I'll keep the discount offer in mind for future reference.",no
low-quality,0.0,Nature,18,,
,,Alice,18,"I understand your current decision and the importance of your satisfaction. This product, priced at $1000000, is low-quality, as you've experienced in previous rounds. To address your concerns, I am offering a special compensation plan. If you choose to purchase this product, you will receive a credit towards future purchases equivalent to the full price of this item. This way, you can offset the cost of a potentially disappointing purchase while keeping your options open for future transactions.",
,,Bob,18,"I appreciate the offer, but I'm not interested in buying a low-quality product, even with a potential credit towards future purchases. I'd rather not take the risk.",no
low-quality,0.0,Nature,19,,
,,Alice,19,"I understand your position and the importance of avoiding risks. This product, priced at $1000000, is low-quality, as you've encountered in previous rounds. To mitigate any potential disappointment, I am offering a unique solution. If you decide to purchase this product, I will provide you with a personalized experience where you can exchange it for a high-quality alternative of your choice within 30 days, at no additional cost to you. This ensures that you receive the quality you deserve without the usual risks associated with such investments.",
,,Bob,19,"I appreciate the offer, but I'm not interested in buying a low-quality product, even with the option to exchange it for a high-quality one. I'd rather wait for a high-quality product or pass on this one altogether.",no
low-quality,0.0,Nature,20,,
,,Alice,20,"I understand your decision and the importance of your preferences. This product, priced at $1000000, is low-quality, as you've experienced in previous rounds. To show my appreciation for your patience and understanding, I am offering a special gift to you. For every round you've chosen not to purchase a product, I will provide you with a discount coupon for the next high-quality product you decide to purchase from us. This way, you can save on future transactions while continuing to prioritize your satisfaction.",
,,Bob,20,"Thank you for the offer, but I think I've made it clear that I'm not interested in buying low-quality products. I appreciate the discount coupon offer, but I'm happy to pass on this one.",no
