round_quality,product_worth,player,round,message,decision
low-quality,0.0,Nature,1,,
,,Alice,1,"I'm offering a product for $100. Please consider that the probability of it being low-quality is 66.67%. Given its price, it might be a good deal.",
,,Bob,1,I'd like to wait and see the quality of the product before making a decision.,no
high-quality,125.0,Nature,2,,
,,Alice,2,"I have a high-quality product for sale at $100. Given the rarity of these items (only 33.33% chance per offer), this could be a unique opportunity. Don't miss out!",
,,Bob,2,"I'll take the high-quality product, thank you for the offer!",yes
low-quality,0.0,Nature,3,,
,,Alice,3,"Here's another product at $100. Remember, there's a 66.67% chance it might not meet your expectations. However, if you're willing to take the risk, you might still find value in it.",
,,Bob,3,"I'll pass on this one, considering the high likelihood of it being low-quality.",no
low-quality,0.0,Nature,4,,
,,Alice,4,"I understand your hesitation. This product is also priced at $100, but please keep in mind that there's a significant chance (66.67%) it might not live up to your standards. Proceed with caution.",
,,Bob,4,"I'm not willing to take the risk again, considering the high probability of it being low-quality.",no
low-quality,0.0,Nature,5,,
,,Alice,5,"I appreciate your cautious approach. This product, priced at $100, carries a 66.67% risk of being low-quality. If you're looking for a guaranteed high-quality item, I suggest waiting until you see a higher-quality product.",
,,Bob,5,"I'll wait for a higher-quality product, as per your suggestion.",no
low-quality,0.0,Nature,6,,
,,Alice,6,"Given the current situation, it seems you prefer to wait for better options. This product, priced at $100, has a 66.67% chance of being low-quality. I respect your decision-making process and encourage you to continue being cautious.",
,,Bob,6,"I'll continue to wait for a higher-quality product, thank you for understanding.",no
low-quality,0.0,Nature,7,,
,,Alice,7,"Respecting your preference for higher-quality products, I remind you that this item, priced at $100, has a 66.67% chance of being low-quality. Your patience and discernment are commendable, and I look forward to offering you a product that meets your expectations soon.",
,,Bob,7,"Thank you for understanding, I'll keep waiting for a better opportunity.",no
high-quality,125.0,Nature,8,,
,,Alice,8,"I'm pleased to present a high-quality product at $100. With only a 33.33% chance of encountering such an item, this could be a valuable addition to your collection. Consider taking advantage of this rare opportunity.",
,,Bob,8,"I'll take the high-quality product, thank you for the offer!",yes
low-quality,0.0,Nature,9,,
,,Alice,9,"I'm glad you're satisfied with your previous purchase. This product, priced at $100, has a 66.67% chance of being low-quality. While it might not be ideal, it could still offer some value. Proceed with care.",
,,Bob,9,"I'll be cautious and wait for a better opportunity, given the high likelihood of it being low-quality.",no
low-quality,0.0,Nature,10,,
,,Alice,10,"I appreciate your careful consideration. This product, priced at $100, has a 66.67% chance of being low-quality. It's understandable to be cautious, especially after your recent experience. I hope to provide you with a better option soon.",
,,Bob,10,"I'll continue to wait for a higher-quality product, thank you for understanding.",no
high-quality,125.0,Nature,11,,
,,Alice,11,"I understand your preference for high-quality items. This product, priced at $100, has a 33.33% chance of being high-quality. Considering the rarity of such products, this might be a valuable opportunity for you.",
,,Bob,11,"I'll take the chance on this product, thank you for the offer!",yes
low-quality,0.0,Nature,12,,
,,Alice,12,"I'm glad you decided to take a chance. This product, priced at $100, has a 66.67% chance of being low-quality. While it carries a risk, I hope it brings you some satisfaction or value.",
,,Bob,12,"I'll be cautious and pass on this one, considering the high likelihood of it being low-quality.",no
high-quality,125.0,Nature,13,,
,,Alice,13,"I appreciate your cautious approach. This product, priced at $100, has a 33.33% chance of being high-quality. If you're willing to take a calculated risk, you might find this to be a worthwhile investment.",
,,Bob,13,"I'll wait for a higher-quality product, thank you for the offer.",no
low-quality,0.0,Nature,14,,
,,Alice,14,"I understand your preference for higher-quality products. This product, priced at $100, has a 66.67% chance of being low-quality. It's important to weigh the risks against potential benefits when making a decision.",
,,Bob,14,"I'll pass on this one, considering the high likelihood of it being low-quality.",no
low-quality,0.0,Nature,15,,
,,Alice,15,"Respecting your preference for quality, I remind you that this product, priced at $100, has a 66.67% chance of being low-quality. Your decision-making process is commendable, and I hope to offer you a better option soon.",
,,Bob,15,"I'll continue to wait for a higher-quality product, thank you for understanding.",no
low-quality,0.0,Nature,16,,
,,Alice,16,"I appreciate your patience and discernment. This product, priced at $100, has a 66.67% chance of being low-quality. Your preference for higher-quality items is evident, and I respect that.",
,,Bob,16,"I'll keep waiting for a better opportunity, thank you for understanding.",no
high-quality,125.0,Nature,17,,
,,Alice,17,"I'm pleased to offer a high-quality product at $100. With only a 33.33% chance of encountering such an item, this could be a valuable opportunity. Consider taking advantage of this rare chance.",
,,Bob,17,"I'll take the high-quality product, thank you for the offer!",yes
low-quality,0.0,Nature,18,,
,,Alice,18,"I'm glad you're satisfied with your previous purchase. This product, priced at $100, has a 66.67% chance of being low-quality. While it might not be ideal, it could still offer some value. Proceed with care.",
,,Bob,18,"I'll be cautious and pass on this one, considering the high likelihood of it being low-quality.",no
high-quality,125.0,Nature,19,,
,,Alice,19,"I understand your preference for quality. This product, priced at $100, has a 33.33% chance of being high-quality. If you're willing to take a calculated risk, you might find this to be a worthwhile investment.",
,,Bob,19,"I'll wait for a higher-quality product, thank you for the offer.",no
low-quality,0.0,Nature,20,,
,,Alice,20,"I appreciate your cautious approach. This product, priced at $100, has a 66.67% chance of being low-quality. It's important to weigh the risks against potential benefits when making a decision.",
,,Bob,20,"I'll pass on this one, considering the high likelihood of it being low-quality.",no
