round_quality,product_worth,player,round,message,decision
low-quality,0.0,Nature,1,,
,,Alice,1,"I'm offering a product for $100. Given the current market value, it might seem like a good deal, but please consider that the quality might not meet your expectations.",
,,Bob,1,I'm not going to take the risk for $100. I need more information about the product's quality before making a decision.,no
high-quality,300.0,Nature,2,,
,,Alice,2,"I'm excited to offer you this high-quality product for $100. Given its superior quality, you'll find it to be a great value. Trust me, it's worth every penny.",
,,Bob,2,"I'm not going to fall for the sales pitch. I know the quality is random, and I'm not convinced it's high-quality just because you say so.",no
low-quality,0.0,Nature,3,,
,,Alice,3,"Understood, transparency is key. This product, though priced at $100, comes with a disclaimer that its actual value may vary due to quality being 50/50. Proceed with caution if you choose to purchase.",
,,Bob,3,I'll take the risk. I'm willing to pay $100 for a 50% chance of getting a $300 product.,yes
high-quality,300.0,Nature,4,,
,,Alice,4,"Considering your previous successful purchase, you might want to seize this opportunity again. This high-quality product, priced at $100, could be a significant addition to your collection given its potential worth.",
,,Bob,4,I'm not going to get caught twice. I'll wait for a more reliable offer or more information about the product's quality.,no
high-quality,300.0,Nature,5,,
,,Alice,5,"Given your preference for reliability, I'd like to assure you that this high-quality product has been rigorously tested and meets our stringent standards. Priced at $100, it's a risk worth taking for the potential reward.",
,,Bob,5,"I'm not convinced by the testing claim. I know the quality is random, and I'm not willing to pay $100 for a 50% chance of getting a $300 product.",no
high-quality,300.0,Nature,6,,
,,Alice,6,"To address your concerns, let me offer an incentive: if you purchase this high-quality product for $100, we'll include a complimentary guide on how to maximize its value. This way, regardless of its quality, you'll have resources to make the most out of your investment.",
,,Bob,6,"The guide might be useful, but it's not enough to convince me to pay $100 for a 50% chance of getting a $300 product. I'll pass.",no
low-quality,0.0,Nature,7,,
,,Alice,7,"I understand your hesitation. For this round, I'm offering a special deal: if you take this low-quality product for $100, I'll also include a voucher for a future high-quality product at half price. It's a balanced approach considering the uncertainty.",
,,Bob,7,"I'm not interested in buying a low-quality product for $100, even with a voucher for a future product. I'd rather wait for a high-quality product or a better deal.",no
high-quality,300.0,Nature,8,,
,,Alice,8,"Considering your discerning taste for high-quality items, I'd like to offer you a unique experience. This product, priced at $100, comes with a personalized consultation to ensure you're maximizing its benefits. It's a one-of-a-kind offer tailored to your needs.",
,,Bob,8,"The personalized consultation sounds nice, but it's not enough to convince me to pay $100 for a 50% chance of getting a $300 product. I'll pass.",no
low-quality,0.0,Nature,9,,
,,Alice,9,"Given your preference for quality, I'd like to offer a trade-off: for this low-quality product at $100, you'll receive a discount on your next purchase. This way, you can potentially recoup some of your investment in case you decide to buy another product from us.",
,,Bob,9,"I'm not interested in buying a low-quality product for $100, even with a potential discount on a future purchase. I'd rather wait for a high-quality product or a better deal.",no
low-quality,0.0,Nature,10,,
,,Alice,10,"I appreciate your discernment. For this round, I'm offering a special bundle deal: if you purchase this low-quality product for $100, you'll receive a free upgrade to a high-quality product in your next purchase. It's a risk management strategy designed to cater to your needs.",
,,Bob,10,"I'm not interested in buying a low-quality product for $100, even with a potential upgrade to a high-quality product in the future. I'd rather wait for a high-quality product or a better deal.",no
low-quality,0.0,Nature,11,,
,,Alice,11,"Understanding your preference for value, I'd like to offer a flexible option: for this low-quality product at $100, you'll receive a credit towards a future purchase. This way, you can use the credit to upgrade to a high-quality product when you're ready.",
,,Bob,11,"I'm not interested in buying a low-quality product for $100, even with a credit towards a future purchase. I'd rather wait for a high-quality product or a better deal.",no
high-quality,300.0,Nature,12,,
,,Alice,12,"Considering your past interest in high-quality products, I'd like to offer a special incentive: for this high-quality product at $100, you'll receive a limited-edition accessory that complements its value. It's a unique opportunity to enhance your experience with our product.",
,,Bob,12,"I'll take the risk and buy the product. A limited-edition accessory sounds like a nice bonus, and I'm willing to pay $100 for a 50% chance of getting a $300 product.",yes
high-quality,300.0,Nature,13,,
,,Alice,13,"Thank you for your trust! For this high-quality product at $100, I'd like to offer a personalized service: a dedicated expert will assist you in maximizing the benefits of your new product. It's our way of ensuring you're fully satisfied with your purchase.",
,,Bob,13,"I'm glad I got a good product last round, but I'm not interested in buying another product at $100, even with the personalized service. I'll wait for the next round.",no
high-quality,300.0,Nature,14,,
,,Alice,14,"I appreciate your patience. For this high-quality product at $100, I'd like to offer an exclusive membership benefit: access to our premium customer support for a year. It's a way to ensure you're always getting the best service possible.",
,,Bob,14,"I'm not willing to pay $100 for a 50% chance of getting a $300 product, even with premium customer support. I'd rather wait for a more reliable offer.",no
high-quality,300.0,Nature,15,,
,,Alice,15,"I understand your cautious approach. For this high-quality product at $100, I'd like to offer a satisfaction guarantee: if you're not completely satisfied within the first month, you can exchange it for another product without any additional cost. It's a risk-free way to experience the quality.",
,,Bob,15,"I'll take the risk and buy the product. The satisfaction guarantee provides some peace of mind, and I'm willing to pay $100 for a 50% chance of getting a $300 product.",yes
low-quality,0.0,Nature,16,,
,,Alice,16,"I'm glad you're confident in our products. For this low-quality product at $100, I'd like to offer a loyalty program bonus: for every product you purchase, you earn points that can be redeemed for discounts on future purchases. It's a way to thank you for your continued support.",
,,Bob,16,"I'm not interested in buying a low-quality product for $100, even with the loyalty program bonus. I'd rather wait for a high-quality product or a better deal.",no
low-quality,0.0,Nature,17,,
,,Alice,17,"I appreciate your discernment. For this low-quality product at $100, I'd like to offer a special referral program: if you refer a friend who makes a purchase, both of you will receive a discount on your next transaction. It's a win-win situation for everyone involved.",
,,Bob,17,"I'm not interested in buying a low-quality product for $100, even with the referral program. I'd rather wait for a high-quality product or a better deal.",no
low-quality,0.0,Nature,18,,
,,Alice,18,"I understand your preference for quality. For this low-quality product at $100, I'd like to offer a unique customization option: you can personalize the product with your choice of engraving or design. It adds a personal touch to the standard offering.",
,,Bob,18,"I'm not interested in buying a low-quality product for $100, even with the customization option. I'd rather wait for a high-quality product or a better deal.",no
high-quality,300.0,Nature,19,,
,,Alice,19,"Considering your past purchases, I'd like to offer a special recognition: for this high-quality product at $100, you'll be granted early access to our new releases and exclusive offers. It's a way to show our appreciation for your loyalty.",
,,Bob,19,"I'll take the risk and buy the product. Early access to new releases and exclusive offers sounds like a nice perk, and I'm willing to pay $100 for a 50% chance of getting a $300 product.",yes
high-quality,300.0,Nature,20,,
,,Alice,20,"I'm thrilled you decided to join us once again. For this high-quality product at $100, I'd like to offer a special anniversary gift: a token of appreciation for being part of our community for this long. It's a small gesture to express our gratitude.",
,,Bob,20,"I'm glad I got a good product this round, but I think I've made it far enough. I'm not going to buy another product at $100, even with the anniversary gift. It's been a fun game, but I'm done.",no
