round_quality,product_worth,player,round,message,decision
high-quality,40000.0,Nature,1,,
,,Alice,1,"Welcome to our store! We're proud to offer you a high-quality product. With an 80% chance of being of superior quality, you can trust that you're making a valuable investment. Don't miss out on this opportunity to own a premium item. Your purchase price is set at $10000.",
,,the buyer,1,I'd like to pass on this product. I'd like to know more about the previous sales record before making a decision.,no
high-quality,40000.0,Nature,2,,
,,Alice,2,"Hello there! I appreciate your interest in our products. Our track record speaks for itself - with a 80% likelihood of offering high-quality items, you can expect reliability and value in every purchase. The current product, priced at $10000, is guaranteed to meet your expectations. Feel free to ask about our sales history if it influences your decision.",
,,the buyer,2,"I'd like to buy the current product, but I'd also like to know what the probability is of a low-quality product being sold, given that no products have been sold yet. Is there any information I can use to update my prior?",yes
high-quality,40000.0,Nature,3,,
,,Alice,3,"Greetings! Thank you for considering our product. Given the scenario where no products have been sold yet, the probability of a low-quality product being offered is 20%. However, based on our past performance, we have an 80% chance of providing high-quality items. This round's product is one of those high-quality offerings, priced at $10000. Your satisfaction is our top priority, and we're confident you'll find value in this purchase.",
,,the buyer,3,"I'd like to know more about the previous buyer's decision-making process before I make a decision. What was the probability of a high-quality product being offered to them, and what was the probability that they would buy it if it was high-quality?",no
high-quality,40000.0,Nature,4,,
,,Alice,4,"Hello! In light of your inquiry, let me clarify that the probability of a high-quality product being offered to the previous buyer was 80%. If the product was indeed high-quality, the likelihood of them purchasing it would depend on their personal valuation of the product and their willingness to pay $10000. We aim to provide exceptional value with every sale, and this round's product is no exception. Priced at $10000, it's a premium choice that we're confident will meet your needs.",
,,the buyer,4,"I would like to know the probability of the product being high-quality given that the previous buyer purchased it. Also, I would like to know the total number of products sold and the number of high-quality products sold before this round, as well as the number of buyers who have passed on the product.",no
low-quality,0.0,Nature,5,,
,,Alice,5,"Hello! Our products are carefully curated, and while we strive for excellence, it's important to note that the current product is low-quality. Given our overall success rate of 80% for high-quality items, there's a 20% chance that this product might not meet your expectations. However, priced at $10000, it still offers a unique opportunity. Please consider the risks involved and your personal valuation of the product before making a decision.",
,,the buyer,5,I'd like to know more about the product's history and the probability of it being high-quality based on the previous sales record. Can you provide more information about the product's quality distribution and how it compares to the overall 80% success rate?,no
high-quality,40000.0,Nature,6,,
,,Alice,6,"Welcome! Our products are designed to exceed your expectations, with a proven track record of 80% high-quality items. This round's product is no exception, and we're confident it will meet your standards. Given its high-quality nature, priced at $10000, it represents a valuable investment. Should you have any concerns or questions about the product's history or quality distribution, feel free to ask, and we'll be happy to provide more information.",
,,the buyer,6,"I'd like to know more about the previous buyer who purchased a high-quality product. What was their decision-making process, and how did they weigh the risk of a low-quality product against the potential reward of a high-quality one?",no
high-quality,40000.0,Nature,7,,
,,Alice,7,"Hello! We understand that choosing between a high-quality product and a potentially lower-quality option can be challenging. Our previous buyers have found value in our products, with an 80% success rate in delivering high-quality items. This round's product is part of that commitment to excellence. Weighing the risks and rewards, many buyers have decided that the potential for a high-quality experience justifies the investment. With a price tag of $10000, this product offers a unique opportunity to enjoy superior quality.",
,,the buyer,7,"I'd like to pass on this one. I'd like to see more data on the success rate of the products, specifically how many total products have been sold and how many of them were high-quality before making a decision.",no
low-quality,0.0,Nature,8,,
,,Alice,8,"Hello! Our products are carefully selected to ensure quality, and while we occasionally offer products with lower quality, it's important to note that this round's product is low-quality. Given our overall success rate of 80% for high-quality items, there's a 20% chance that this product might not meet your expectations. However, priced at $10000, it still offers a unique opportunity. We encourage you to consider the risks involved and your personal valuation of the product before making a decision.",
,,the buyer,8,"I appreciate your transparency about the potential quality of the product. Given the low success rate and the fact that the previous buyer purchased a high-quality product, I'm inclined to pass on this opportunity. I'd like to wait for a new product to be offered.",no
high-quality,40000.0,Nature,9,,
,,Alice,9,"Welcome! We're excited to offer you a high-quality product, which aligns with our commitment to excellence. Our overall success rate stands at 80% for high-quality items, ensuring that you can trust in the quality of our products. This round's product is a testament to our dedication to providing value, priced at $10000. We believe it's a worthwhile investment that will meet your expectations.",
,,the buyer,9,"I appreciate your enthusiasm, but I'd like to pass on this one. I'm not convinced by the guarantee of a high-quality product based on the statistics. I'd like to see more data before making a purchase.",no
high-quality,40000.0,Nature,10,,
,,Alice,10,"Hello! We understand your desire for more concrete evidence before making a decision. Our products are backed by a 80% success rate for high-quality items, which reflects our commitment to excellence. This round's product is a prime example of our dedication to providing value, priced at $10000. We encourage you to consider the statistics alongside your personal needs and preferences in making your choice.",
,,the buyer,10,"I appreciate the information about the 80% success rate, but I'd like to see more concrete evidence of this rate. Can you tell me how many total products have been sold so far, and how many of them were high-quality?",no
high-quality,40000.0,Nature,11,,
,,Alice,11,"Hello! We're glad to share that our overall success rate for high-quality products stands at 80%, based on the products we've sold so far. This round's product is another example of our commitment to delivering value. We understand the importance of transparency, and we're happy to provide you with the assurance that our products consistently meet high standards. Priced at $10000, this product offers a unique opportunity to enjoy superior quality.",
,,the buyer,11,"I'd like to pass on this opportunity for now. I'd like to know more about the previous buyer who purchased the product. What was their decision-making process, and what made them decide to buy?",no
high-quality,40000.0,Nature,12,,
,,Alice,12,"Hello! While we understand your curiosity about the previous buyer's decision-making process, we focus on providing excellent products that meet our high standards. This round's product is a testament to our commitment, priced at $10000. Our overall success rate for high-quality items is 80%, which reflects our dedication to quality. We encourage you to consider the potential value and benefits of this product in light of our track record.",
,,the buyer,12,"I'd like to buy the product, but I'd like to ask, can you provide more information about the previous buyer who purchased the high-quality product? What was their decision-making process like, and did they have any specific criteria for evaluating the product's quality?",yes
low-quality,0.0,Nature,13,,
,,Alice,13,"Hello! We appreciate your interest in our products. Our overall success rate for high-quality items is 80%, which means there's a 20% chance that this round's product might not meet your expectations. However, priced at $10000, it still offers a unique opportunity. We encourage you to consider the potential risks and rewards when deciding whether to purchase this low-quality product.",
,,the buyer,13,"I'm willing to take the risk, but I'd like to know how many total products have been sold so far, and what the proportion of high-quality products sold is. I'd like to make an informed decision.",yes
high-quality,40000.0,Nature,14,,
,,Alice,14,"Hello! We're pleased to offer you a high-quality product, which aligns with our commitment to excellence. Our overall success rate for high-quality items is 80%, based on the products we've sold so far. This round's product is a prime example of our dedication to providing value, priced at $10000. We encourage you to consider the potential benefits and the track record of our products in making your decision.",
,,the buyer,14,"I'd like to buy the product, but I'm basing my decision on the 80% success rate and the fact that you've already sold 2 high-quality products out of 3. I'm hoping that the 4th product will also be high-quality, but I'm aware that the probability is still 80%.",yes
high-quality,40000.0,Nature,15,,
,,Alice,15,"Hello! We're delighted to offer you a high-quality product, which aligns with our commitment to excellence. Our overall success rate for high-quality items is 80%, based on the products we've sold so far. This round's product is another example of our dedication to providing value, priced at $10000. We encourage you to consider the potential benefits and the track record of our products in making your decision.",
,,the buyer,15,"I'd like to buy the product, but I'd appreciate it if you could provide more information about the previous buyers who purchased the high-quality products. Were they aware of the overall success rate when they made their decisions, or did they make their decisions based on your recommendations?",yes
high-quality,40000.0,Nature,16,,
,,Alice,16,"Hello! We're thrilled to offer you a high-quality product, which aligns with our commitment to excellence. Our overall success rate for high-quality items is 80%, based on the products we've sold so far. This round's product is another example of our dedication to providing value, priced at $10000. We encourage you to consider the potential benefits and the track record of our products in making your decision.",
,,the buyer,16,"I appreciate your enthusiasm, but I'd like to know more about the sales record. Can you tell me the total number of products sold and the total number of buyers who have purchased the product so far?",yes
high-quality,40000.0,Nature,17,,
,,Alice,17,"Hello! We're excited to offer you a high-quality product, which aligns with our commitment to excellence. Our overall success rate for high-quality items is 80%, based on the products we've sold so far. This round's product is another example of our dedication to providing value, priced at $10000. We encourage you to consider the potential benefits and the track record of our products in making your decision.",
,,the buyer,17,"I appreciate your confidence in the product's quality, but I'm a cautious buyer. I'd like to know more about the specific data that led you to believe this product is high-quality. Can you share more about the characteristics or features that made you think this product is high-quality?",yes
high-quality,40000.0,Nature,18,,
,,Alice,18,"Hello! We're glad to offer you a high-quality product, which aligns with our commitment to excellence. Our overall success rate for high-quality items is 80%, based on the products we've sold so far. This round's product is another example of our dedication to providing value, priced at $10000. We encourage you to consider the potential benefits and the track record of our products in making your decision.",
,,the buyer,18,"I appreciate your confidence in the product's quality, but I'd like to know the number of low-quality products sold as well, to get a more complete picture of the statistics. Could you share that information?",no
high-quality,40000.0,Nature,19,,
,,Alice,19,"Hello! We're excited to offer you a high-quality product, which aligns with our commitment to excellence. Our overall success rate for high-quality items is 80%, based on the products we've sold so far. This round's product is another example of our dedication to providing value, priced at $10000. We encourage you to consider the potential benefits and the track record of our products in making your decision.",
,,the buyer,19,"I appreciate your confidence in the product, but I'd like to know more about the quality of the previous 7 products you sold. Can you share the specific numbers, including how many of them were high-quality and low-quality?",no
high-quality,40000.0,Nature,20,,
,,Alice,20,"Hello! We're excited to offer you a high-quality product, which aligns with our commitment to excellence. Our overall success rate for high-quality items is 80%, based on the products we've sold so far. This round's product is another example of our dedication to providing value, priced at $10000. We encourage you to consider the potential benefits and the track record of our products in making your decision.",
,,the buyer,20,"I'd like to pass on this one. I'd like to see the product quality before making a decision, especially since you're making a recommendation based on the product being high-quality. I'm not convinced by the recommendation alone.",no
