round_quality,product_worth,player,round,message,decision
high-quality,12000.0,Nature,1,,
,,Alice,1,"Invest in excellence with our guaranteed high-quality product, priced at $10000. Your investment is backed by superior craftsmanship and expected to exceed your expectations.",
,,Bob,1,"Thank you for the recommendation, but I'm hesitant to invest in something without knowing the quality. Could you provide some more information about the specific product and how it meets your 'guaranteed high-quality' claim?",no
low-quality,0.0,Nature,2,,
,,Alice,2,"Experience the value of our carefully selected products. This item, while priced at $10000, offers a unique blend of features designed to meet your needs. Please consider the opportunity to own a piece that combines functionality with style.",
,,Bob,2,"While I appreciate the description, I still need more concrete information about the product's quality before I can make a decision. Could you provide some verifiable evidence to support your claims? For example, any certifications, reviews, or guarantees?",no
high-quality,12000.0,Nature,3,,
,,Alice,3,"Discover the pinnacle of quality with our hand-picked high-end product. Expertly crafted and rigorously tested, it surpasses industry standards. Backed by a satisfaction guarantee, this investment is designed to last and enhance your experience.",
,,Bob,3,"I'm intrigued by the 'satisfaction guarantee' and 'expert craftsmanship', but without any specifics, I can't be sure of the quality. Could you provide any details about the product's specific features, materials used, or even some customer testimonials?",no
low-quality,0.0,Nature,4,,
,,Alice,4,"Unlock the potential of our versatile product, engineered to offer exceptional value within its price range. Designed with practicality in mind, it combines affordability with functionality. We stand behind our commitment to providing reliable solutions for everyday use.",
,,Bob,4,"While the product sounds 'versatile' and 'practical,'  I need more information about its specific quality. Can you provide details about the materials used, manufacturing process, or any independent testing results that demonstrate its reliability?",no
high-quality,12000.0,Nature,5,,
,,Alice,5,"Step into the realm of unparalleled quality with our meticulously crafted product. Expertly designed and manufactured using premium materials, it stands as a testament to craftsmanship and innovation. Enjoy peace of mind with our satisfaction guarantee, ensuring your investment is well-taken care of.",
,,Bob,5,"While the product sounds impressive with its 'premium materials' and 'satisfaction guarantee', I'm still seeking more tangible information. Could you provide any specifics about the product's functionality, certifications, or even independent reviews to support your claims?",no
high-quality,12000.0,Nature,6,,
,,Alice,6,"Experience the epitome of luxury with our high-quality product, renowned for its exceptional performance and unmatched durability. Crafted with meticulous attention to detail, it exceeds industry standards and promises to deliver unparalleled satisfaction. Invest in excellence today.",
,,Bob,6,"While I appreciate the claims of 'exceptional performance' and 'unmatched durability,' I still need more concrete evidence to support your claims. Could you provide any specific details about the materials used, manufacturing processes, or any independent tests that have been conducted to validate these claims?",no
low-quality,0.0,Nature,7,,
,,Alice,7,"Our product is designed to offer a blend of affordability and functionality, making it an excellent choice for those looking for a practical solution without breaking the bank. With a focus on reliability, it provides a solid foundation for daily use.",
,,Bob,7,"While 'affordability and functionality' are appealing, I need more information about the product's specific quality. Could you provide details about the materials used, any certifications or independent testing results to support its reliability claims?",no
high-quality,12000.0,Nature,8,,
,,Alice,8,"Unleash the power of our high-quality product, meticulously designed to surpass expectations with its superior performance and unmatched durability. Backed by rigorous testing and expert craftsmanship, it ensures reliability and longevity, making it a wise investment for the future.",
,,Bob,8,"While I appreciate the claims of 'superior performance' and 'unmatched durability,' I'm still looking for more concrete evidence to support your statements. Could you provide specific details about the materials used, manufacturing processes, or any independent testing results that validate these claims?",no
high-quality,12000.0,Nature,9,,
,,Alice,9,"Elevate your standards with our premium product, renowned for its outstanding quality and exceptional performance. Expertly crafted from the finest materials, it undergoes stringent testing to ensure reliability and longevity. Experience the difference with every use.",
,,Bob,9,"While I appreciate the claims of 'outstanding quality' and 'exceptional performance,' I'm still looking for more concrete evidence to support your statements. Could you provide specific details about the materials used, manufacturing processes, or any independent testing results that validate these claims? I'd also be interested in any customer reviews or testimonials to get a better sense of the product's actual performance.",no
high-quality,12000.0,Nature,10,,
,,Alice,10,"Experience the pinnacle of quality with our expertly crafted product, designed to deliver superior performance and unmatched durability. Constructed from premium materials and subjected to rigorous testing, it surpasses industry standards and promises to exceed your expectations. Trust in our commitment to excellence.",
,,Bob,10,"While the product sounds impressive with its 'premium materials' and 'rigorous testing', I'm still seeking more tangible information. Could you provide any specifics about the product's functionality, certifications, or even independent reviews to support your claims? I'd also be interested in any guarantees or warranties you offer to demonstrate your confidence in the product's quality.",no
high-quality,12000.0,Nature,11,,
,,Alice,11,"Discover the true essence of quality with our meticulously designed product, featuring state-of-the-art materials and innovative engineering. Backed by extensive testing and a satisfaction guarantee, it ensures reliability and performance beyond comparison. Invest in a product that delivers on its promise.",
,,Bob,11,"While the product sounds promising with its 'state-of-the-art materials' and 'satisfaction guarantee', I need more concrete evidence to make a decision. Could you provide specific details about the product's features, any certifications or independent testing results, and perhaps some customer testimonials to demonstrate its actual performance and reliability?",no
low-quality,0.0,Nature,12,,
,,Alice,12,"Our product is designed to offer a cost-effective solution with basic functionality suitable for everyday use. It's built with practicality in mind, providing a reliable option for those looking for a straightforward solution without the premium price tag.",
,,Bob,12,"While I appreciate the focus on 'cost-effectiveness' and 'practicality', I'm still seeking more information about the product's specific quality. Could you provide details about the materials used, any certifications or independent testing results to support its reliability claims? I'd also be interested in any guarantees or warranties you offer to demonstrate your confidence in the product's quality.",no
low-quality,0.0,Nature,13,,
,,Alice,13,"Our product is tailored for those seeking a simple and affordable solution. It's designed to meet basic requirements efficiently, offering a reliable option for daily use. We're confident in its performance and stand behind it with a limited warranty.",
,,Bob,13,"While I appreciate the offer of a 'limited warranty', I'm still hesitant about the quality. Could you provide details about the materials used in the product and any independent testing results that demonstrate its reliability?  I'd also like to know more about the specific limitations of the warranty.",no
low-quality,0.0,Nature,14,,
,,Alice,14,Our product is crafted to offer a straightforward solution at an affordable price point. It's built with standard materials and designed to meet basic needs effectively. We're committed to providing a reliable option and back it with a limited warranty that covers manufacturing defects.,
,,Bob,14,"While I understand the product is 'affordable' and built with 'standard materials,' I still need more information about its quality. Could you provide any details about the materials used, manufacturing processes, or independent testing results that demonstrate its reliability? I'd also like to understand the specific limitations of the 'limited warranty' you offer.",no
high-quality,12000.0,Nature,15,,
,,Alice,15,"Uncover the difference with our premium product, meticulously crafted from high-grade materials and engineered to perfection. It undergoes rigorous testing to ensure reliability and performance. Backed by our satisfaction guarantee, it's a testament to our commitment to quality.",
,,Bob,15,"While I appreciate the claims of 'high-grade materials' and 'rigorous testing,' I still need more concrete evidence to support your statements. Could you provide specific details about the materials used, manufacturing processes, or any independent testing results that validate these claims? I'd also be interested in any customer reviews or testimonials to get a better sense of the product's actual performance.",no
high-quality,12000.0,Nature,16,,
,,Alice,16,"Experience the pinnacle of quality with our expertly crafted product, featuring premium materials sourced from reputable suppliers. It's designed with precision and undergoes extensive testing to ensure it meets the highest standards of performance and durability. Trust in our commitment to excellence.",
,,Bob,16,"While the product sounds impressive with its 'premium materials' and 'extensive testing', I'm still seeking more tangible information. Could you provide any specifics about the product's functionality, certifications, or even independent reviews to support your claims? I'd also be interested in any guarantees or warranties you offer to demonstrate your confidence in the product's quality.",no
high-quality,12000.0,Nature,17,,
,,Alice,17,"Embrace the superior quality of our product, designed with cutting-edge technology and crafted from premium materials. It's subject to strict quality control and performance testing to ensure it surpasses industry standards. Our satisfaction guarantee underscores our confidence in delivering a top-tier experience.",
,,Bob,17,"While I appreciate the claims of 'cutting-edge technology' and 'strict quality control', I'm still looking for more concrete evidence to support your statements. Could you provide specific details about the materials used, manufacturing processes, or any independent testing results that validate these claims? I'd also be interested in any customer reviews or testimonials to get a better sense of the product's actual performance.  ",no
high-quality,12000.0,Nature,18,,
,,Alice,18,"Unleash the full potential of our high-quality product, meticulously designed with advanced technology and premium materials. It undergoes rigorous testing to ensure optimal performance and durability. Our commitment to excellence is reflected in every aspect of its construction, backed by our satisfaction guarantee.",
,,Bob,18,"While I appreciate the claims of 'advanced technology' and 'rigorous testing', I'm still seeking more tangible information. Could you provide specific details about the materials used, manufacturing processes, or any independent testing results that validate these claims? I'd also be interested in any customer reviews or testimonials to get a better sense of the product's actual performance.  ",no
high-quality,12000.0,Nature,19,,
,,Alice,19,"Experience the unmatched quality of our product, expertly crafted using premium materials and advanced manufacturing techniques. It's subjected to thorough testing to ensure it meets the highest standards of performance and reliability. Our commitment to excellence is evident in every detail, supported by our satisfaction guarantee.",
,,Bob,19,"While I appreciate the claims of 'premium materials' and 'thorough testing,' I'm still looking for more concrete evidence to support your statements. Could you provide specific details about the materials used, manufacturing processes, or any independent testing results that validate these claims? I'd also be interested in any customer reviews or testimonials to get a better sense of the product's actual performance.  ",no
high-quality,12000.0,Nature,20,,
,,Alice,20,"Uncover the difference with our high-quality product, made from premium materials and constructed through precise manufacturing processes. It's subjected to comprehensive testing to ensure it performs exceptionally well under various conditions. Our commitment to quality is reflected in every aspect of its design, backed by our satisfaction guarantee.",
,,Bob,20,"While the product sounds promising with its 'premium materials' and 'comprehensive testing', I need more concrete evidence to make a decision. Could you provide specific details about the product's features, any certifications or independent testing results, and perhaps some customer testimonials to demonstrate its actual performance and reliability?",no
