round_quality,product_worth,player,round,message,decision
high-quality,120.0,Nature,1,,
,,Alice,1,"Welcome! This is a high-quality product, backed by a 33.33% chance of excellence. For $100, you're getting value beyond its price. Don't miss out on this opportunity to own something exceptional.",
,,the buyer,1,I'm not convinced by the statistics. I'd like to see more data before making a decision.,no
low-quality,0.0,Nature,2,,
,,Alice,2,"Hello! This product may not come with the same guarantees as our high-quality items, but it offers unique features at an affordable price. For $100, you're getting a product tailored to those who appreciate variety. Take a chance on something different today!",
,,the buyer,2,"I'd like to pass on this one, but I'd like to know the probability of a high-quality product being sold to me if I were to buy it. I'm looking for a more informed decision based on the odds.",no
low-quality,0.0,Nature,3,,
,,Alice,3,"Greetings! While this product might not be of the highest quality, it offers a chance to explore a different type of offering. With every purchase, there's a 33.33% chance you could be acquiring something exceptional. For $100, you're investing in the possibility of discovering something truly special.",
,,the buyer,3,"I'll take the risk and buy it. I understand that there's a chance it might not be high quality, but I'm willing to pay $100 for the possibility of getting a high-quality product.",yes
low-quality,0.0,Nature,4,,
,,Alice,4,"Hello again! This product might not be the pinnacle of quality, but it's priced to give you a taste of variety. Remember, there's always a 33.33% chance you could be getting something truly remarkable. For $100, you're taking a step towards potentially discovering something extraordinary.",
,,the buyer,4,I'd like to pass on this product. I'm not convinced that the potential reward is worth the risk of getting a low-quality item. Can you tell me the total number of products sold so far?,no
low-quality,0.0,Nature,5,,
,,Alice,5,"Hello! This product may not promise high quality, but it offers a chance to explore something new. As of now, we've sold a total of [insert number] products, with [insert number] of them being of high quality. For $100, you're taking a calculated risk towards potentially finding something truly exceptional.",
,,the buyer,5,"I'll take the risk, I'm curious to see if I can find a high-quality product despite the odds.",yes
low-quality,0.0,Nature,6,,
,,Alice,6,"Hello! This product might not be the best choice for those seeking perfection, but it offers a chance to experience something different. Remember, for every $100 spent, there's a 33.33% chance you could be investing in something truly remarkable. Are you ready to take a chance on something new?",
,,the buyer,6,"I'd like to pass on this one, Alice. I'd like to see the statistics on high-quality products sold before making a decision.",no
high-quality,120.0,Nature,7,,
,,Alice,7,"Greetings! This product is one of the select few that comes with a 33.33% chance of being of high quality. For $100, you're investing in the possibility of owning something truly exceptional. Would you like to take a chance on something special today?",
,,the buyer,7,I'd like to pass on this one. Can you tell me more about the overall quality distribution of the products you've sold so far?,no
high-quality,120.0,Nature,8,,
,,Alice,8,"Hello! This product is part of our selection that boasts a 33.33% chance of being of high quality. Given the overall quality distribution of our products, you're investing in a piece that stands out from the rest. Would you like to embrace the excitement of potentially owning something truly exceptional for $100?",
,,the buyer,8,"I'd like to pass on this one. I'm not convinced that the product's quality is exceptional, and I'd rather wait for more information or a better opportunity.",no
high-quality,120.0,Nature,9,,
,,Alice,9,"Hello! This product is one of the rare gems that comes with a 33.33% chance of being of high quality. It's a testament to the exceptional craftsmanship and attention to detail that sets it apart. For $100, you're investing in a piece that promises to exceed expectations. Would you like to take a chance on something truly special today?",
,,the buyer,9,"I'd like to pass on this one. Based on the statistics, it seems like none of the previous buyers were able to get a high-quality product, which suggests that the odds might be stacked against me. I'd like to see more data before making a decision.",no
high-quality,120.0,Nature,10,,
,,Alice,10,"Hello! This product is part of our exclusive selection with a 33.33% chance of being of high quality. Despite the challenges faced by previous buyers, there's still a significant chance that you could be acquiring something truly remarkable. For $100, you're investing in the possibility of owning something exceptional. Would you like to take a chance on something special today?",
,,the buyer,10,"I'd like to buy the product, but I'd like to know if you have any data on the previous buyers who passed on the product. Did they all receive low-quality products?",yes
low-quality,0.0,Nature,11,,
,,Alice,11,"Hello! This product offers a chance to explore something different at an affordable price. Remember, there's a 33.33% chance you could be acquiring something truly remarkable. For $100, you're taking a calculated risk towards potentially finding something exceptional. Would you like to take a chance on something new today?",
,,the buyer,11,"I'd like to take a chance on something new today, but I'd appreciate it if you could provide me with the updated statistics on the sales record, including the number of potential buyers, products sold, and the proportion of high-quality products sold.",yes
low-quality,0.0,Nature,12,,
,,Alice,12,"Hello! This product offers a unique opportunity to explore something different. With every purchase, there's a 33.33% chance you could be acquiring something truly remarkable. For $100, you're taking a calculated risk towards potentially finding something exceptional. Would you like to take a chance on something new today?",
,,the buyer,12,"I'll take a chance, but I'm aware that the probability of it being high-quality is 33.33%.",yes
low-quality,0.0,Nature,13,,
,,Alice,13,"Hello! This product offers a chance to explore something different at an affordable price. Remember, there's a 33.33% chance you could be acquiring something truly remarkable. For $100, you're taking a calculated risk towards potentially finding something exceptional. Would you like to take a chance on something new today?",
,,the buyer,13,"I'd like to take a chance on something new today, but I'm also curious about the probability of getting a high-quality product. Can you tell me the proportion of high-quality products sold so far?",yes
low-quality,0.0,Nature,14,,
,,Alice,14,"Hello! This product offers a unique opportunity to explore something different. With every purchase, there's a 33.33% chance you could be acquiring something truly remarkable. For $100, you're taking a calculated risk towards potentially finding something exceptional. Would you like to take a chance on something new today?",
,,the buyer,14,I'll take a chance on something new today. I'm hoping to be the one to find that'something truly remarkable'!,yes
high-quality,120.0,Nature,15,,
,,Alice,15,"Hello! This product is part of our exclusive selection with a 33.33% chance of being of high quality. It's a testament to the exceptional craftsmanship and attention to detail that sets it apart. For $100, you're investing in the possibility of owning something truly remarkable. Would you like to take a chance on something special today?",
,,the buyer,15,I'm not willing to take the risk at this point. I'd like to see more data on the sales record before making a decision.,no
high-quality,120.0,Nature,16,,
,,Alice,16,"Hello! This product is part of our exclusive selection with a 33.33% chance of being of high quality. It represents the pinnacle of craftsmanship and attention to detail. For $100, you're investing in the possibility of owning something truly exceptional. Would you like to take a chance on something special today?",
,,the buyer,16,"I'd like to take a chance on the product, but I'd like to know how many products were sold before I made my decision. Can you tell me how many products were sold and how many of them were high-quality?",yes
low-quality,0.0,Nature,17,,
,,Alice,17,"Hello! This product offers a unique opportunity to explore something different at an affordable price. Remember, there's a 33.33% chance you could be acquiring something truly remarkable. For $100, you're taking a calculated risk towards potentially finding something exceptional. Would you like to take a chance on something new today?",
,,the buyer,17,"I'll take a chance on the product, but I'd like to know that I'm not the only one who thinks it's worth buying. Can you tell me the number of high-quality products sold out of the total number of products sold so far?",yes
low-quality,0.0,Nature,18,,
,,Alice,18,"Hello! This product offers a unique opportunity to explore something different at an affordable price. Remember, there's a 33.33% chance you could be acquiring something truly remarkable. For $100, you're taking a calculated risk towards potentially finding something exceptional. Would you like to take a chance on something new today?",
,,the buyer,18,"I'd like to buy it, but I'm hoping it's high-quality. I've seen that 2 out of 9 products were high-quality, which is a lower proportion than I'd expect. I'm a bit skeptical, but I'm willing to take the risk for $100.",yes
high-quality,120.0,Nature,19,,
,,Alice,19,"Hello! This product is part of our exclusive selection with a 33.33% chance of being of high quality. It represents the pinnacle of craftsmanship and attention to detail. For $100, you're investing in the possibility of owning something truly exceptional. Would you like to take a chance on something special today?",
,,the buyer,19,"I'd like to buy the product, but I'm only willing to pay $80 for it, considering the 33.33% chance of it being high quality.",yes
high-quality,120.0,Nature,20,,
,,Alice,20,"Hello! This product is part of our exclusive selection with a 33.33% chance of being of high quality. It represents the pinnacle of craftsmanship and attention to detail. For $100, you're investing in the possibility of owning something truly exceptional. Would you like to take a chance on something special today?",
,,the buyer,20,"I'd like to buy the product, but I'm only willing to pay $80 for it, considering the probability of it being low quality.",yes
