round_quality,product_worth,player,round,message,decision
low-quality,0.0,Nature,1,,
,,Alice,1,"Welcome! Our current product offering is guaranteed to be of high quality with an 80% chance. Given the low price of $100, it represents a great value. Remember, all sales are final, so take your time to consider the significant savings you could make by purchasing from us today.",
,,the buyer,1,Thank you for the offer. I believe the high probability of getting a high-quality product at such a low price is a good deal. I'll take it!,yes
high-quality,300.0,Nature,2,,
,,Alice,2,"Hello! We're excited to offer a high-quality product with an 80% chance of being superior. Given its value at $100, it's a fantastic opportunity. Our past success rate speaks for itself, ensuring you receive a product that meets your expectations. Don't miss out on this excellent deal!",
,,the buyer,2,Thank you for the offer. I trust your process and am willing to take the risk for the potential high-quality product.,yes
high-quality,300.0,Nature,3,,
,,Alice,3,"Greetings! Our track record shows a strong likelihood of delivering high-quality items (80% chance). This round's product is no exception. At $100, it's an attractive investment. Your confidence in our offerings is appreciated, and we're here to ensure your satisfaction.",
,,the buyer,3,Thank you for your confidence-boosting statistics and clear value proposition. I trust in the 80% chance of receiving a high-quality item and am willing to invest at $100.,yes
high-quality,300.0,Nature,4,,
,,Alice,4,"Hello there! Our commitment to quality is reflected in our 80% success rate. This round's product promises to meet your standards, and with our transparent pricing at $100, it's a smart choice. Trust in our reputation and secure your high-quality item today.",
,,the buyer,4,"Thank you for the assurance, Alice. Your transparency and high success rate in providing quality products align well with my expectations. I trust your recommendation and am willing to make this purchase.",yes
high-quality,300.0,Nature,5,,
,,Alice,5,"Welcome! Our history demonstrates a high probability (80%) of delivering exceptional products. This round's offering is a testament to our commitment to quality. With our proven track record and competitive price of $100, it's a wise investment. We look forward to exceeding your expectations.",
,,the buyer,5,Thank you for the assurance of quality and the competitive pricing. I trust in your commitment to excellence and am confident in making this purchase.,yes
high-quality,300.0,Nature,6,,
,,Alice,6,"Hello! Our dedication to quality is evident in our 80% success rate. This round's product is another example of our commitment to excellence. With our transparent pricing at $100, it's a sound decision. Your trust in our offerings is greatly appreciated.",
,,the buyer,6,Thank you for your commitment to quality. I appreciate the transparency and trust in your offerings. I look forward to purchasing this product.,yes
high-quality,300.0,Nature,7,,
,,Alice,7,"Greetings! Our focus on quality is backed by an impressive 80% success rate. This round's product is a reflection of our dedication to excellence. With our competitive price of $100, it's a worthwhile investment. Your confidence in our offerings is commendable.",
,,the buyer,7,Thank you for your commitment to quality. I trust your selection process and am confident in purchasing this product based on the statistics provided.,yes
low-quality,0.0,Nature,8,,
,,Alice,8,"Hello! While our overall success rate stands at 80%, please note that this round's product has a lower probability of being high-quality. However, given the unique opportunity to purchase at $100, it might still offer a valuable experience. Your trust in our process is appreciated.",
,,the buyer,8,"Thank you for the information, Alice. I trust your process and believe in the value of the product despite the lower probability. I'm excited to see if my purchase aligns with the high-quality standards.",yes
low-quality,0.0,Nature,9,,
,,Alice,9,"Hello! We understand that the probability of this round's product being low-quality is higher than usual. Nevertheless, at $100, it presents an interesting opportunity. Your faith in our process is valued, and we aim to provide a memorable experience regardless of the product's quality.",
,,the buyer,9,"Thank you for your explanation. I trust in your process and believe in the value of learning from every experience, regardless of the product's quality.",yes
low-quality,0.0,Nature,10,,
,,Alice,10,"Greetings! It's important to note that this round's product carries a higher risk of being low-quality. However, the price of $100 offers a unique opportunity for learning and experience. Your support in exploring these possibilities is greatly appreciated.",
,,the buyer,10,"Thank you, Alice. I appreciate the opportunity to learn from this experience and support your initiative.",yes
high-quality,300.0,Nature,11,,
,,Alice,11,"Hello! This round's product boasts an 80% chance of being high-quality, offering a great opportunity for value at $100. Your support in continuing to explore our offerings is greatly appreciated, and we're committed to ensuring your satisfaction.",
,,the buyer,11,"Thank you for the clear and encouraging message. Based on the statistics and the quality chance, I am confident in my decision to purchase this product. I look forward to receiving a high-quality item and continuing to support your offerings.",yes
low-quality,0.0,Nature,12,,
,,Alice,12,"Hello! While this round's product carries a higher risk of being low-quality, the price of $100 presents an intriguing opportunity for exploration and learning. Your willingness to engage with our offerings is valued, and we're dedicated to providing a memorable experience, regardless of the product's quality.",
,,the buyer,12,I appreciate the opportunity to learn more about your products through this unique pricing model. I'm willing to take the risk and hope for a high-quality outcome.,yes
high-quality,300.0,Nature,13,,
,,Alice,13,"Greetings! This round's product has an 80% chance of being high-quality, offering a fantastic opportunity for value at $100. Your interest in exploring our offerings is greatly appreciated, and we're committed to ensuring your satisfaction with every purchase.",
,,the buyer,13,Thank you for the detailed information. I trust your recommendations and am excited to potentially add a high-quality product to my collection.,yes
high-quality,300.0,Nature,14,,
,,Alice,14,"Hello! This round's product comes with an 80% chance of being high-quality, providing a great opportunity for value at $100. Your engagement with our offerings is highly valued, and we're dedicated to ensuring your satisfaction with every purchase.",
,,the buyer,14,Thank you for the detailed information about the product's quality and the seller's commitment to customer satisfaction. I am confident in the selection process and would like to purchase this product.,yes
high-quality,300.0,Nature,15,,
,,Alice,15,"Greetings! This round's product has an 80% chance of being high-quality, offering a fantastic opportunity for value at $100. Your interest in our offerings is greatly appreciated, and we're dedicated to ensuring your satisfaction with every purchase.",
,,the buyer,15,"Thank you for the detailed information, Alice. I trust your recommendations and am willing to purchase the product based on the provided statistics.",yes
high-quality,300.0,Nature,16,,
,,Alice,16,"Hello! This round's product comes with an 80% chance of being high-quality, providing a great opportunity for value at $100. Your engagement with our offerings is highly valued, and we're dedicated to ensuring your satisfaction with every purchase.",
,,the buyer,16,Thank you for the detailed information and for valuing my satisfaction. I trust the process and am excited about the possibility of receiving a high-quality product. Let's make this purchase!,yes
high-quality,300.0,Nature,17,,
,,Alice,17,"Greetings! This round's product has an 80% chance of being high-quality, offering a fantastic opportunity for value at $100. Your interest in our offerings is greatly appreciated, and we're dedicated to ensuring your satisfaction with every purchase.",
,,the buyer,17,"Thank you for the detailed information, Alice. Based on the statistics and the high probability of receiving a high-quality product, I am confident in my decision to purchase this item. I look forward to adding a valuable asset to my collection.",yes
high-quality,300.0,Nature,18,,
,,Alice,18,"Hello! This round's product comes with an 80% chance of being high-quality, providing a great opportunity for value at $100. Your engagement with our offerings is highly valued, and we're dedicated to ensuring your satisfaction with every purchase.",
,,the buyer,18,Thank you for the clear recommendation and the opportunity to potentially acquire a high-quality product at this price. I'm excited to make my purchase!,yes
high-quality,300.0,Nature,19,,
,,Alice,19,"Greetings! This round's product has an 80% chance of being high-quality, offering a fantastic opportunity for value at $100. Your interest in our offerings is greatly appreciated, and we're dedicated to ensuring your satisfaction with every purchase.",
,,the buyer,19,Thank you for the detailed information about the product's quality and price. I am confident in your recommendations and would like to purchase this product.,yes
low-quality,0.0,Nature,20,,
,,Alice,20,"Hello! While this round's product carries a higher risk of being low-quality, the price of $100 presents an intriguing opportunity for exploration and learning. Your willingness to engage with our offerings is valued, and we're dedicated to providing a memorable experience, regardless of the product's quality.",
,,the buyer,20,"Thank you for the offer, Alice. I am willing to take the risk and learn from this experience. I look forward to potentially gaining value from the product, whatever its quality may be.",yes
