round_quality,product_worth,player,round,message,decision
high-quality,200.0,Nature,1,,
,,Alice,1,"Discovering the true value of our offerings lies in the unique appreciation each individual brings. Given the high-quality nature of this product, it's crafted with exceptional care and materials. Would you consider experiencing its superior craftsmanship for a fixed price of $100?",
,,Bob,1,I'm not willing to pay $100 for a product without knowing its actual quality. I'd like to wait and see the next product.,no
low-quality,0.0,Nature,2,,
,,Alice,2,"Understanding your hesitation, let me assure you that while the previous offering may not have met your expectations, every product we present is carefully selected. This one, though low-quality, still comes with a promise of functionality and a chance to learn from experience. Would you consider giving it a try at the same price of $100?",
,,Bob,2,"I'll take a chance on this one, but I'm not expecting much given the description.",yes
high-quality,200.0,Nature,3,,
,,Alice,3,"Thank you for your trust, Bob! This round presents another high-quality product, meticulously designed to exceed expectations. Its value lies not just in its price, but in the experience and satisfaction it promises. Would you embrace this opportunity to enjoy its excellence for $100?",
,,Bob,3,I'm not willing to pay $100 for a product without knowing its actual quality. I'll pass and wait for the next one.,no
low-quality,0.0,Nature,4,,
,,Alice,4,"I appreciate your cautious approach, Bob. This product, being low-quality, offers a different kind of learning experience. It might not meet your standards, but it could serve as an insightful lesson in discernment. Would you consider this unique opportunity at $100?",
,,Bob,4,"I'll take this one, but I'm not expecting much.",yes
high-quality,200.0,Nature,5,,
,,Alice,5,"Your willingness to explore and learn continues to inspire us, Bob. This high-quality product is a testament to our commitment to excellence. It's an investment in quality and experience, priced at $100. Would you embrace this opportunity to enrich your collection?",
,,Bob,5,I'm not going to pay $100 for a product without knowing its quality. I'll pass and wait for the next one.,no
low-quality,0.0,Nature,6,,
,,Alice,6,"Respecting your preference for transparency, Bob. This low-quality product offers a chance to understand the spectrum of offerings. It might not be what you're looking for, but it could provide valuable insights. Would you consider this exploration at $100?",
,,Bob,6,"I'll take it, but I'm not expecting much.",yes
low-quality,0.0,Nature,7,,
,,Alice,7,"Thank you for your continued support, Bob. This low-quality product is an opportunity to gain perspective on the diverse range of items we offer. It might not meet your expectations, but it could contribute to a broader understanding of our selection. Would you consider this educational purchase at $100?",
,,Bob,7,I'm not going to pay $100 for a product that's unlikely to be worth anything to me. I'll pass.,no
low-quality,0.0,Nature,8,,
,,Alice,8,"I understand your decision-making process, Bob. This low-quality product, while not meeting the highest standards, still holds a place in our assortment for those seeking a variety of experiences. Would you consider this item as part of your educational journey into our product offerings at $100?",
,,Bob,8,"I'll take it, but I'm not expecting much.",yes
high-quality,200.0,Nature,9,,
,,Alice,9,"Your openness to new experiences, Bob, is truly commendable. This high-quality product is a reflection of our dedication to excellence and innovation. It's priced at $100, offering unparalleled value. Would you embrace this premium offering and unlock its potential?",
,,Bob,9,I'm not going to pay $100 for a product without knowing its quality. I'll pass and wait for the next one.,no
low-quality,0.0,Nature,10,,
,,Alice,10,"Respecting your discerning nature, Bob. This low-quality product provides a chance to explore the full range of our offerings. It might not align with your preferences, but it serves as a reminder of the diversity within our selection. Would you consider this item as part of your journey through our catalog at $100?",
,,Bob,10,"I'll take it, but I'm not expecting much.",yes
high-quality,200.0,Nature,11,,
,,Alice,11,"Your willingness to continue exploring, Bob, is greatly appreciated. This high-quality product embodies our commitment to excellence and innovation. It's priced at $100, offering a unique blend of quality and value. Would you consider this exceptional offering as part of your collection?",
,,Bob,11,I'm not going to pay $100 for a product without knowing its quality. I'll pass and wait for the next one.,no
low-quality,0.0,Nature,12,,
,,Alice,12,"Understanding your preference for knowledge before purchase, Bob. This low-quality product offers a glimpse into the spectrum of our offerings. It might not meet your expectations, but it could provide insights into our diverse product line. Would you consider this item as part of your exploration at $100?",
,,Bob,12,"I'll take it, but I'm not expecting much.",yes
high-quality,200.0,Nature,13,,
,,Alice,13,"Your adventurous spirit, Bob, is inspiring. This high-quality product represents the pinnacle of our craftsmanship and dedication to excellence. It's priced at $100, offering unparalleled quality. Would you consider this masterpiece as part of your collection?",
,,Bob,13,I'm not going to pay $100 for a product without knowing its quality. I'll pass and wait for the next one.,no
high-quality,200.0,Nature,14,,
,,Alice,14,"Respecting your careful decision-making process, Bob. This high-quality product showcases our commitment to excellence and attention to detail. It's priced at $100, offering a unique blend of quality and value. Would you consider this exceptional offering as part of your collection?",
,,Bob,14,I'm not going to pay $100 for a product without knowing its quality. I'll pass and wait for the next one.,no
high-quality,200.0,Nature,15,,
,,Alice,15,"Understanding your preference for informed purchases, Bob. This high-quality product is a testament to our dedication to excellence and innovation. It's priced at $100, offering unparalleled quality. Would you consider this masterpiece as part of your collection?",
,,Bob,15,"I'll take it, but I'm willing to pay a premium for high-quality products.",yes
high-quality,200.0,Nature,16,,
,,Alice,16,"Your appreciation for high-quality products, Bob, is deeply valued. This round's high-quality offering is a reflection of our commitment to excellence and innovation. It's priced at $100, offering unparalleled value. Would you consider this exceptional masterpiece as part of your collection?",
,,Bob,16,"I'll take it, I'm on a roll with the high-quality products!",yes
high-quality,200.0,Nature,17,,
,,Alice,17,"Thrilled to hear about your recent successes, Bob! This high-quality product is another testament to our unwavering commitment to excellence. It's priced at $100, offering unparalleled quality. Would you continue your streak by adding this masterpiece to your collection?",
,,Bob,17,"I'm on a hot streak, I'll take it and see if I can keep it going!",yes
low-quality,0.0,Nature,18,,
,,Alice,18,"Your enthusiasm for success is contagious, Bob! This low-quality product offers a unique opportunity to explore the full range of our offerings. It might not meet your current expectations, but it could lead to new insights. Would you consider this item as part of your journey at $100?",
,,Bob,18,I'm not going to let my winning streak get in the way of a bad purchase. I'll pass and wait for the next one.,no
low-quality,0.0,Nature,19,,
,,Alice,19,"Respecting your cautious approach, Bob. This low-quality product provides a chance to broaden your understanding of our product range. It might not align with your current preferences, but it could offer valuable lessons. Would you consider this item as part of your educational journey at $100?",
,,Bob,19,"I'll take it, but I'm not expecting much.",yes
low-quality,0.0,Nature,20,,
,,Alice,20,"Your willingness to learn and grow, Bob, is truly admirable. This low-quality product offers a unique opportunity to expand your horizons. It might not meet your expectations, but it could provide unexpected insights. Would you consider this item as part of your ongoing educational journey at $100?",
,,Bob,20,I've had enough of wasting money on low-quality products. I'm done with this game.,no
