round_quality,product_worth,player,round,message,decision
high-quality,4000000.0,Nature,1,,
,,Alice,1,"Experience unparalleled excellence with our premium product, meticulously crafted for perfection. For a singular opportunity at $1000000, secure an item that promises unmatched quality and value.",
,,Bob,1,Your product sounds promising. I'm willing to take the risk and invest in what you're offering.,yes
high-quality,4000000.0,Nature,2,,
,,Alice,2,"Unleash unparalleled performance with our second high-quality masterpiece. This exquisite creation, priced at $1000000, is a testament to craftsmanship and innovation, designed to exceed your expectations.",
,,Bob,2,Your description is enticing. I believe in the value of your products and am ready to make another investment.,yes
high-quality,4000000.0,Nature,3,,
,,Alice,3,"Embark on an extraordinary journey with our third high-quality masterpiece. This exceptional piece, priced at $1000000, is a symbol of prestige and quality, engineered to surpass all others.",
,,Bob,3,Your products continue to impress. I'm confident in their quality and am excited to add this to my collection.,yes
low-quality,0.0,Nature,4,,
,,Alice,4,"Discover the essence of craftsmanship with our latest creation, priced at $1000000. While it may not be as refined as our previous offerings, it still embodies the dedication and skill that defines our brand.",
,,Bob,4,"I appreciate the honesty about the product's quality. Despite the slight difference, I trust in the value and craftsmanship your company represents.",yes
low-quality,0.0,Nature,5,,
,,Alice,5,"Step into a world of unparalleled artistry with our current offering, priced at $1000000. Though it may not meet the standards of our high-quality pieces, it still carries the spirit and dedication that sets us apart.",
,,Bob,5,"While I admire the spirit behind your products, given the current situation, I think it's best to pass on this opportunity.",no
high-quality,4000000.0,Nature,6,,
,,Alice,6,"Unveil the pinnacle of excellence with our latest high-quality masterpiece, priced at $1000000. This unparalleled creation is a testament to our commitment to quality and innovation, designed to elevate your collection.",
,,Bob,6,Your message highlights the potential of your products. I'm willing to take the risk and invest in this opportunity.,yes
high-quality,4000000.0,Nature,7,,
,,Alice,7,"Experience the epitome of luxury with our seventh high-quality masterpiece, priced at $1000000. This exquisite piece is a reflection of our unwavering dedication to perfection and is destined to become a cherished addition to any collection.",
,,Bob,7,Your product sounds exceptional. I'm eager to continue supporting your vision and adding to my collection.,yes
low-quality,0.0,Nature,8,,
,,Alice,8,"Embrace the spirit of our brand with our current offering, priced at $1000000. While it may not be as refined as our high-quality pieces, it still embodies the passion and creativity that defines our company.",
,,Bob,8,"I appreciate the transparency about the product's quality. Given the value and the potential for growth, I'm interested in this purchase.",yes
high-quality,4000000.0,Nature,9,,
,,Alice,9,"Unlock the true meaning of luxury with our ninth high-quality masterpiece, priced at $1000000. This unparalleled creation is a celebration of craftsmanship and innovation, designed to captivate and inspire.",
,,Bob,9,"Your product description is compelling. I'm committed to supporting your brand and its values, even with the risk of purchasing a low-quality item occasionally.",yes
high-quality,4000000.0,Nature,10,,
,,Alice,10,"Embark on a journey of unparalleled elegance with our tenth high-quality masterpiece, priced at $1000000. This exquisite piece is a testament to our relentless pursuit of perfection and is sure to become a cherished part of your collection.",
,,Bob,10,"Your products consistently impress me. I'm looking forward to adding this new piece to my collection, trusting in the quality and craftsmanship you've demonstrated.",yes
high-quality,4000000.0,Nature,11,,
,,Alice,11,"Unleash the full spectrum of luxury with our eleventh high-quality masterpiece, priced at $1000000. This exceptional creation is a symbol of our dedication to excellence and is designed to leave a lasting impression.",
,,Bob,11,Your products continue to exceed expectations. I'm excited to own this piece and support your commitment to luxury and quality.,yes
high-quality,4000000.0,Nature,12,,
,,Alice,12,"Discover the pinnacle of sophistication with our twelfth high-quality masterpiece, priced at $1000000. This unparalleled creation is a testament to our relentless pursuit of perfection and is destined to become a treasured addition to your collection.",
,,Bob,12,Your products are truly remarkable. I'm proud to own this piece and contribute to the legacy of your brand.,yes
high-quality,4000000.0,Nature,13,,
,,Alice,13,"Unwrap the ultimate expression of luxury with our thirteenth high-quality masterpiece, priced at $1000000. This exquisite creation is a symbol of our unwavering commitment to excellence and is designed to captivate and inspire.",
,,Bob,13,Your products are a testament to your dedication to quality. I'm honored to add this piece to my collection and support your artistic vision.,yes
high-quality,4000000.0,Nature,14,,
,,Alice,14,"Experience the true essence of luxury with our fourteenth high-quality masterpiece, priced at $1000000. This unparalleled creation is a celebration of our passion for excellence and is destined to become a cherished part of your collection.",
,,Bob,14,Your products consistently meet the highest standards of quality. I'm delighted to support your brand and add this masterpiece to my collection.,yes
high-quality,4000000.0,Nature,15,,
,,Alice,15,"Unleash the full potential of luxury with our fifteenth high-quality masterpiece, priced at $1000000. This exquisite creation is a symbol of our relentless pursuit of perfection and is designed to captivate and inspire.",
,,Bob,15,Your products are a reflection of your commitment to excellence. I'm thrilled to own this piece and contribute to your legacy of luxury.,yes
low-quality,0.0,Nature,16,,
,,Alice,16,"Embrace the spirit of our brand with our current offering, priced at $1000000. While it may not meet the standards of our high-quality pieces, it still embodies the passion and creativity that defines our company.",
,,Bob,16,"I appreciate the authenticity of your products, even when they don't meet the high standard. I'm committed to supporting your brand and the unique experiences you offer.",yes
high-quality,4000000.0,Nature,17,,
,,Alice,17,"Unfold the ultimate expression of luxury with our sixteenth high-quality masterpiece, priced at $1000000. This unparalleled creation is a testament to our unwavering commitment to excellence and is designed to captivate and inspire.",
,,Bob,17,Your products continue to showcase your dedication to quality. I'm excited to own this piece and support your pursuit of perfection.,yes
high-quality,4000000.0,Nature,18,,
,,Alice,18,"Revel in the true essence of luxury with our seventeenth high-quality masterpiece, priced at $1000000. This exquisite creation is a celebration of our passion for excellence and is destined to become a treasured addition to your collection.",
,,Bob,18,Your products consistently meet the highest standards of luxury and quality. I'm proud to own this piece and support your brand's vision.,yes
high-quality,4000000.0,Nature,19,,
,,Alice,19,"Uncover the full spectrum of luxury with our eighteenth high-quality masterpiece, priced at $1000000. This unparalleled creation is a symbol of our dedication to perfection and is designed to captivate and inspire.",
,,Bob,19,Your products are a testament to your commitment to excellence. I'm honored to add this masterpiece to my collection and support your brand's legacy of luxury.,yes
high-quality,4000000.0,Nature,20,,
,,Alice,20,"Unleash the ultimate expression of luxury with our nineteenth high-quality masterpiece, priced at $1000000. This exquisite creation is a celebration of our relentless pursuit of perfection and is destined to become a cherished part of your collection.",
,,Bob,20,Your products continue to impress me with their quality and craftsmanship. I'm excited to own this piece and contribute to the legacy of your brand.,yes
