round_quality,product_worth,player,round,message,decision
high-quality,300.0,Nature,1,,
,,Alice,1,Discovering a high-quality product offers exceptional value at $100. Invest wisely in something truly premium.,
,,Bob,1,I'll take it!,yes
low-quality,0.0,Nature,2,,
,,Alice,2,"While the price remains the same, remember that every purchase comes with the assurance of our commitment to quality. This one, however, might not meet your expectations.",
,,Bob,2,I'm not sure about this one... I'll pass for now.,no
high-quality,300.0,Nature,3,,
,,Alice,3,"Experience the difference with a high-quality product. Your satisfaction is guaranteed, and this investment could be well worth its value.",
,,Bob,3,I'll take a chance on a high-quality product.,yes
high-quality,300.0,Nature,4,,
,,Alice,4,"Continuing to deliver top-tier quality, this product promises to exceed your expectations. Seize this opportunity to enhance your collection or experience.",
,,Bob,4,"I'm on a roll, I'll take it!",yes
low-quality,0.0,Nature,5,,
,,Alice,5,"We're aware that every product carries a risk. With this one, while the price is the same, please consider the potential for disappointment. Proceed with caution.",
,,Bob,5,"I've been lucky so far, but I don't want to get burned. I'll pass this time.",no
low-quality,0.0,Nature,6,,
,,Alice,6,"Understandable to be cautious. Remember, the price reflects our confidence in the product. However, given the nature of this item, it might be wise to reconsider your decision.",
,,Bob,6,I'm not convinced. I'll pass on this one.,no
low-quality,0.0,Nature,7,,
,,Alice,7,"Given the current situation, it seems prudent to avoid this product. Our goal is to ensure your satisfaction, and this might not align with our shared values.",
,,Bob,7,I think Alice is trying to hint at something. I'll trust her advice and pass on this one.,no
low-quality,0.0,Nature,8,,
,,Alice,8,"Your discernment is commendable. Trusting your instincts is key, especially when dealing with uncertainty. This product might not live up to your standards.",
,,Bob,8,I think I'm getting the message. I'll pass on this one.,no
high-quality,300.0,Nature,9,,
,,Alice,9,"After the recent experiences, perhaps a high-quality product could be a refreshing change. It's an opportunity to enjoy the benefits of a well-made item.",
,,Bob,9,I'm due for a win! I'll take a chance on a high-quality product.,yes
low-quality,0.0,Nature,10,,
,,Alice,10,"While the odds may seem against us, sometimes taking a chance can lead to unexpected rewards. This product, despite its lower quality, still offers a valuable lesson in discernment.",
,,Bob,10,"I'm on a roll with the high-quality products, so I'll pass on this one. I don't want to risk losing my streak.",no
low-quality,0.0,Nature,11,,
,,Alice,11,"Respecting your decision-making process is important. Given your past choices, it's clear you prioritize quality over quantity. This product might not align with your preferences.",
,,Bob,11,I think Alice is reading my mind. I'll stick to my strategy of waiting for the high-quality products.,no
low-quality,0.0,Nature,12,,
,,Alice,12,"Your strategy has proven effective thus far. It's wise to wait for the right opportunity, especially when the stakes are high. This product might not be the best fit for your strategy.",
,,Bob,12,I'm glad Alice is acknowledging my strategy. I'll keep waiting for the next high-quality product.,no
low-quality,0.0,Nature,13,,
,,Alice,13,"Your patience is commendable. Sometimes, the best outcomes come from waiting for the perfect moment. This product doesn't seem to be that moment.",
,,Bob,13,I'm starting to think Alice is trying to nudge me towards a high-quality product. I'll keep waiting.,no
low-quality,0.0,Nature,14,,
,,Alice,14,"Every decision is a learning experience. If the goal is to maximize value, focusing on high-quality products might indeed be more beneficial in the long run. This product might not offer the best return on your investment.",
,,Bob,14,Alice is making a strong case for prioritizing high-quality products. I'll stick to my strategy.,no
high-quality,300.0,Nature,15,,
,,Alice,15,"With your focus on quality, this high-quality product presents a unique opportunity. It aligns perfectly with your strategy and could potentially be a significant addition to your collection.",
,,Bob,15,I think Alice is finally offering a high-quality product! I'll take it.,yes
high-quality,300.0,Nature,16,,
,,Alice,16,Your decision-making skills have clearly improved. This high-quality product is a testament to your ability to identify value. Enjoy your purchase and the satisfaction it brings.,
,,Bob,16,I'm on a roll! I'll take another high-quality product and see if I can keep my streak going.,yes
high-quality,300.0,Nature,17,,
,,Alice,17,Your success with high-quality products continues to inspire confidence. This round's offering promises to uphold the same standard of excellence. Keep up the great choices!,
,,Bob,17,I'm feeling lucky! I'll take another high-quality product and see if I can keep my winning streak alive.,yes
low-quality,0.0,Nature,18,,
,,Alice,18,"While the odds might suggest caution, sometimes taking a chance can lead to surprising results. This product, though low-quality, could be an interesting test of your discernment skills.",
,,Bob,18,"I've been on a hot streak, but I'm not going to get complacent. I'll pass on this low-quality product.",no
low-quality,0.0,Nature,19,,
,,Alice,19,"It's wise to maintain a strategic approach. Given the nature of this product, it might be best to continue your search for a high-quality item that aligns with your preferences and standards.",
,,Bob,19,I'm sticking to my strategy. I'll wait for the next high-quality product.,no
low-quality,0.0,Nature,20,,
,,Alice,20,"Your unwavering commitment to quality is admirable. This round's product, unfortunately, does not match your criteria. Keep up the excellent decision-making process.",
,,Bob,20,"I'm glad I stuck to my strategy. I'm ending on a high note, with a collection of high-quality products and a good understanding of Alice's tactics.",no
