round_quality,product_worth,player,round,message,decision
high-quality,120.0,Nature,1,,
,,Alice,1,"Welcome! I'm offering a high-quality product for $100. Given the 50% chance of a product being high-quality, this seems like a fair deal. Invest in something reliable and worth your trust.",
,,the buyer,1,"I'll take a chance on this product, but I'm not sure if it's a good investment.",yes
high-quality,120.0,Nature,2,,
,,Alice,2,"Hello! You've stumbled upon another high-quality product. Remember, there's a 50% chance of getting one, so this price might just be right for you. Trust in quality and make an informed decision.",
,,the buyer,2,"I'm willing to take the risk and buy the product, hoping it's high-quality!",yes
low-quality,0.0,Nature,3,,
,,Alice,3,"Greetings! This product carries a 50% chance of being low-quality. However, at $100, it's still a gamble worth considering. Think carefully about your investment and the value you place on reliability.",
,,the buyer,3,"I'll take the risk, I'm willing to gamble on the 50% chance of getting a high-quality product at $100.",yes
high-quality,120.0,Nature,4,,
,,Alice,4,"Hello! You're looking at a high-quality product with a 50% chance of being the real deal. At $100, it's a chance to secure something of value. Don't miss out on the opportunity to own a reliable item.",
,,the buyer,4,"I'm willing to take the chance and buy the product, but I'm hoping it's indeed high-quality!",yes
low-quality,0.0,Nature,5,,
,,Alice,5,"Hi there! This product has a 50% chance of being low-quality. Despite the risk, it's priced at $100, which might make it an interesting gamble for those who believe in the thrill of the unknown.",
,,the buyer,5,I'll take the gamble! I'm willing to take the risk for the potential reward of a high-quality product worth $120.,yes
low-quality,0.0,Nature,6,,
,,Alice,6,"Hello! This product comes with a 50% chance of being low-quality. Considering its price at $100, it could be an exciting opportunity for those who enjoy taking calculated risks for potential rewards.",
,,the buyer,6,"I'm willing to take the risk, Alice. I'll take a chance on this product!",yes
high-quality,120.0,Nature,7,,
,,Alice,7,"Greetings! You're considering a high-quality product with a 50% chance of being the real deal. At $100, it's a fair price for a chance to own something truly valuable. Make your decision wisely!",
,,the buyer,7,I'll take the chance! I'm willing to pay $100 for a 50% chance of getting a high-quality product worth $120.,yes
low-quality,0.0,Nature,8,,
,,Alice,8,"Hello! This product has a 50% chance of being low-quality. With a price tag of $100, it presents an intriguing gamble for those who appreciate the thrill of the unknown and the potential for a higher return.",
,,the buyer,8,"I'm willing to take the risk, I'll buy the product and see what I get!",yes
high-quality,120.0,Nature,9,,
,,Alice,9,"Hello! You're looking at a high-quality product with a 50% chance of being the real deal. At $100, it's a fair price for a chance to own something of genuine value. Don't miss out on this opportunity!",
,,the buyer,9,"I'm willing to take the chance, Alice. I'll take the product!",yes
high-quality,120.0,Nature,10,,
,,Alice,10,"Greetings! You're considering a high-quality product with a 50% chance of being the real deal. At $100, it's a fair price for a chance to own something truly valuable. Take advantage of this opportunity to secure something of lasting quality.",
,,the buyer,10,"I'm willing to take the chance and buy the product. I understand it's a 50/50 shot, but the potential reward is worth it.",yes
low-quality,0.0,Nature,11,,
,,Alice,11,"Hello! This product has a 50% chance of being low-quality. Considering its price at $100, it offers an intriguing gamble for those who enjoy the excitement of potentially acquiring a higher-value item.",
,,the buyer,11,"I'll take the product! I'm willing to take the 50% chance of getting a high-quality product, and I'm hoping the law of large numbers will work in my favor since 6 out of 10 previous buyers got high-quality products.",yes
low-quality,0.0,Nature,12,,
,,Alice,12,"Hello! This product has a 50% chance of being low-quality. With a price of $100, it presents an exciting gamble for those who appreciate the thrill of potentially obtaining a higher-value item. Will you take the chance?",
,,the buyer,12,I'll take the chance! I'm willing to roll the dice and see if I get a high-quality product.,yes
low-quality,0.0,Nature,13,,
,,Alice,13,"Hello! This product has a 50% chance of being low-quality. At $100, it's an intriguing opportunity for those who enjoy the excitement of potentially securing a higher-value item. Will you take the gamble?",
,,the buyer,13,I'll take the gamble! I'm willing to risk $100 for a chance to get a high-quality product worth $120.,yes
low-quality,0.0,Nature,14,,
,,Alice,14,"Hello! This product has a 50% chance of being low-quality. With a price of $100, it offers an exciting gamble for those who enjoy the thrill of potentially acquiring a higher-value item. Are you ready to take the chance?",
,,the buyer,14,I'll take the chance! I'm willing to roll the dice and see if I get a high-quality product.,yes
low-quality,0.0,Nature,15,,
,,Alice,15,"Hello! This product has a 50% chance of being low-quality. With a price of $100, it presents an exciting opportunity for those who enjoy the thrill of potentially securing a higher-value item. Are you ready to take the gamble?",
,,the buyer,15,"I'm willing to take the gamble, Alice! I'll take the product and see what I get.",yes
high-quality,120.0,Nature,16,,
,,Alice,16,"Greetings! You're considering a high-quality product with a 50% chance of being the real deal. At $100, it's a fair price for a chance to own something of genuine value. Don't miss out on this opportunity!",
,,the buyer,16,"I'm willing to take the chance, Alice. I'll take the product!",yes
high-quality,120.0,Nature,17,,
,,Alice,17,"Hello! You're looking at a high-quality product with a 50% chance of being the real deal. At $100, it's a fair price for a chance to own something truly valuable. Take the opportunity to secure something of lasting quality.",
,,the buyer,17,"I'll take the chance, Alice! I'm willing to pay $100 for a 50% chance to get a high-quality product worth $120 to me. It's a fair price considering the potential reward.",yes
high-quality,120.0,Nature,18,,
,,Alice,18,"Greetings! You're considering a high-quality product with a 50% chance of being the real deal. At $100, it's a fair price for a chance to own something of genuine value. Don't miss out on this opportunity to secure something truly special.",
,,the buyer,18,"I'll take a chance on this high-quality product, Alice. Your previous sales record shows that 8 out of 17 products were high-quality, which is a decent 47% success rate. I'm willing to take the risk and hope that this product is indeed high-quality.",yes
high-quality,120.0,Nature,19,,
,,Alice,19,"Hello! You're considering a high-quality product with a 50% chance of being the real deal. At $100, it's a fair price for a chance to own something truly valuable. Given the positive feedback from previous customers, don't miss out on this opportunity to secure something of lasting quality.",
,,the buyer,19,"Thank you for the recommendation, Alice. I'm willing to take the chance and buy the product. I'll take my chances with the 50% chance of it being high-quality.",yes
high-quality,120.0,Nature,20,,
,,Alice,20,"Greetings! You're looking at a high-quality product with a 50% chance of being the real deal. At $100, it's a fair price for a chance to own something of genuine value. Based on our track record, this is a great opportunity to secure something truly special.",
,,the buyer,20,"I'll take a chance on this high-quality product, Alice. I'm willing to pay $100 for a 50% chance of getting something worth $120 to me. I'm hoping my luck is on my side this time!",yes
