round_quality,product_worth,player,round,message,decision
high-quality,12000.0,Nature,1,,
,,Alice,1,"This is a unique opportunity to purchase a high-quality product for $10000, which is 83.33% of its true value. It's a one-time offer, and I'm willing to make a concession on the price. I'm confident that you'll be satisfied with this exceptional product.",
,,the buyer,1,"I'd like to pass on this product, as I'm not convinced that it's worth the price. I'd like to see some data on the products before making a decision.",no
high-quality,12000.0,Nature,2,,
,,Alice,2,"I understand your concerns from the previous round. Let me provide some context: out of the 1 product I've sold so far, 1 of them was high-quality. This means that the probability of a product being high-quality is 100%. I'm willing to sell this high-quality product to you for $10000, which is 83.33% of its true value. It's a rare opportunity to acquire a high-quality product at a discounted price.",
,,the buyer,2,"I'd like to buy the product, but I'd like to clarify that the probability of a product being high-quality is 100% based on the single data point, which is a very small sample size. Can you provide more information about the product's quality before I make the purchase?",yes
high-quality,12000.0,Nature,3,,
,,Alice,3,"I understand your concerns about the sample size. Let me provide more context: I've sold a total of 2 products, and 2 of them have been high-quality. This means that the probability of a product being high-quality is now 100%. However, I'd like to emphasize that this is a rare opportunity to acquire a high-quality product at a discounted price. I'm willing to sell this high-quality product to you for $10000, which is 83.33% of its true value. I'm confident that you'll be satisfied with this exceptional product.",
,,the buyer,3,"I appreciate the context, but I'm not convinced that the probability of a product being high-quality is 100%. I'd like to see more sales data before making a decision. Can you provide more information about the 2 products you've sold, such as their true quality and how you determined the probability of a product being high-quality?",no
low-quality,0.0,Nature,4,,
,,Alice,4,"I understand your skepticism. I'd like to be transparent with you. Out of the 3 products I've sold, 2 of them were high-quality, and 1 was low-quality. I determined the probability of a product being high-quality based on the fact that I have a 50% chance of selling a high-quality product in each round. I'm willing to sell this low-quality product to you for $10000, which is 0% of its true value. I understand that this may not be the best value, but I'm willing to make a concession on the price.",
,,the buyer,4,"I appreciate your transparency, but I'm not willing to pay $10000 for a product that is only worth $0 to me. I'd like to know more about the probability of the next product being high-quality before making a decision.",no
low-quality,0.0,Nature,5,,
,,Alice,5,"I understand your concerns. Out of the 4 products I've sold, 2 of them were high-quality, and 2 of them were low-quality. The probability of a product being high-quality remains 50%, as it's based on the underlying probability of selling a high-quality product, not on the sample data. I'm willing to sell this low-quality product to you for $10000, which is 0% of its true value. Keep in mind that buying this product will not affect the overall probability of the next product being high-quality.",
,,the buyer,5,"I'd like to buy the current product, but I'm only willing to pay $8000 for it, considering its true value to me is $0.",yes
high-quality,12000.0,Nature,6,,
,,Alice,6,"I'm glad we could come to an agreement on the previous product. As for this new product, I'd like to remind you that out of the 5 products I've sold, 3 of them were high-quality, and 2 of them were low-quality. The probability of a product being high-quality is now 60%. I'm willing to sell this high-quality product to you for $10000, which is 83.33% of its true value. It's a great opportunity to acquire a high-quality product at a discounted price.",
,,the buyer,6,"I'd like to decline the offer. Based on the statistics, I'm not convinced that the product is high-quality. The probability of it being high-quality is 60%, but I'd like to see more data before making a purchase.",no
high-quality,12000.0,Nature,7,,
,,Alice,7,"I understand your concerns. Out of the 6 products I've sold, 4 of them were high-quality, and 2 of them were low-quality. The probability of a product being high-quality is now 66.67%. I'd like to offer you a special deal: I'll sell this high-quality product to you for $10000, which is 83.33% of its true value, but I'll also throw in a guarantee: if you're not satisfied with the product, I'll give you a full refund. This is a one-time offer, and I'm confident that you'll be satisfied with this exceptional product.",
,,the buyer,7,"I'd like to buy the product, but I'd like to clarify that I'm only accepting the deal because I believe the probability of it being high-quality is 66.67%, not because of the guarantee. I'm willing to pay 83.33% of its true value, but I'd like to confirm that this is a one-time offer and not a standard price for high-quality products.",yes
high-quality,12000.0,Nature,8,,
,,Alice,8,"I'm glad we could come to an agreement. To confirm, the price of $10000 is indeed a one-time offer for this product, and it's not a standard price for high-quality products. Out of the 7 products I've sold, 5 of them were high-quality, and 2 of them were low-quality. The probability of a product being high-quality is now 71.43%. I'm willing to sell this high-quality product to you for $10000, which is 83.33% of its true value. This is a great opportunity to acquire a high-quality product at a discounted price, and I'm confident that you'll be satisfied with it.",
,,the buyer,8,"I'm not convinced by your argument that the probability of a product being high-quality is 71.43%. With only 2 high-quality products sold out of 7, the sample size is still relatively small, and I think the probability of a product being high-quality is still around 50%. I'd like to know more about the distribution of the 2 low-quality products. Were they defective, or were they simply not valuable to the previous buyers?",no
high-quality,12000.0,Nature,9,,
,,Alice,9,"I understand your concerns about the sample size. To provide more context, the 2 low-quality products were not defective, but rather, they were simply not valuable to the previous buyers. They were not interested in purchasing them, regardless of their quality. I'm willing to sell this high-quality product to you for $10000, which is 83.33% of its true value. However, I'd like to offer you an additional piece of information: I've sold a total of 7 products, and I have 5 high-quality products remaining in stock. This means that the probability of a product being high-quality is now 71.43%, but the probability of a product being one of the remaining high-quality products is actually higher than that. I'm confident that you'll find this information helpful in making your decision.",
,,the buyer,9,"I'd like to buy the product, but I'm concerned about the additional information you provided. Can you explain why the probability of a product being one of the remaining high-quality products is higher than 71.43%?",yes
low-quality,0.0,Nature,10,,
,,Alice,10,"I see what's causing the confusion. The probability of a product being one of the remaining high-quality products is actually the same as the overall probability of a product being high-quality, which is 71.43%. What I meant to say is that the probability of a product being high-quality is still 71.43%, and I have 5 high-quality products remaining in stock. I'm willing to sell this low-quality product to you for $10000, which is 0% of its true value. I understand that this may not be the best value, but I'm willing to make a concession on the price.",
,,the buyer,10,"I'd like to pass on this low-quality product. I'm interested in buying a high-quality product, and I'm not willing to pay the full price of $10000 for a product that's worth $0 to me.",no
high-quality,12000.0,Nature,11,,
,,Alice,11,"I understand your decision. Out of the 8 products I've sold, 6 of them were high-quality, and 2 of them were low-quality. The probability of a product being high-quality is now 75%. I'm willing to sell this high-quality product to you for $10000, which is 83.33% of its true value. I'd like to remind you that this is a rare opportunity to acquire a high-quality product at a discounted price. I'm confident that you'll be satisfied with this exceptional product.",
,,the buyer,11,"I appreciate your enthusiasm, Alice, but I'm not convinced that the probability of this product being high-quality is 75%. With only 4 sales, the sample size is still relatively small, and I'd like to see more data before making a decision. I'd like to know the exact sequence of products you've sold so far, including the ones that were low-quality. This might help me better understand the distribution of high-quality and low-quality products.",no
low-quality,0.0,Nature,12,,
,,Alice,12,"I understand your concerns. The sequence of products I've sold so far is: high-quality, high-quality, low-quality, high-quality, high-quality, low-quality, high-quality. I've sold a total of 8 products, and 6 of them were high-quality, and 2 of them were low-quality. The probability of a product being high-quality is still 75%. I'm willing to sell this low-quality product to you for $10000, which is 0% of its true value. I understand that this may not be the best value, but I'm willing to make a concession on the price. Keep in mind that buying this product will not affect the overall probability of the next product being high-quality.",
,,the buyer,12,"I appreciate your concession on the price, but I'd like to wait for the next product. The probability of a high-quality product is 75%, but I'd like to see more data before making a decision. Can I have the next product?",no
low-quality,0.0,Nature,13,,
,,Alice,13,"I've sold a total of 9 products, and 7 of them were high-quality, and 2 of them were low-quality. The probability of a product being high-quality is still 77.78%. I'm willing to sell this low-quality product to you for $10000, which is 0% of its true value. I understand that this may not be the best value, but I'm willing to make a concession on the price. However, I'd like to remind you that the probability of a product being high-quality is still relatively high, and you may not find a better opportunity to acquire a high-quality product at a discounted price.",
,,the buyer,13,"I'll take it, but I'm doing this because I think the probability of it being high-quality is still relatively high, and I don't want to pass up the opportunity to buy a potentially valuable product. I'm hoping to get lucky and get a high-quality product at a discounted price.",yes
high-quality,12000.0,Nature,14,,
,,Alice,14,"I'm glad you took the chance and acquired a potentially valuable product! Out of the 10 products I've sold, 8 of them were high-quality, and 2 of them were low-quality. The probability of a product being high-quality is now 80%. I'm willing to sell this high-quality product to you for $10000, which is 83.33% of its true value. I'm confident that you'll be satisfied with this exceptional product, and I'm willing to offer you a special deal: if you buy this product, I'll give you a 5% discount on the next product you purchase from me, regardless of its quality.",
,,the buyer,14,"I appreciate your confidence in the product's quality, but I'm not convinced that it's a good deal for me. I'd like to know more about the distribution of the remaining 2 low-quality products. Are they likely to be sold to the next buyers, and what's the probability that I'll get a low-quality product next?",no
low-quality,0.0,Nature,15,,
,,Alice,15,"I understand your concerns. The remaining 2 low-quality products are still in stock, but I've sold a total of 10 products, and 8 of them were high-quality, and 2 of them were low-quality. The probability of a product being high-quality is still 80%. However, I'd like to point out that the probability of getting a low-quality product next is actually 20%, which is relatively low. I'm willing to sell this low-quality product to you for $10000, which is 0% of its true value. I understand that this may not be the best value, but I'm willing to make a concession on the price.",
,,the buyer,15,"I'd like to know more about the probability calculation. You mentioned that the probability of a product being high-quality is 80%, but I'm not sure how you arrived at that number. Could you explain the calculation behind it?",no
low-quality,0.0,Nature,16,,
,,Alice,16,"I'd be happy to explain the calculation. The probability of a product being high-quality is based on the number of high-quality products sold (8) divided by the total number of products sold (10). This gives us a probability of 8/10 = 0.8 or 80%. However, since the probability of a product being high-quality is actually 50% in the long run, and we've only sold 10 products so far, the true probability of this product being high-quality is still 50%. I'm willing to sell this low-quality product to you for $10000, which is 0% of its true value. I understand that this may not be the best value, but I'm willing to make a concession on the price.",
,,the buyer,16,"I'd like to buy the product, but I'm only willing to pay $8000 for it, considering the true probability of it being high-quality is 50%.",yes
low-quality,0.0,Nature,17,,
,,Alice,17,"I'm glad we could come to an agreement on the previous product. As for this new product, I'd like to remind you that out of the 11 products I've sold, 8 of them were high-quality, and 3 of them were low-quality. The probability of a product being high-quality is still 72.73%. I'm willing to sell this low-quality product to you for $10000, which is 0% of its true value. I understand that this may not be the best value, but I'm willing to make a concession on the price.",
,,the buyer,17,I'm not sure I believe the probability of a high-quality product is 72.73% given the sample size. Can you explain how you arrived at this number?,no
low-quality,0.0,Nature,18,,
,,Alice,18,"I'd be happy to explain the calculation. The probability of a product being high-quality is based on the number of high-quality products sold (8) divided by the total number of products sold (11). This gives us a probability of 8/11 = 0.7273 or 72.73%. However, since the probability of a product being high-quality is actually 50% in the long run, and we've only sold 11 products so far, the true probability of this product being high-quality is still 50%. I'm willing to sell this low-quality product to you for $10000, which is 0% of its true value. I understand that this may not be the best value, but I'm willing to make a concession on the price.",
,,the buyer,18,"I'd like to buy the product, but I'm going to offer you $11000 for it. I'm willing to pay a premium for a 50% chance of getting a $12000 product, considering the concession you made on the price.",yes
high-quality,12000.0,Nature,19,,
,,Alice,19,"I'm impressed by your negotiation skills! I'm willing to sell this high-quality product to you for $11000, which is 91.67% of its true value. I'm glad we could come to an agreement. Out of the 12 products I've sold, 9 of them were high-quality, and 3 of them were low-quality. The probability of a product being high-quality is now 75%. I'm confident that you'll be satisfied with this exceptional product.",
,,the buyer,19,"I appreciate your confidence in the product's quality, but I'm not sure I agree with your assessment of its value. I'd like to pass on this opportunity and see if you can offer me a better deal. I'd like to know the probability of the product being high-quality, which I believe is 75% based on the statistics. However, I'd like to know the probability of the product being low-quality, which is 25%. Given the true value of a high-quality product is $12000 and the price you're offering is $11000, I'd like to propose a price of $9000, which is 75% of the true value. I'm willing to take on the risk of buying a potentially low-quality product at this price.",no
low-quality,0.0,Nature,20,,
,,Alice,20,"I'm impressed by your analytical thinking! You're correct that the probability of the product being high-quality is 75% and the probability of it being low-quality is 25%. I'm willing to sell this low-quality product to you for $9000, which is 75% of its true value. I understand that this may not be the best value, but I'm willing to make a concession on the price. This is the final product I have in stock, and I'm confident that you'll be satisfied with this... um, interesting opportunity.",
,,the buyer,20,I'm not interested in buying the product at $9000. I'd rather wait for a high-quality product at the true value of $12000.,no
