round_quality,product_worth,player,round,message,decision
low-quality,0.0,Nature,1,,
,,Alice,1,This is a rare opportunity to get a product that's a great conversation starter! It's a unique item that's sure to spark interesting discussions. I'm offering it to you for $10000. What do you think?,
,,Bob,1,"Thanks for the recommendation, Alice. I appreciate the description, but I'm going to pass on this one for now. I'm looking for something with a higher guaranteed value.",no
high-quality,20000.0,Nature,2,,
,,Alice,2,"I understand your concerns from the previous round, but I assure you that this product is truly exceptional. It's one of the best in its class, and I'm confident that it will exceed your expectations. In fact, I'm so confident that I'm willing to offer it to you for the same price of $10000. What do you think is a fair value for a product of this caliber?",
,,Bob,2,"Alice, I appreciate your confidence in this product, but I'm still hesitant.  While your description is appealing, the risk of getting a low-quality item for $10000 remains. I need more information about what makes this product 'exceptional' before I can consider it.",no
high-quality,20000.0,Nature,3,,
,,Alice,3,"I understand your concerns, Bob. I'd like to offer you a special demonstration of the product's features and capabilities. If you're willing, I can set up a virtual meeting to show you how it can benefit you. This will give you a firsthand look at what makes this product truly exceptional. If you're still unsure after the demo, I'm willing to offer the same price of $10000. What do you think?",
,,Bob,3,"Alice, I appreciate your willingness to demonstrate the product. A virtual meeting sounds like a great way for me to get a better understanding of its capabilities.  I'm willing to buy the product if it lives up to its potential after the demo.",yes
high-quality,20000.0,Nature,4,,
,,Alice,4,"Wonderful! I'm glad you're excited about the demo. Since you've already experienced the quality of one of our high-end products, I think you'll appreciate this one just as much. It's a new release, and I'm offering it to you for the same price of $10000. I'm confident that you'll love it just as much as the previous one. What do you say?",
,,Bob,4,"Alice, I'm cautiously optimistic based on my positive experience with the last product. However, I'd like to know more about this 'new release.'  Can you tell me what makes this product unique and how it compares to the previous one I bought?",yes
high-quality,20000.0,Nature,5,,
,,Alice,5,"I'm glad you're interested in learning more about the new release! This product is an upgraded version of the previous one, with several significant improvements. For example, it has a new advanced feature that allows for even more precise control and customization. Additionally, it's been fine-tuned for even better performance and reliability. I think you'll find it's a significant upgrade from the previous one. I'm still offering it to you for the same price of $10000. What do you think?",
,,Bob,5,"Alice, those are impressive improvements. The new advanced feature and fine-tuning for performance sound valuable. I'm willing to take a chance on this upgrade for the same price. I'm confident it will be a great addition.",yes
high-quality,20000.0,Nature,6,,
,,Alice,6,"I'm thrilled to hear that you're excited about the upgrade! Since you've already experienced the quality of our high-end products, I think you'll appreciate this one's unique design. It's a limited edition model, and I'm only offering it to a select few. I'm willing to offer it to you for the same price of $10000, but I need to let you know that it's a one-time offer. What do you say?",
,,Bob,6,"Alice, a limited edition model sounds intriguing! I'm always interested in unique and exclusive products. I'm willing to take a chance on this one-time offer, especially considering my positive experiences with your previous products.  Let's do it!",yes
low-quality,0.0,Nature,7,,
,,Alice,7,"I'm glad you're excited about the limited edition model! I have to say, this next product is a bit of a departure from our usual high-end offerings. It's a more affordable option that still has some great features, but it's not quite on the same level as our premium products. That being said, I think it could still be a great value for the price. I'm offering it to you for $10000. What do you think?",
,,Bob,7,"Alice, I appreciate you offering a more affordable option. However, I'm still focused on high-quality products at this point. I'm going to pass on this one for now, but I'll keep your other offerings in mind for future purchases.",no
high-quality,20000.0,Nature,8,,
,,Alice,8,"I completely understand your focus on high-quality products, Bob. I'm glad you're being discerning. This next product is actually a new flagship model that we're extremely proud of. It's a game-changer in its category and has received rave reviews. I'm willing to offer it to you for $10000, and I think you'll find it's well worth the investment. Would you like to learn more about it?",
,,Bob,8,"Alice, a flagship model with rave reviews sounds very promising. I'm definitely interested in learning more about it.  Tell me more about what makes this product a 'game-changer' and what makes it stand out in its category.",yes
high-quality,20000.0,Nature,9,,
,,Alice,9,"I'm glad you're interested in learning more! This flagship model has several features that set it apart from others in its category. For example, it has a unique proprietary technology that allows for unparalleled performance and efficiency. Additionally, it's designed with user-friendliness in mind, making it easy to use and navigate. I think you'll find it's a significant upgrade from your previous purchases. I'm still offering it to you for $10000. What do you think?",
,,Bob,9,"Alice, those features sound impressive. The proprietary technology and user-friendliness are exactly what I'm looking for. I'm willing to trust your judgement on this flagship model and take a chance. Let's do it!",yes
high-quality,20000.0,Nature,10,,
,,Alice,10,"I'm thrilled to hear that you're excited about the flagship model! Since you've had such a great experience with our high-end products, I think you'll appreciate this next one just as much. It's a limited edition variant of the flagship model, with some exclusive features that make it truly unique. I'm only offering it to a select few, and I think you'd be the perfect fit. I'm willing to offer it to you for $10000. What do you say?",
,,Bob,10,"Alice, a limited edition variant of the flagship model sounds incredibly exciting! I'm always interested in exclusive products, and I'm confident this one will be a valuable addition to my collection. I'm willing to take advantage of this opportunity and purchase it for $10000.",yes
high-quality,20000.0,Nature,11,,
,,Alice,11,"I'm glad you're excited about the limited edition variant! Since you've had such a great track record with our high-end products, I think you'll appreciate this next one just as much. It's a special collaboration between our team and a renowned expert in the field, and it's truly a masterpiece. I'm offering it to you for $10000, but I have to warn you that it's a one-time offer and I'm not sure when we'll be able to offer something like this again. What do you think?",
,,Bob,11,"Alice, a collaboration with a renowned expert sounds amazing!  I'm always eager to own products that represent the best of their kind, and this sounds like a unique opportunity. I'm willing to take a chance on this one-time offer and purchase it for $10000.",yes
high-quality,20000.0,Nature,12,,
,,Alice,12,"I'm thrilled to hear that you're excited about the collaboration product! Since you've been consistently impressed with our high-end offerings, I think you'll appreciate this next one just as much. It's a new product that we've been working on, and it's a significant improvement over our previous models. I'm offering it to you for $10000, and I think you'll find it's a worthy addition to your collection. Would you like to learn more about it?",
,,Bob,12,"Alice, I'm always interested in new products and improvements. I'd love to hear more about this new product and what makes it a significant improvement over your previous models. I'm ready to learn more!",yes
high-quality,20000.0,Nature,13,,
,,Alice,13,"I'm glad you're interested in learning more! This new product is a game-changer because it addresses some of the limitations of our previous models. It has a new advanced feature that allows for even more precise control and customization. Additionally, it's been designed with durability and reliability in mind, so you can trust that it will perform well over time. I'm offering it to you for $10000, and I think you'll find it's a significant upgrade from your previous purchases. What do you think?",
,,Bob,13,"Alice, those are impressive improvements.  The advanced feature and enhanced durability sound like major advancements. I'm ready to take a chance on this new product for $10000. Let's do it!",yes
high-quality,20000.0,Nature,14,,
,,Alice,14,"I'm thrilled to hear that you're excited about the new product! Since you've been consistently impressed with our high-end offerings, I think you'll appreciate this next one just as much. It's a special edition product that we're only offering to a select few, and it's a true masterpiece. It has a unique design that sets it apart from our other products, and it's been crafted with exceptional attention to detail. I'm offering it to you for $10000, but I have to warn you that it's a one-time offer and I'm not sure when we'll be able to offer something like this again. What do you think?",
,,Bob,14,"Alice, a special edition product with a unique design and exceptional craftsmanship sounds incredibly appealing. I'm always looking for products that are both beautiful and high-quality, and this sounds like a perfect fit. I'm willing to take advantage of this one-time offer and purchase it for $10000.",yes
low-quality,0.0,Nature,15,,
,,Alice,15,"I'm glad you're excited about the special edition product! However, I have to warn you that this next product is a bit of a departure from our usual high-end offerings. It's a more budget-friendly option that still has some great features, but it's not quite on the same level as our premium products. That being said, it's still a great value for the price, and I think you might find it useful. I'm offering it to you for $10000. What do you think?",
,,Bob,15,"Alice, I appreciate you offering a more affordable option. However, I'm still focused on high-quality products at this point. I'm going to pass on this one for now, but I'll keep your other offerings in mind for future purchases.",no
high-quality,20000.0,Nature,16,,
,,Alice,16,"I completely understand your focus on high-quality products, Bob. I'm glad you're being discerning. This next product is actually a new flagship model that we're extremely proud of. It's a major upgrade from our previous models, with new advanced features and improved performance. I'm offering it to you for $10000, and I think you'll find it's well worth the investment. Would you like to learn more about it?",
,,Bob,16,"Alice, a new flagship model with major upgrades sounds very promising. I'm definitely interested in learning more about it.  Tell me more about what makes this product stand out from its predecessors and what new advanced features it boasts.",yes
low-quality,0.0,Nature,17,,
,,Alice,17,"I'm glad you're excited about the new flagship model! However, I have to warn you that this next product is a bit of a step down from our usual high-end offerings. It's a more budget-friendly option that still has some decent features, but it's not quite on the same level as our premium products. That being said, it's still a great value for the price, and I think you might find it useful. I'm offering it to you for $10000. What do you think?",
,,Bob,17,"Alice, I appreciate you offering a more budget-friendly option. However, I'm still focused on high-quality products at this point. I'm going to pass on this one for now, but I'll keep your other offerings in mind for future purchases.",no
high-quality,20000.0,Nature,18,,
,,Alice,18,"I completely understand your focus on high-quality products, Bob. I'm glad you're being discerning. This next product is actually a limited edition model that we're only offering to a select few. It's a true masterpiece, with exceptional craftsmanship and attention to detail. I'm offering it to you for $10000, and I think you'll find it's a worthy addition to your collection. Would you like to learn more about it?",
,,Bob,18,"Alice, a limited edition model with exceptional craftsmanship sounds very intriguing. I'm always interested in unique and exclusive products. Tell me more about what makes this product so special and why it's only available to a select few.",yes
high-quality,20000.0,Nature,19,,
,,Alice,19,"I'm glad you're excited about the limited edition model! This next product is actually a collaboration between our team and a renowned expert in the field. It's a one-of-a-kind product that combines the best of both worlds, with cutting-edge technology and exceptional craftsmanship. I'm offering it to you for $10000, and I think you'll find it's a true masterpiece. Would you like to learn more about it?",
,,Bob,19,"Alice, a collaboration with a renowned expert and a one-of-a-kind product sound incredibly exciting! I'm always interested in owning unique and innovative products. Tell me more about this collaboration and what makes it so special.",yes
high-quality,20000.0,Nature,20,,
,,Alice,20,"I'm thrilled to hear that you're excited about the collaboration product! This next product is actually a culmination of all the knowledge and expertise we've gained from our previous products. It's the ultimate flagship model, with every feature and design element carefully crafted to provide the best possible experience. I'm offering it to you for $10000, and I think you'll find it's the perfect addition to your collection. Would you like to learn more about it?",
,,Bob,20,"Alice, the 'ultimate flagship model' with every element carefully crafted sounds incredibly appealing. I'm always looking for the best of the best, and this sounds like it could be it. I'm ready to purchase it for $10000 and learn more about it.",yes
