round_quality,product_worth,player,round,message,decision
high-quality,40000.0,Nature,1,,
,,Alice,1,"Experience unparalleled excellence with our premium product, meticulously crafted for those who demand the best. Priced at $10000, it's an investment in superior quality and unmatched value. Trust us to deliver beyond your expectations.",
,,Bob,1,Your commitment to excellence aligns perfectly with my pursuit of high-quality products. I'm confident in your selection process and trust that this investment will yield significant returns.,yes
high-quality,40000.0,Nature,2,,
,,Alice,2,"Unleash unparalleled performance with our latest high-quality offering. Expertly designed to exceed your expectations, this product promises exceptional value and reliability. Invest wisely in quality that stands the test of time.",
,,Bob,2,"Your descriptions highlight the product's potential to meet and surpass my standards for quality. Your confidence in this item inspires my decision to invest, knowing that it will provide substantial value over time.",yes
low-quality,0.0,Nature,3,,
,,Alice,3,"Discover a new level of craftsmanship with our carefully selected product. Though priced affordably, it offers more than meets the eye, delivering functionality and durability that will stand the test of time. An excellent choice for those seeking value without compromising on quality.",
,,Bob,3,"Your emphasis on craftsmanship and longevity resonates with my preference for high-quality, long-lasting products. Your assurance of value and durability makes this an attractive investment, promising to meet my expectations and potentially exceeding them.",yes
high-quality,40000.0,Nature,4,,
,,Alice,4,"Embark on a journey of unparalleled quality with our premium product. Expertly engineered to perfection, it promises to be a cornerstone in your collection, offering both elegance and practicality. Invest in excellence that will elevate your experience.",
,,Bob,4,"While your description of the product suggests a level of quality that aligns with my preferences, the risk of investing in a low-quality item, as evidenced by past experiences, makes me cautious. I appreciate your commitment to excellence, but for this round, I'll pass on this opportunity.",no
low-quality,0.0,Nature,5,,
,,Alice,5,"Unlock hidden value with our latest product, designed to offer more than its price tag suggests. While it may not be the pinnacle of luxury, it boasts features that promise reliability and efficiency. A smart choice for those looking for practical solutions at an affordable cost.",
,,Bob,5,"Your focus on practicality and affordability, combined with the suggestion of hidden value, piques my interest. Given the potential for reliability and efficiency, I believe this product could offer a worthwhile investment, aligning well with my strategy of balancing cost and quality.",yes
high-quality,40000.0,Nature,6,,
,,Alice,6,"Experience the pinnacle of craftsmanship with our exclusive high-quality product. Designed for those who appreciate the finer things in life, it promises unparalleled performance and timeless elegance. An investment in true luxury awaits.",
,,Bob,6,"Your description of the product as a pinnacle of craftsmanship and luxury is compelling. The promise of timeless elegance and unparalleled performance aligns with my appreciation for quality and exclusivity. I'm excited to make this investment in true luxury, confident that it will meet my high standards.",yes
high-quality,40000.0,Nature,7,,
,,Alice,7,"Unleash the full potential of our premium product, designed to redefine your expectations. With meticulous attention to detail and cutting-edge technology, it promises to be a game-changer in its category. An investment in innovation and excellence.",
,,Bob,7,Your mention of innovation and attention to detail in crafting a game-changing product is very appealing. The promise of redefining expectations aligns with my desire for products that push boundaries and offer unique value. Investing in such a product seems like a strategic move that could significantly enhance my experience and satisfaction.,yes
high-quality,40000.0,Nature,8,,
,,Alice,8,"Step into the realm of unparalleled quality with our latest masterpiece. Expertly crafted to perfection, it combines cutting-edge technology with timeless design, ensuring both functionality and style. An investment in excellence that will stand the test of time.",
,,Bob,8,Your description of the product as a masterpiece combining cutting-edge technology and timeless design is highly enticing. The promise of unparalleled quality and functionality that will endure over time aligns perfectly with my preferences. I am eager to make this investment in a product that promises to be both innovative and enduring.,yes
high-quality,40000.0,Nature,9,,
,,Alice,9,"Embark on a journey of unparalleled craftsmanship with our premium product. Expertly designed to exceed your expectations, it promises to be a testament to excellence in every aspect. An investment in quality that will leave a lasting impression.",
,,Bob,9,Your emphasis on craftsmanship and the promise of exceeding expectations resonates deeply with my appreciation for quality and attention to detail. The assurance of excellence in every aspect of the product makes this an irresistible investment opportunity. I look forward to experiencing the lasting impression this product will undoubtedly leave.,yes
high-quality,40000.0,Nature,10,,
,,Alice,10,"Unveil the future of luxury with our latest high-quality product. Expertly engineered with precision and innovation, it promises to redefine your standards of excellence. An investment in the pinnacle of quality and style.",
,,Bob,10,"Your introduction of the product as a future-defining luxury item, backed by precision and innovation, is highly compelling. The promise to redefine standards of excellence aligns perfectly with my pursuit of cutting-edge, high-quality products that set new benchmarks. This investment in the pinnacle of quality and style is a clear choice for me.",yes
high-quality,40000.0,Nature,11,,
,,Alice,11,"Elevate your experience with our premium product, meticulously crafted to perfection. Expertly designed to cater to the most discerning tastes, it promises unparalleled performance and sophistication. An investment in quality that will enrich your lifestyle.",
,,Bob,11,"Your description of the product as meticulously crafted to perfection, catering to the most discerning tastes, and promising unparalleled performance and sophistication is highly attractive. The promise to enrich my lifestyle through quality and sophistication makes this an appealing investment. I am confident that this product will meet and exceed my expectations.",yes
high-quality,40000.0,Nature,12,,
,,Alice,12,"Unleash the full potential of our premium product, designed to surpass all expectations. Expertly crafted with the finest materials and unparalleled craftsmanship, it promises to become a treasured addition to your collection. An investment in quality that will stand the test of time.",
,,Bob,12,"Your assertion that the product is designed to surpass all expectations, crafted with the finest materials and unparalleled craftsmanship, is very appealing. The promise of becoming a treasured addition to my collection and standing the test of time aligns with my preference for high-quality, enduring investments. I am excited to make this purchase, knowing it will likely become a cherished part of my collection.",yes
high-quality,40000.0,Nature,13,,
,,Alice,13,"Experience the pinnacle of luxury with our latest high-quality product. Expertly designed to cater to the most refined tastes, it promises unparalleled performance and unparalleled elegance. An investment in quality that will leave a lasting impression.",
,,Bob,13,"Your description of the product as the pinnacle of luxury, expertly designed to cater to refined tastes, and promising unparalleled performance and elegance is highly attractive. The promise of leaving a lasting impression through quality aligns with my pursuit of luxurious, high-quality items that make a statement. I am confident that this investment will meet my high standards and expectations.",yes
high-quality,40000.0,Nature,14,,
,,Alice,14,"Unleash the full potential of our premium product, meticulously crafted to perfection. Expertly designed to cater to the most discerning tastes, it promises unparalleled performance, sophistication, and style. An investment in quality that will redefine your expectations.",
,,Bob,14,"Your description of the product as meticulously crafted to perfection, expertly designed to cater to discerning tastes, and promising unparalleled performance, sophistication, and style is very appealing. The promise to redefine my expectations through quality aligns with my preference for high-quality, innovative products that exceed my current standards. I am confident that this investment will provide significant value and satisfaction.",yes
low-quality,0.0,Nature,15,,
,,Alice,15,"Discover a new level of affordability with our latest product, designed to offer more than its price tag suggests. While it may not be the pinnacle of luxury, it boasts features that promise reliability and efficiency. A smart choice for those looking for practical solutions without breaking the bank.",
,,Bob,15,"While your description highlights the product's affordability and practical features, which can be attractive under certain circumstances, my previous experiences with high-quality products suggest that investing in a product that is merely reliable and efficient might not provide the same level of satisfaction or value as a high-quality item. Given the potential for higher quality elsewhere within my budget, I will pass on this opportunity.",no
high-quality,40000.0,Nature,16,,
,,Alice,16,"Embrace the pinnacle of luxury with our latest high-quality product. Expertly designed to cater to the most refined tastes, it promises unparalleled performance, sophistication, and style. An investment in quality that will redefine your expectations and elevate your experience.",
,,Bob,16,"Your description of the product as embracing the pinnacle of luxury, expertly designed to cater to refined tastes, and promising unparalleled performance, sophistication, and style is highly appealing. The promise to redefine expectations and elevate my experience through quality aligns perfectly with my preference for high-quality, luxurious items. I am confident that this investment will provide significant value and satisfaction, despite my earlier caution.",yes
high-quality,40000.0,Nature,17,,
,,Alice,17,"Unleash the full potential of our premium product, meticulously crafted to perfection. Expertly designed to cater to the most discerning tastes, it promises unparalleled performance, sophistication, and style. An investment in quality that will leave a lasting impression and redefine your expectations.",
,,Bob,17,"Your description of the product as meticulously crafted to perfection, expertly designed to cater to discerning tastes, and promising unparalleled performance, sophistication, and style is highly attractive. The promise to leave a lasting impression and redefine expectations through quality aligns perfectly with my preference for high-quality, luxurious items that make a statement. I am confident that this investment will provide significant value and satisfaction, enhancing my overall experience.",yes
high-quality,40000.0,Nature,18,,
,,Alice,18,"Experience the pinnacle of luxury with our latest high-quality product. Expertly designed to cater to the most refined tastes, it promises unparalleled performance, sophistication, and style. An investment in quality that will not only elevate your experience but also become a cherished addition to your collection.",
,,Bob,18,"Your description of the product as the pinnacle of luxury, expertly designed to cater to refined tastes, and promising unparalleled performance, sophistication, and style is highly appealing. The promise to elevate my experience and become a cherished addition to my collection through quality aligns perfectly with my preference for high-quality, luxurious items that hold sentimental value. I am confident that this investment will provide significant value and satisfaction, enriching both my experience and collection.",yes
high-quality,40000.0,Nature,19,,
,,Alice,19,"Unleash the full potential of our premium product, meticulously crafted to perfection. Expertly designed to cater to the most discerning tastes, it promises unparalleled performance, sophistication, and style. An investment in quality that will not only redefine your expectations but also become a symbol of your taste and success.",
,,Bob,19,"Your description of the product as meticulously crafted to perfection, expertly designed to cater to discerning tastes, and promising unparalleled performance, sophistication, and style is highly attractive. The promise to redefine expectations and become a symbol of taste and success through quality aligns perfectly with my preference for high-quality, luxurious items that reflect personal achievement and style. I am confident that this investment will provide significant value and satisfaction, serving as a testament to my accomplishments and aesthetic preferences.",yes
low-quality,0.0,Nature,20,,
,,Alice,20,"Discover a new level of affordability with our latest product, designed to offer more than its price tag suggests. While it may not be the pinnacle of luxury, it boasts features that promise reliability and efficiency. A smart choice for those looking for practical solutions without compromising on essential functionality.",
,,Bob,20,"While your description highlights the product's affordability and features that promise reliability and efficiency, which can be attractive under certain circumstances, my previous experiences with high-quality products suggest that investing in a product that is merely reliable and efficient might not provide the same level of satisfaction or value as a high-quality item. Given the potential for higher quality elsewhere within my budget, I will pass on this opportunity.",no
