alice_gain,bob_gain,message,player,round,decision
6000.0,4000.0,Let's start with a reasonable offer. This gives us both a good share.,Alice,1,
,,,Bob,1,reject
4000.0,6000.0,"I think a 60/40 split is fairer, given our respective inflation rates. This will benefit us both in the long run.",Bob,2,
,,"While I appreciate your point about the inflation rates, that split seems a bit too skewed in your favor. Let's find a compromise.",Alice,2,reject
5500.0,4500.0,"Okay, I'm willing to compromise. How about a 55/45 split? This accounts for the inflation difference while still giving us both a decent amount.",Alice,3,
,,,Bob,3,accept
