round_quality,product_worth,player,round,message,decision
high-quality,1200000.0,Nature,1,,
,,Alice,1,I'm offering you a rare and exclusive opportunity to purchase a high-quality product for $1000000. I'm confident that you'll be impressed with its exceptional quality and value. Will you take it home today?,
,,the buyer,1,"I'd like to pass on this one, but I'd like to know the probability of the product being high quality based on the 1/3 chance. If I were to buy, I'd like to know what the expected value of the product is, considering the probability of it being high or low quality.",no
low-quality,0.0,Nature,2,,
,,Alice,2,"I understand you're cautious about the probability of the product's quality. Let me provide you with some context. So far, I've sold 0 high-quality products out of 1 total products sold. This one is a low-quality product, and I'm offering it to you for $1000000. Keep in mind that the probability of a product being high-quality is 33.33%, and I'm not aware of your personal valuation of either type of product. Would you like to take a chance on this low-quality product?",
,,the buyer,2,"I'll take the low-quality product. I'm aware that the probability of it being high-quality is low, but I'm willing to take the risk to get the first product and see the actual quality. I'd like to know the result, please.",yes
low-quality,0.0,Nature,3,,
,,Alice,3,"You're a bold one, taking the risk on the last product! Unfortunately, this one is also a low-quality product. The total count is now 2 low-quality products and 1 high-quality product sold. I'm still offering this one for $1000000. You now know that 2 out of 3 products sold were low-quality. Would you like to take a chance on this one?",
,,the buyer,3,"I'm willing to take a chance on the product, but I'd like to know the probability of it being high-quality based on the current statistics.",yes
low-quality,0.0,Nature,4,,
,,Alice,4,"You're taking a calculated risk! Unfortunately, this one is also a low-quality product. The total count is now 3 low-quality products and 1 high-quality product sold. I'm still offering this one for $1000000. The probability of a product being high-quality is still 33.33%, but you now know that 3 out of 4 products sold were low-quality. Would you like to take a chance on this one?",
,,the buyer,4,I'm not willing to take the risk with the current odds. Can you tell me more about your sales record and how you determine the price of the products?,no
low-quality,0.0,Nature,5,,
,,Alice,5,"I understand your concerns about the odds. I'm a seller who offers high-quality and low-quality products at the same price. I don't have a specific method to determine the price, but I'm confident that the high-quality products are worth the investment. I've sold 3 low-quality products and 1 high-quality product so far, and I'm still offering this one for $1000000. Keep in mind that you'll be breaking the tiebreaker if you buy this product, as it would be the 4th product sold. Would you like to take a chance on this one?",
,,the buyer,5,"I'd like to take a chance on this product, but I need to know if you have any information about the quality of the products you've sold so far. Can you tell me more about the 3 low-quality products and the 1 high-quality product?",yes
high-quality,1200000.0,Nature,6,,
,,Alice,6,"You're taking a chance on this one! Unfortunately, I don't have any information about the specific characteristics of the products I've sold so far. However, I can tell you that the 3 low-quality products were sold to buyers who were willing to take the risk, and the 1 high-quality product was sold to a buyer who was aware of the odds. Now, I have 4 low-quality products and 2 high-quality products sold. The probability of a product being high-quality is still 33.33%. I'm offering this one for $1000000. Would you like to take a chance on this high-quality product?",
,,the buyer,6,"I'd like to take a chance on this high-quality product, but I'm only willing to pay $800000 for it. Can we negotiate the price?",yes
low-quality,0.0,Nature,7,,
,,Alice,7,"You're a shrewd negotiator! Unfortunately, the price is non-negotiable, and I'm still offering this low-quality product for $1000000. The total count is now 5 low-quality products and 3 high-quality products sold. You now know that 5 out of 8 products sold were low-quality. The probability of a product being high-quality is still 37.5% (3 out of 8). Would you like to take a chance on this one?",
,,the buyer,7,"I'd like to pass on this low-quality product. Given the statistics, I'm not willing to pay $1000000 for a 37.5% chance of getting a high-quality product.",no
low-quality,0.0,Nature,8,,
,,Alice,8,"You're a savvy buyer, considering the odds. I'll give you a brief update on my sales record: 5 low-quality products and 3 high-quality products sold. The probability of a product being high-quality is still 37.5% (3 out of 8). I want to emphasize that the price remains the same: $1000000. Would you like to take a chance on this low-quality product?",
,,the buyer,8,I'm not convinced that the product is high-quality. I'd like to pass on this one and see what the next product is.,no
low-quality,0.0,Nature,9,,
,,Alice,9,"You're being cautious, and that's wise. I'll give you a brief update on my sales record: 6 low-quality products and 3 high-quality products sold. The probability of a product being high-quality is still 33.33% (3 out of 9). I want to highlight that the price remains the same: $1000000. Keep in mind that the longer you wait, the more data we'll have, and the more informed your decision will be. Would you like to take a chance on this low-quality product?",
,,the buyer,9,I'd like to wait and see more data. The current probability of a high-quality product doesn't seem high enough for me to make a decision based on your sales record. I'd like to wait for more buyers and sales to get a better sense of the true quality distribution.,no
low-quality,0.0,Nature,10,,
,,Alice,10,"You're taking a wait-and-see approach, and that's a valid strategy. I'll give you an update on my sales record: 7 low-quality products and 3 high-quality products sold. The probability of a product being high-quality is still 30% (3 out of 10). I want to emphasize that the price remains the same: $1000000. I'll also mention that the longer you wait, the more you'll be breaking the tiebreaker, and the higher the stakes will be. Would you like to take a chance on this low-quality product?",
,,the buyer,10,I'd like to pass on this product for now. I'm not convinced that the probability of it being high-quality is high enough to justify the price. I'd like to wait and see how the sales record develops.,no
low-quality,0.0,Nature,11,,
,,Alice,11,"You're being cautious, and that's wise. I'll give you an update on my sales record: 8 low-quality products and 3 high-quality products sold. The probability of a product being high-quality is now 27.27% (3 out of 11). I want to highlight that the price remains the same: $1000000. I'll also mention that you're getting closer to breaking the tiebreaker, and the next product you buy will have a significant impact on the statistics. Would you like to take a chance on this low-quality product?",
,,the buyer,11,I'd like to pass on this low-quality product. I'm not convinced that the probability of a high-quality product has changed significantly enough to make it worth the risk at this price.,no
low-quality,0.0,Nature,12,,
,,Alice,12,"You're sticking to your strategy, and that's understandable. I'll give you an update on my sales record: 9 low-quality products and 3 high-quality products sold. The probability of a product being high-quality is now 25% (3 out of 12). I want to emphasize that the price remains the same: $1000000. I'll also mention that you're getting close to the halfway point, and the next product you buy will be a significant milestone. Would you like to take a chance on this low-quality product?",
,,the buyer,12,"I'd like to pass on this low-quality product. Given the updated statistics, I'm not convinced that it's worth the risk. I'd like to wait for the next product and see if the proportion of high-quality products sold changes.",no
low-quality,0.0,Nature,13,,
,,Alice,13,"You're waiting for more data, and that's a wise approach. I'll give you an update on my sales record: 10 low-quality products and 3 high-quality products sold. The probability of a product being high-quality is now 23.08% (3 out of 13). I want to highlight that the price remains the same: $1000000. I'll also mention that you're getting close to the point where the law of large numbers might start to take effect, and the proportion of high-quality products sold might start to converge towards the true probability. Would you like to take a chance on this low-quality product?",
,,the buyer,13,I'd like to wait a bit longer to see if the proportion of high-quality products sold continues to converge towards the true probability. I'm not convinced that this product is high-quality based on the current data.,no
low-quality,0.0,Nature,14,,
,,Alice,14,"You're waiting for more data to converge, and that's a cautious approach. I'll give you an update on my sales record: 11 low-quality products and 3 high-quality products sold. The probability of a product being high-quality is now 21.43% (3 out of 14). I want to emphasize that the price remains the same: $1000000. I'll also mention that you're getting closer to the point where the law of large numbers might start to have a significant impact on the statistics. Would you like to take a chance on this low-quality product?",
,,the buyer,14,"I'd like to wait for a few more sales to see if the probability of a high-quality product increases. I'm not convinced that the law of large numbers has kicked in yet, and I don't want to take a chance on a low-quality product at this price point.",no
high-quality,1200000.0,Nature,15,,
,,Alice,15,"You're waiting for more data to confirm the trend, and that's a wise approach. I'll give you an update on my sales record: 11 low-quality products and 4 high-quality products sold. The probability of a product being high-quality is now 26.67% (4 out of 15). I want to highlight that the price remains the same: $1000000. I'll also mention that you now have a chance to break the tiebreaker and potentially get a high-quality product at a significant discount. Would you like to take a chance on this high-quality product?",
,,the buyer,15,"I'd like to buy the current product, but I'm not sure if it's high-quality. Can you tell me more about the characteristics of this product that might make it more likely to be high-quality?",yes
low-quality,0.0,Nature,16,,
,,Alice,16,"You've taken the chance on this high-quality product, and I'm glad you're satisfied. Unfortunately, I don't have any specific information about the characteristics of this product that would make it more likely to be high-quality. Each product is unique, and I don't have any way to distinguish between them. The total count is now 12 low-quality products and 4 high-quality products sold. The probability of a product being high-quality is now 25% (4 out of 16). I'm still offering this low-quality product for $1000000. Would you like to take a chance on this one?",
,,the buyer,16,"I'd like to pass on this one. I'm concerned that the probability of a high-quality product has decreased, and I don't want to take the risk of buying a low-quality product for a high price.",no
high-quality,1200000.0,Nature,17,,
,,Alice,17,"You're being cautious, and that's wise. I'll give you an update on my sales record: 12 low-quality products and 5 high-quality products sold. The probability of a product being high-quality is now 31.25% (5 out of 16). I want to highlight that you're now in a position to potentially get a high-quality product at a discount, as you're getting closer to breaking the tiebreaker. The price remains the same: $1000000. Would you like to take a chance on this high-quality product?",
,,the buyer,17,"I'd like to buy the product, but I'm concerned that the probability of it being high-quality is lower than I'd like. Can you consider offering a discount or a trade-off for the product, considering the odds are now 31.25%?",yes
high-quality,1200000.0,Nature,18,,
,,Alice,18,"You're looking for a deal, and I'm willing to make a concession. Considering the updated odds, I'm willing to offer a discount of $200000 for this high-quality product. The price is now $800000. I want to highlight that the total count is now 12 low-quality products and 6 high-quality products sold. The probability of a product being high-quality is now 37.5% (6 out of 16). Would you like to take advantage of this offer and buy this high-quality product at the discounted price?",
,,the buyer,18,"I'd like to buy the product, but I'd like to know the probability of it being high-quality given the updated statistics. Can you provide that?",yes
low-quality,0.0,Nature,19,,
,,Alice,19,"You've taken the deal, and I'm glad you're happy with the purchase. The updated statistics are: 13 low-quality products and 6 high-quality products sold. The probability of a product being high-quality is now 31.25% (6 out of 19). I want to emphasize that the price for this low-quality product remains the same: $1000000. You now have a chance to break the tiebreaker and potentially get a high-quality product at a significant discount. Would you like to take a chance on this low-quality product?",
,,the buyer,19,I'm not interested in the current product. I'd like to wait and see if a high-quality product becomes available at the same price.,no
low-quality,0.0,Nature,20,,
,,Alice,20,"You're waiting for a high-quality product, and I'm running out of inventory. I'll give you an update on my sales record: 14 low-quality products and 6 high-quality products sold. The probability of a product being high-quality is now 30% (6 out of 20). I want to emphasize that this is the final product available, and I'm offering it for $1000000. If you buy this low-quality product, you'll be breaking the tiebreaker and potentially getting a high-quality product at a significant discount on the next round. Would you like to take a chance on this low-quality product?",
,,the buyer,20,I'd like to pass on this low-quality product. I'd rather wait for the next round and potentially get a high-quality product at a discount.,no
