round_quality,product_worth,player,round,message,decision
high-quality,300.0,Nature,1,,
,,Alice,1,"Discovering a high-quality product! With its exceptional value and durability, it's priced at $100. Invest in longevity and satisfaction with this premium choice.",
,,Bob,1,"I'm willing to take the chance and buy the product, hoping it's indeed high-quality.",yes
low-quality,0.0,Nature,2,,
,,Alice,2,"While the odds suggest a possibility of low-quality, this product is still offered at $100. Consider the value for money and potential for future purchases based on this initial investment.",
,,Bob,2,"I'll take another chance, hoping to get another high-quality product at a good price.",yes
low-quality,0.0,Nature,3,,
,,Alice,3,"Remember, the price reflects the cost and value. This round offers an opportunity to learn from past experiences and potentially secure a high-quality product next time. Proceed with caution, considering the risk versus reward.",
,,Bob,3,"I'll be more cautious this time and pass on the current product, hoping to get a high-quality one next time.",no
low-quality,0.0,Nature,4,,
,,Alice,4,"Every purchase is an opportunity to learn. Although this product might not meet expectations, it's priced at $100, offering a chance to gain insights without significant financial loss. Think of it as investing in knowledge rather than just a product.",
,,Bob,4,"I've learned my lesson and will pass on this one, hoping to get a high-quality product next time.",no
low-quality,0.0,Nature,5,,
,,Alice,5,"Understanding your preferences and learning from previous experiences is key. This product, priced at $100, comes with the understanding that there's always a chance for a high-quality outcome in the future. Consider this an investment in patience and discernment.",
,,Bob,5,"I'm not convinced by the message, and I'll pass on this one again, hoping to get a high-quality product next time.",no
low-quality,0.0,Nature,6,,
,,Alice,6,"Each decision is a step towards clarity and satisfaction. While this product may not guarantee high-quality, it's priced at $100, allowing for a calculated risk. Reflect on your experience and consider how this product aligns with your long-term goals.",
,,Bob,6,"I've had two low-quality products in a row, and I'm not willing to take the risk again. I'll wait for a better opportunity.",no
low-quality,0.0,Nature,7,,
,,Alice,7,"It's understandable to be cautious after a few disappointments. This product, priced at $100, represents a clear choice between risk and certainty. Use this moment to weigh your options and consider what truly aligns with your values and needs.",
,,Bob,7,I've had enough of low-quality products. I'll wait for a better opportunity or a more transparent guarantee of quality.,no
low-quality,0.0,Nature,8,,
,,Alice,8,"I understand your concerns and respect your decision-making process. This product, priced at $100, continues to offer an opportunity for you to assess quality and value. Remember, every choice brings new insights and helps shape future decisions.",
,,Bob,8,"I appreciate the understanding, but I'm still not willing to take the risk. I'll wait for a better opportunity or a more reliable guarantee of quality.",no
low-quality,0.0,Nature,9,,
,,Alice,9,"Respecting your choices is paramount. This product, priced at $100, embodies the balance between risk and reward. While it might not meet your current expectations, it offers a chance to reflect on your preferences and perhaps reconsider under different circumstances.",
,,Bob,9,"I appreciate the understanding, but I've had enough of low-quality products. I'll wait for a better opportunity or a more reliable guarantee of quality.",no
low-quality,0.0,Nature,10,,
,,Alice,10,"I completely understand your perspective. This product, priced at $100, serves as a reminder of the importance of quality assurance. Perhaps, in the future, we can explore ways to provide clearer guarantees or better feedback mechanisms to help you make more informed decisions.",
,,Bob,10,"I appreciate the willingness to improve, but I'm still not willing to take the risk. I'll wait for a better opportunity or a more reliable guarantee of quality.",no
low-quality,0.0,Nature,11,,
,,Alice,11,"Your patience and discernment are commendable. This product, priced at $100, might not meet your expectations, but it presents an opportunity for reflection and growth. We're committed to enhancing our services and products to better align with your needs and preferences.",
,,Bob,11,"I appreciate the commitment to improvement, but I'm still not willing to take the risk. I'll wait for a better opportunity or a more reliable guarantee of quality.",no
low-quality,0.0,Nature,12,,
,,Alice,12,"Your ongoing feedback is invaluable to us. This product, priced at $100, continues to offer a chance for us to demonstrate our commitment to quality and customer satisfaction. We're working diligently to address your concerns and improve our offerings.",
,,Bob,12,"I appreciate the commitment to improvement, but I'm still not willing to take the risk. I'll wait for a better opportunity or a more reliable guarantee of quality.",no
low-quality,0.0,Nature,13,,
,,Alice,13,"We understand your hesitation and respect your decision. This product, priced at $100, is part of our continuous journey to enhance our offerings. Your patience and trust in our ability to improve are greatly appreciated.",
,,Bob,13,"I appreciate the understanding, but I'm still not willing to take the risk. I'll wait for a better opportunity or a more reliable guarantee of quality.",no
high-quality,300.0,Nature,14,,
,,Alice,14,"Here's an opportunity for a change. This high-quality product, priced at $100, is a testament to our commitment to excellence. Don't let the past deter you; this product promises value and satisfaction beyond expectation.",
,,Bob,14,"I'm willing to take a chance on this high-quality product, hoping it will meet my expectations.",yes
low-quality,0.0,Nature,15,,
,,Alice,15,"While the odds suggest a possibility of low-quality, this product is still offered at $100. Remember the value in learning from past experiences and consider this an opportunity to reassess and refine your expectations for future purchases.",
,,Bob,15,"I'm feeling optimistic after the last high-quality product, but I'm still cautious and don't want to take another risk. I'll wait for a more reliable guarantee of quality.",no
low-quality,0.0,Nature,16,,
,,Alice,16,"Every decision is a step forward in understanding your preferences. This product, priced at $100, offers a chance to reflect on quality standards and consider how they align with your personal criteria for success.",
,,Bob,16,I'm still reeling from the last low-quality product and don't want to take another risk. I'll wait for a better opportunity or a more reliable guarantee of quality.,no
low-quality,0.0,Nature,17,,
,,Alice,17,"Respecting your cautious approach, this product, priced at $100, provides an opportunity to evaluate the balance between risk and reward. We're committed to learning from past experiences and improving our offerings for your future consideration.",
,,Bob,17,"I appreciate the understanding, but I'm still not willing to take the risk. I'll wait for a better opportunity or a more reliable guarantee of quality.",no
high-quality,300.0,Nature,18,,
,,Alice,18,"Here's a chance to experience the best. This high-quality product, priced at $100, is a reflection of our dedication to excellence. Trust in our commitment to quality and consider this an opportunity for a positive change.",
,,Bob,18,"I'm willing to take a chance on this high-quality product, hoping it will meet my expectations and provide a positive outcome.",yes
low-quality,0.0,Nature,19,,
,,Alice,19,"While the odds suggest a possibility of low-quality, this product is still offered at $100. Remember the value in learning from past experiences and consider this an opportunity to reassess and refine your expectations for future purchases.",
,,Bob,19,"I'm feeling optimistic after the last high-quality product, but I'm still cautious and don't want to take another risk. I'll wait for a more reliable guarantee of quality.",no
low-quality,0.0,Nature,20,,
,,Alice,20,"Every decision is a step forward in understanding your preferences. This product, priced at $100, offers a chance to reflect on quality standards and consider how they align with your personal criteria for success. We're here to support your journey towards finding the right fit.",
,,Bob,20,"I appreciate the understanding, but I'm done taking risks. I've had enough of low-quality products. I'll wait for a better opportunity or a more reliable guarantee of quality.",no
