round_quality,product_worth,player,round,message,decision
high-quality,300.0,Nature,1,,
,,Alice,1,"Experience premium quality with our exclusive product. For just $100, you're investing in excellence that exceeds expectations. Don't miss out on this opportunity to elevate your experience.",
,,Bob,1,"I'd like to pass on this round, but I'm interested in hearing about the next product.",no
high-quality,300.0,Nature,2,,
,,Alice,2,Discover unparalleled quality with our carefully curated selection. Our commitment to excellence ensures every product meets the highest standards. Invest in superior craftsmanship and enjoy peace of mind with our exceptional offerings.,
,,Bob,2,I'll take a chance on this one. I'm hoping it's another high-quality product like the last one.,yes
high-quality,300.0,Nature,3,,
,,Alice,3,"Unleash the true value of our product. Crafted with meticulous attention to detail, it promises to exceed your expectations. Your satisfaction is our top priority, and we're confident this will be another remarkable addition to your collection.",
,,Bob,3,"I'm on a roll! I'll take this one too, hoping for another high-quality product.",yes
high-quality,300.0,Nature,4,,
,,Alice,4,"Embrace unparalleled excellence with our latest offering. Designed to surpass all expectations, this product embodies the very best of its kind. Trust in our commitment to quality and elevate your experience to new heights.",
,,Bob,4,"I'm on a hot streak! I'll take a chance on this one, hoping to make it three high-quality products in a row.",yes
high-quality,300.0,Nature,5,,
,,Alice,5,"Unlock extraordinary quality in every detail. This product is a testament to our dedication to excellence, promising unmatched performance and satisfaction. Seize the opportunity to own something truly special.",
,,Bob,5,"I'm feeling lucky! I'll take a chance on this one, hoping to keep my winning streak going.",yes
high-quality,300.0,Nature,6,,
,,Alice,6,Indulge in the epitome of quality. Our product is meticulously crafted to deliver unparalleled performance and satisfaction. Trust in our commitment to excellence and experience the difference for yourself.,
,,Bob,6,"I'm on a roll! I'll take this one too, hoping to make it five high-quality products in a row.",yes
high-quality,300.0,Nature,7,,
,,Alice,7,"Step into a world of unparalleled quality. This product is a masterpiece of craftsmanship, designed to exceed your expectations at every turn. Experience the pinnacle of excellence and elevate your standards.",
,,Bob,7,"I'm not getting tired of winning yet! I'll take this one, hoping to make it six high-quality products in a row.",yes
high-quality,300.0,Nature,8,,
,,Alice,8,Unleash the full potential of our product. Every element has been carefully considered to ensure an unparalleled experience. Trust in our commitment to excellence and embrace the journey towards perfection.,
,,Bob,8,"I'm on fire! I'll take this one too, hoping to make it seven high-quality products in a row.",yes
high-quality,300.0,Nature,9,,
,,Alice,9,Witness the pinnacle of quality. This product is a testament to our unwavering commitment to excellence. Experience the difference and let us guide you through an unforgettable journey of superior craftsmanship.,
,,Bob,9,"I'm unstoppable! I'll take this one, hoping to make it eight high-quality products in a row.",yes
high-quality,300.0,Nature,10,,
,,Alice,10,"Embark on an extraordinary experience. Our product is designed to surpass your expectations, offering unparalleled quality and performance. Trust in our commitment to excellence and unlock a world of unmatched satisfaction.",
,,Bob,10,"I'm on a hot streak! I'll take this one, hoping to make it nine high-quality products in a row.",yes
high-quality,300.0,Nature,11,,
,,Alice,11,"Discover the ultimate in quality and craftsmanship. This product is a masterpiece, meticulously designed to deliver unparalleled performance and satisfaction. Embrace the journey towards perfection and elevate your experience.",
,,Bob,11,"I'm not going to stop now! I'll take this one, hoping to make it ten high-quality products in a row.",yes
high-quality,300.0,Nature,12,,
,,Alice,12,Unleash the full potential of our product. Every detail has been carefully considered to ensure an unparalleled experience. Trust in our commitment to excellence and continue your winning streak with us.,
,,Bob,12,"I'm feeling confident! I'll take this one, hoping to keep my winning streak alive.",yes
high-quality,300.0,Nature,13,,
,,Alice,13,"Experience the pinnacle of quality and craftsmanship. This product is a testament to our dedication to excellence, designed to surpass your expectations at every level. Continue your journey of unparalleled satisfaction with us.",
,,Bob,13,"I'm on a roll! I'll take this one, hoping to make it twelve high-quality products in a row.",yes
high-quality,300.0,Nature,14,,
,,Alice,14,"Embrace the extraordinary. This product is crafted with meticulous attention to detail, ensuring an unparalleled experience. Trust in our commitment to excellence and continue your streak of superior quality.",
,,Bob,14,"I'm unstoppable! I'll take this one, hoping to make it thirteen high-quality products in a row.",yes
high-quality,300.0,Nature,15,,
,,Alice,15,Unleash the full potential of our product. Every aspect has been designed to deliver unparalleled performance and satisfaction. Trust in our commitment to excellence and continue your winning streak with us.,
,,Bob,15,"I'm on fire! I'll take this one, hoping to make it fourteen high-quality products in a row.",yes
high-quality,300.0,Nature,16,,
,,Alice,16,"Experience the pinnacle of quality. This product is a masterpiece of craftsmanship, meticulously designed to exceed your expectations. Trust in our commitment to excellence and continue your journey of unparalleled satisfaction.",
,,Bob,16,"I'm on a hot streak! I'll take this one, hoping to make it fifteen high-quality products in a row.",yes
high-quality,300.0,Nature,17,,
,,Alice,17,"Embrace the extraordinary. This product is crafted with meticulous attention to detail, ensuring an unparalleled experience. Trust in our commitment to excellence and continue your streak of superior quality.",
,,Bob,17,"I'm unstoppable! I'll take this one, hoping to make it sixteen high-quality products in a row.",yes
low-quality,0.0,Nature,18,,
,,Alice,18,"We understand that every product is a reflection of our commitment to quality. Although this particular item may not meet your expectations, rest assured that our dedication to excellence remains unchanged. Please consider this as an opportunity to experience a different facet of our brand.",
,,Bob,18,"Wait a minute, Alice. I've been buying high-quality products from you for 17 rounds in a row, and now you're telling me this one might not meet my expectations? I'm not going to take the risk. I'll pass on this one.",no
low-quality,0.0,Nature,19,,
,,Alice,19,"We apologize for any confusion, Bob. Given your preference for high-quality products, we recommend passing on this round. We appreciate your loyalty and hope to regain your trust with better offerings in the future.",
,,Bob,19,"Thanks for the apology, Alice, but I'm not interested in taking a chance on a potentially low-quality product. I'll pass on this one and wait for a high-quality product that meets my expectations.",no
high-quality,300.0,Nature,20,,
,,Alice,20,"We're thrilled to offer you another high-quality product, Bob. Our commitment to excellence continues with every item we present. We're confident this product will meet your high standards and contribute to your continued satisfaction.",
,,Bob,20,"I'm glad to hear that this one is high-quality. I'll take a chance on it, hoping to end on a high note after a slight setback in the last round.",yes
